Rank,Song,Artist,Year,Lyrics
41,Rose Garden,Lynn Anderson,1971,"b""I beg your pardon I never promised you a rose garden\nAlong with the sunshine there's got to be a little rain sometimes\nWhen you take you got to give so live and let live or let go\nI beg your pardon I never promised you a rose garden\nI could promise you things like big diamond rings\nBut you don't find roses growing on stalks of clover\nSo you better think it over\nWell if sweet talking you could make it come true\nI would give you the world right now on a silver platter\nBut what would it matter\nSo smile for a while and let's be jolly\nLove shouldn't be so melancholy\nCome along and share the good times while we can\nI beg your pardon I never promised you a rose garden\nAlong with the sunshine there's got to be a little rain sometimes\nI beg your pardon I never promised you a rose garden\nI could sing you a tune and promise you the moon\nBut if that's what it takes to hold you\nI'd just as soon let you go\nBut there's one thing I want you to know\nYou better look before you leap still waters run deep\nAnd there won't always be someone there to pull you out\nAnd you know what I'm talking about\nSo smile for a while and let's be jolly\nLove shouldn't be so melancholy\nCome along and share the good times while we can\nI beg your pardon I never promised you a rose garden\nAlong with the sunshine there's got to be a little rain sometimes"""
42,Don't Pull Your Love,Hamilton Joe Frank,1971,"b""Don't pull your love out on me baby\nIf you do then I think that maybe\nI'll just lay me down and cry for a hundred years\nDon't pull your love out on me honey\nTake my heart my soul my money\nBut don't leave me drownin' in my tears\nYou say you're gonna leave\nGonna take that big white bird\nGonna fly right out of here\nWithout a single word\nBut you know you'll break my heart\nWhen I watch you close that door\n'Cause I know I won't see you anymore\nDon't pull your love out on me baby\nIf you do then I think that maybe\nI'll just lay me down and cry for a hundred years\nDon't pull your love out on me honey\nTake my heart my soul my money\nBut don't leave me drownin' in my tears\nHaven't I been good to you\nWhat about that brand new ring\nDoesn't that mean love to you\nDoesn't that mean anything\nIf I threw away my pride\nAnd I got down on my knees\nWould you make me beg you pretty please\nDon't pull your love out on me baby\nIf you do then I think that maybe\nI'll just lay me down and cry for a hundred years\nDon't pull your love out on me honey\nTake my heart my soul my money\nBut don't leave me drownin' in my tears\nThere's so much I wanna do\nI've got love enough for two\nBut I'll never use it girl if I don't have you\nDon't pull your love out on me baby\nIf you do then I think that maybe\nI'll just lay me down and cry for a hundred years\nDon't pull your love out on me honey\nTake my heart my soul my money\nBut don't leave me drownin' in my tears\nDon't pull your love out on me baby\nIf you do then I think that maybe\nI'll just lay me down and cry for a hundred years\nDon't pull your love out on me baby\nIf you do then I think that maybe\nI'll just lay me down and cry for a hundred years"""
43,It Don't Come Easy,Ringo Starr,1971,"b""It don't come easy\nYou know it don't come easy\nGot to pay your dues if you want to sing the blues\nAnd you know it don't come easy\nYou don't have to shout or leap about\nYou can even play them easy\nForget about the past and all your sorrows\nThe future won't last\nIt will soon be over tomorrow\nI don't ask for much I only want your trust\nAnd you know it don't come easy\nAnd this love of mine keeps growing all the time\nAnd you know it just ain't easy\nOpen up your heart let's come together\nUse a little love\nAnd we will make it work out better\nPeace remember peace is how we make it\nHere within your reach\nIf you're big enough to take it"""
44,Mr. Bojangles,Nitty Gritty Dirt Band,1971,"b'I knew a man Bojangles and he\'d dance for you\nIn worn out shoes\nWith silver hair a ragged shirt and baggy pants\nThe old soft shoe\nHe jumped so high jumped so high\nThen he lightly touched down\nI met him in a cell in New Orleans I was\nDown and out\nHe looked to me to be the eyes of age\nAs he spoke right out\nHe talked of life talked of life he laughed\nClicked his heels and stepped\nHe said his name ""Bojangles"" and he danced a lick\nAcross the cell\nHe grabbed his pants and spread his stance\nOh he jumped so high and then he clicked his heels\nHe let go a laugh let go a laugh\nAnd shook back his clothes all around\nMr. Bojangles Mr. Bojangles\nMr. Bojangles dance\nHe danced for those at minstrel shows and county fairs\nThroughout the south\nHe spoke through tears of 15 years how his dog and him\nTraveled about\nThe dog up and died he up and died\nAnd after 20 years he still grieves\nHe said ""I dance now at every chance in honky tonks\nFor drinks and tips\nBut most the time I spend behind these county bars\nCause I drinks a bit""\nHe shook his head and as he shook his head\nI heard someone ask him please\nMr. Bojangles Mr. Bojangles\nMr. Bojangles dance...'"
45,I Love You for All Seasons,The Fuzz,1971,"b""I love you for so many reasons\nWhich means I love you for all seasons\nFirst of all I love you with the freshness of a spring day\nThen I love you with hot passions like the summer sun\nWhen june's here to stay\nI don't know how to explain my love's seasonal change\nIt seems never the same - all I know is\nI love you for so many reasons\nWhich means I love you for all seasons\nI love you with the gentleness of a falling leaf on an autumn day\nBut most of all I love you with the briskness of a winter\nWhen the snows come out to stay\nI don't know how to explain my love's seasonal change\nIt seems never the same - all I know is\nI love you for so many reasons\nWhich means i love you for all seasons\nI love you for so many reasons\nWhich means i love you for all seasons"""
46,Whatcha See is Whatcha Get,The Dramatics,1971,"b""Some people are made of plastic\nAnd you know some people are made of wood\nSome people have hearts of stone\nSome people are up to no good\nBut baby I'm for real\nI'm as real as real can get\nIf what you're looking for is real loving\nThen what you see is what you get\nWhat you see  is what you get \nWhat you see  is what you get \nI said what you see  is what you get now baby \nAnd the real thing is the best thing yet \nYou know some people are made of lies\nTo bring you down and shame your name\nBut baby I have good intentions\n'Cause breaking hearts just ain't my game\nAll I want to do is love you\nAnd sugar I won't fill you with regret no no\nIf what you're looking for is real loving\nThen what you see is what you get\nWhat you see  is what you get \nWhat you see  is what you get \nI mean what you see  is what you get now baby \nAnd the real thing is the best thing yet """
47,That's the Way I've Always Heard It Should Be,Carly Simon,1971,"b""My father sits at night with no lights on\nHis cigarette glows in the dark\nThe living room is still\nI walk by no remark\nI tiptoe past the master bedroom where\nMy mother reads her magazines\nI hear her call sweet dreams\nBut I forgot how to dream\nBut you say it's time we moved in together\nAnd raised a family of our own\nYou and me\nWell that's the way I've always heard it should be\nYou want to marry me\nWe'll marry\nMy friends from college\nThey're all married now\nThey have their houses and their lawns\nThey have their silent noons\nTearful nights angry dawns\nTheir children hate them for the things they're not\nThey hate themselves for what they are\nAnd yet they drink they laugh\nClose the wound\nHide the scar\nBut you say it's time we moved in together\nAnd raised a family of our own\nYou and me\nWell that's the way I've always heard it should be\nYou want to marry me\nWe'll marry\nYou say we can keep our love alive\nBabe all I know is what I see\nThe couples cling and claw\nAnd drown in love's debris\nYou say we'll soar like two birds through the clouds\nBut soon you'll cage me on your shelf\nI'll never learn to be just me first\nBy myself\nWell O.K\nIt's time we moved in together\nAnd raised a family of our own\nYou and me\nWell that's the way I've always heard it should be\nYou want to marry me\nWe'll marry\nWe'll marry"""
48,If You Really Love Me,Stevie Wonder,1971,"b""And if you really love me won't you tell me\nAnd if you really love me won't you tell me\nAnd if you really love me won't you tell me\nThen I won't have to be\nPlaying around\nYou call my name\nOoh so sweet\nTo make your kiss incomplete\nWhen your mood is clear\nYou quickly change your ways\nThen you say I'm untrue\nWhat am I supposed to do\nBe a fool who sits alone waiting for you\nAnd if you really love me won't you tell me\nAnd if you really love me won't you tell me\nAnd if you really love me won't you tell me \nThen I won't have to be\nPlaying around\nI see the light of your smile\nCalling me all the while\nYou are saying baby\nIt's time to go\nFirst the feeling's alright\nThen it's gone from sight\nSo I'm taking out this time to say\nOoh oh\nAnd if you really love me won't you tell me\nAnd if you really love me won't you tell me\nAnd if you really love me won't you tell me baby tell me\nThen I won't have to be\nPlaying around\nPlaying around \nPlaying around\nHey yeah\nGoofing around no\nOh baby\nPlaying around no\nLet me know how you feel baby \nHey oh baby\nPlaying around no """
49,Spanish Harlem,Aretha Franklin,1971,"b""It is the special one\nIt never sees the sun\nIt only comes up\nWhen the moon is on the run\nAnd all the stars are gleaming\nIt's growing in the street\nRight up through the concrete\nBut soft sweet and dreamy\nWith eyes as black as coal\nThat look down in his soul\nIt start a fire there and then he looses control\nI'm gonna beg his par-ar-ar-ardon yeah\nHe's going to pick that rose\nAnd watch her as she grows\nIn his garden\nWith eyes as black as coal\nThat look down in his soul\nAnd start a fire there and then he loses control\nAnd i wanna beg his par-ar-ar-don\nHe's going to pick that rose\nAnd watch her as she grows\nIn his garden"""
50,I Don't Know How to Love Him,Helen Reddy,1971,"b""I don't know how to love him\nWhat to do how to move him\nI've been changed yes really changed\nIn these past few days when I've seen myself\nI seem like someone else\nI don't know how to take this\nI don't see why he moves me\nHe's a man he's just a man\nAnd I've had so many men before\nIn very many ways\nHe's just once more\nShould I bring him down?\nShould I scream and shout?\nShould I speak of love\nLet my feelings out?\nI never thought I'd come to this\nWhat's it all about\nDon't you think it's rather funny\nI should be in this position\nI'm the one who's always been\nSo calm so cool no lover's fool\nRunning every show\nHe scares me so\nYes if he said he loved me\nI'd be lost I'd be frightened\nI couldn't cope just couldn't cope\nI'd turn my head I'd back away\nI wouldn't want to know\nHe scares me so\nI want him so\nI love him so"""
51,Yo-Yo,The Osmonds,1971,"b""Woah oh ho just like a yo-yo\nWoah oh ho just like a yo-yo\nWell it's hard for me to see\nHow you got such a hold on me\nFirst I'm up and then I'm down\nThen my heart goes around and around\nWell I'll bet you five dollars\nI'm the only fool who will\nClimb up a string for you\nOh yeah and need I say\nI can't break away\nYou control every\nLittle thing I do\nI used to be a swinger\nTil you wrapped me\nRound your finger\nJust like a yo-yo\nJust like a yo-yo\nTurning turning\nLove keeps burning\nLike a fire in my heart\nWhen were apart but\nWhen were back together\nYou keep changing like\nThe weather whoops now\nOh yeah like a yo-yo\nOh just like a yo-yo\nHeard what he said\nLike a yo-yo\nOh just like a yo-yo\nWhere I go and what I do\nWell it all just depends on you\nYou build me up just to let me down\nBut I dare not to make a sound\nCause I'm so afraid\nYou will cast me away\nLike a beat up worn out toy\nSo I hold on tight\nWith all my might just\nTo be your loving boy yeah\nNo matter what they say or do\nI gotta bounce right\nBack to you now\nJust like a yo-yo\nJust like a yo-yo\nTurning turning\nLove keeps burning\nLike a fire in my heart\nWhen were apart but\nWhen were back together\nYou keep changing like\nThe weather whoops now\nOh yeah like a yo-yo\nOh just like a yo-yo......"""
52,Bridge over Troubled Water,Aretha Franklin,1971,"b""I won't \nUm hum hum\nI know that\nIf you only believe\nSaid I wouldn't \nUmm \nYes it do\n if you only believe\nWhen you're down and out\nWhen you're on the street\nWhen evening falls so hard\nI will comfort you\nI'll take your part\nOh when darkness comes\nAnd pain is all is all around\nJust like a bridge over troubled water\nI will lay me down\nJust like a bridge\n over troubled water\nI will lay me down\nSail on silver girl\nSail on by\nYour time has come to shine\nAll of your dreams are on their way\nOoooh and if you ever need a friend\nLook around I'm sailing right behind\nJust like a bridge\n over  water\nI'll be there to lay me down\nLike a bridge over  troubled water\nI will lay me down\nOoooh I'll be your bridge\nYes I will\nSaid I wouldn't\nWell \nUh-huh \nI know that\n yeah \nStill water \nYeah\nTalking bout still water\nYou know they run deep\n uh-huh \nWell I'm gonna be your bridge yeah!\nThe troubled water \nOh!\nCome on come on\nWalk out on me\nOh\n..."""
53,Doesn't Somebody Want to Be Wanted,The Partridge Family,1971,"b""De de de deee de de\nDe de de de de de\nDe de de de de de de de de de de de\nDe de de de\nI go downtown\nAnd roam around\nBut every street I walk I find another dead end\nI'm on my own but I'm so all alone\nI need somebody\nSo I won't have to pretend\nI know there's someone just waiting somewhere\nI look around for her but she's just not there\nOhh\nDoesn't somebody want to be wanted like me?\nWhere are you?\nDoesn't somebody want to be wanted like me just like me?\nI'm runnin' free but I don't want to be\nI couldn't take another day\nLike yesterday\nI'm dead on my feet\nFrom walkin' the street\nI need somebody\nTo help me find my way\nI've gotta get out of this town \nBefore I do I'll take a last look around\nOhh\nDoesn't somebody want to be wanted like me?\nWhere are you?\nDoesn't somebody want to be wanted like me just like me?\nYou know I'm no different from anybody else\nI start each day and end each night\nIt gets really lonely when you're by yourself\nAnd where is love? And who is love?\nI gotta know\nDoesn't somebody want to be wanted like me?\nWhere are you?\nDoesn't somebody want to be wanted like me just like me?\nHeyyy\nDoesn't somebody want to be wanted like me?\nWhere are you?\nDoesn't somebody want to be wanted like me just like me?\nHeyyy\nDoesn't somebody want to be wanted like me?\nWhere are you?\nDoesn't somebody want to be wanted like me just like me?\nHeyyy"""
54,Draggin' the Line,Tommy James,1971,"b""Makin' a livin' the old hard way\nTakin' and givin' by day by day\nI dig snow and rain and the bright sunshine\nDraggin' the line \nMy dog Sam eats purple flowers\nAin't got much but what we got's ours\nWe dig snow and rain and the bright sunshine\nDraggin' the line \nDraggin' the line \nI feel fine\nI'm talkin' 'bout peace of mind\nI'm gonna take my time\nI'm gettin' the good sign\nDraggin' the line \nDraggin' the line \nLovin' the free and feelin' spirit\nOf hugging a tree when you get near it\nDiggin' the snow and rain and the bright sunshine\nDraggin' the line \nDraggin' the line \nI feel fine\nI'm talkin' 'bout peace of mind\nI'm gonna take my time\nI'm gettin' the good sign\nDraggin' the line \nDraggin' the line \nDraggin' the line  \nDraggin' the line  \nDraggin' the line  \nDraggin' the line  \nDraggin' the line  \nDraggin' the line  """
55,Proud Mary,Ike,1971,"b""You know every now and then\nI think you might like to hear something from us\nNice and easy but there's just one thing\nYou see we never ever do nothing nice and easy\nWe always do it nice and rough\nSo we're going to take the beginning of this song\nAnd do it easy\nThen we're going to do the finish rough\nThis is the way we do 'Proud Mary'\nAnd we're rolling rolling rolling on the river\nListen to the story\nLeft a good job in the city\nWorking for the man every night and day\nAnd I never lost one minute of sleeping\nWorrying 'bout the way that things might have been\nBig wheel keep on turning\nProud Mary keep on burning\nAnd we're rolling rolling\nRolling on the river\nCleaned a lot of plates in Memphis\nI pumped a lot of 'tane down in New Orleans\nBut I never saw the good side of the city\nUntil I hitched a ride on the riverboat queen\nBig wheel keep on turning\nProud Mary keep on burning\nAnd we're rolling rolling\nRolling on the river\nIf you come down to the river\nI bet you going to find some people who live\nAnd you don't have to worry if you got no money\nPeople on the river are happy to give\nRolling rolling rolling on the river\nRolling rolling rolling on the river\nRolling rolling rolling on the river\nRolling rolling rolling on the river"""
56,"Beginnings/""Colour My World""",Chicago,1971,b'As time goes on I realize Just what you mean To me And now Now that you re near Promise your love That I ve waited to share And dreams Of our moments together Color my world with hope of loving you'
57,Stay Awhile,The Bells,1971,"b""Into my room he creeps\nWithout making a sound\nInto my dreams he peeps\nWith his hair all long and hanging down\nHow he makes me quiver\nHow he makes me smile\nWith all this love I have to give you\nI guess I'm gonna stay with him awhile\nShe brushes the curls from my eyes\nShe drops her robe on the floor\nAnd she reaches for the light on the bureau\nAnd the darkness is her pillow once more\nHow she makes me quiver\nHow she makes me smile\nWith all this love I have to give her\nI guess I'm gonna stay with her awhile\nHow it makes me quiver\nHow it makes me smile\nWith all this love I have to give you\nGuess I'm gonna stay with you awhile\nHow it makes me quiver\nHow it makes me smile\nWith all this love I have to give you\nGuess I'm gonna stay with you awhile\nStay with you awhile\n I guess I'm gonna stay"""
