Rank,Song,Artist,Year,Lyrics
1,Joy to the World,Three Dog Night,1971,"b""Jeremiah was a bullfrog\nWas a good friend of mine\nI never understood a single word he said\nBut I helped him a-drink his wine\nAnd he always had some mighty fine wine\nSingin'\nJoy to the world\nAll the boys and girls now\nJoy to the fishes in the deep blue sea\nJoy to you and me\nIf I were the king of the world\nTell you what I'd do\nI'd throw away the cars and the bars and the wars\nMake sweet love to you\nSing it now\n to the world\n the boys and girls\nJoy to the fishes in the deep blue sea\nYou know I love the ladies\nLove to have my fun\nI'm a high night flier and a rainbow rider \nAnd a straight-shooting son of a gun \nI said a straight shootin' \n now\nAhhhh yeah!\n yeah YEAH!\n Yowwwww\nYou know I mean to\n Yeah! Yeah!\nYou know I mean to\n You know I mean to\n Yeah yeah\n Wahhh yeah\n Let me tell ya 'bout it"""
2,"Maggie May/""Reason to Believe""",Rod Stewart,1971,b'If I listened long enough to you I d find a way to believe that it s all true Knowing that you lied straight faced while I cried Still I look to find a reason to believe Someone like you makes it hard to live without Somebody else Someone like you makes it easy to give Never think about myself If I gave you time to change my mind I d find a way just to leave the past behind Knowing that you lied straight faced while I cried Still I look to find a reason to believe If I listened long enough to you I d find a way to believe that it s all true Knowing that you lied straight faced while I cried Still I look to find a reason to believe Someone like you makes it hard to live without Somebody else Someone like you makes it easy to give Never think about myself Someone like you makes it hard to live without Somebody else Someone like you makes it easy to give Never think about myself Someone like you makes it hard to live without Somebody else Someone like you makes it easy to give Never think about myself Someone like you makes it hard to live without Somebody else'
3,"It's Too Late/""I Feel the Earth Move""",Carole King,1971,b'I feel the earth move under my feet I feel the sky tumbling down I feel my heart start to trembling Whenever you re around Ooh baby when I see your face Mellow as the month of May Oh darling I can t stand it When you look at me that way I feel the earth move under my feet I feel the sky tumbling down I feel my heart start to trembling Whenever you re around Ooo darling when you re near me And you tenderly call my name I know that my emotions Are something I just can t tame I ve just got to have you baby uh huh huh uh huh huh yeah I feel the earth move under my feet I feel the sky tumbling down a tumbling down I feel the earth move under my feet I feel the sky tumbling down a tumbling down I just lose control Down to my very soul I get hot and cold all over all over all over all over I feel the earth move under my feet I feel the sky tumbling down a tumbling down I feel the earth move under my feet I feel the sky tumbling down a tumbling down A tumbling down a tumbling down a tumbling down a tumbling down tumbling down '
4,One Bad Apple,The Osmonds,1971,"b""I can tell you've been hurt\nBy that look on your face girl\nSome guy brought sad\nInto your happy world\nYou need love\nBut you're afraid that if you give in\nSomeone else will come along\nAnd sock it to you again\nOne bad apple don't spoil the whole bunch girl\nOh give it one more try\nBefore you give up on love\nOne bad apple don't spoil the whole bunch girl\nOh I don't care what they say\nI don't care what you heard\nI could make you happy baby\nSatisfy you too\nBut how can I\nIf you won't give me a chance to prove my love to you?\nWon't you just give me one chance?\nI'll give you my guarantee That you won't be hurt again\nOne bad apple don't spoil the whole bunch girl\nOh give it one more try\nBefore you give up on love\nOne bad apple don't spoil the whole bunch girl\nOh I don't care what they say\nI don't care what you heard now\nI've been noticing you baby\nFor a long long time\nAnd I'm not ashamed to tell the world\nThat you really messed up my mind\nGirl to me you're like a dream come true\nI'd rather hurt myself\nThan to ever hurt you\nOne bad apple don't spoil the whole bunch girl\nOh give it one more try\nBefore you give up on love girl\nOne bad apple don't spoil the whole bunch girl\nOh I don't care what they say\nI don't care what you heard now\nOne bad apple don't spoil the whole bunch girl"""
5,How Can You Mend a Broken Heart,Bee Gees,1971,b'I can think of younger days when living for my life\nWas everything a man could want to do\nI could never see tomorrow\nBut I was never told about the sorrows\nAnd how can you mend a broken heart?\nHow can you stop the rain from falling down?\nHow can you stop the sun from shining?\nWhat makes the world go round?\nHow can you mend this broken man?\nHow can a loser ever win?\nPlease help me mend my broken heart and let me live again\nI can still feel the breeze that rustles through the trees\nAnd misty memories of days gone by\nWe could never see tomorrow\nNo one said a word about the sorrow\nAnd how can you mend a broken heart?\nHow can you stop the rain from falling down?\nHow can you stop the sun from shining?\nWhat makes the world go round?\nAnd how can you mend this broken man?\nHow can a loser ever win?\nPlease help me mend my broken heart and let me live again\nLa la la la la la la la la la\nLa la la la la la la la la la\nPlease help me mend my broken heart and let me live again\nDa da da da\nDa da da da da da da da da da'
6,Indian Reservation (The Lament of the Cherokee Reservation Indian),Paul Revere,1971,"b""They took the whole Cherokee nation\nPut us on this reservation\nTook away our ways of life\nThe tomahawk and the bow and knife\nTook away our native tongue\nAnd taught their English to our young\nAnd all the things we made by hand\nAre nowadays made in Japan\nCherokee people Cherokee tribe\nSo proud to live so proud to die\nThey took the whole Indian nation\nLocked us on this reservation\nThough I wear a shirt and tie\nI'm still a redman deep inside\nCherokee people Cherokee tribe\nSo proud to live so proud to die\nBut maybe someday when they learn\nCherokee nation will return will return will return will return will return"""
7,Go Away Little Girl,Donny Osmond,1971,"b""Go away little girl\nGo away little girl\nI'm not supposed to be alone with you\nI know that your lips are sweet\nBut our lips must never meet\nI'm dating somebody else\nI must be true\nOh go away little girl\nGo away little girl\nIt's hurting me more each minute that we delay\nWhen you're near me like this\nYou're much too hard to resist\nSo go away little girl\nBefore I beg you to stay\nGo away little girl\nGo away little girl\nIt hurts me more the more that we delay\nWhen you're near me like this\nYou're much too hard to resist\nSo go away little girl\nLet's call it a day little girl\nPlease go away little girl\nBefore I beg you to stay"""
8,Take Me Home Country Roads,John Denver,1971,"b""Almost heaven West Virginia\nBlue Ridge Mountains Shenandoah River\nLife is old there older than the trees\nYounger than the mountains growing like a breeze\nCountry roads take me home\nTo the place I belong\nWest Virginia mountain mamma\nTake me home country roads\nAll my memories gather 'round her\nMiner's lady stranger to blue water\nDark and dusty painted on the sky\nMisty taste of moonshine teardrops in my eyes\nCountry roads take me home\nTo the place I belong\nWest Virginia mountain mamma\nTake me home country roads\nI hear her voice in the morning hour she calls me\nThe radio reminds me of my home far away\nDriving down the road I get a feeling\nThat I should have been home yesterday yesterday\nCountry roads take me home\nTo the place I belong\nWest Virginia mountain mamma\nTake me home country roads\nCountry roads take me home\nTo the place I belong\nWest Virginia mountain mamma\nTake me home country roads\nTake me home  country roads\nTake me home  country roads"""
9,Just My Imagination (Running Away with Me),The Temptations,1971,"b""Each day through my window I watch her as she passes by\nI say to myself you're such a lucky guy\nTo have a girl like her is truly a dream come true\nOut of all the fellows in the world she belongs to me\nBut it was Just my imagination runnin' away with me\nIt was just my imagination runnin' away with me\nSoon we'll be married and raise a family \nA cozy little home out in the country with two children maybe three\nI tell you I can visualize it all\nThis couldn't be a dream for too real it all seems\nBut it was just my imagination once again runnin' away with me\nTell you it was just my imagination runnin' away with me\nEv'ry night on my knees I pray Dear Lord hear my plea\nDon't ever let another take her love from me or I would surely die\nHer love is heavenly when her arms enfold me\nI hear a tender rhapsody; but in reality she doesn't even know me\nJust my imagination once again runnin' away with me\nTell you it was just my imagination runnin' away with me\nNo no no no no no no I can't forget her\nJust my imagination once again runnin' away with me\nJust my imagination runnin' away with me"""
10,Knock Three Times,Tony Orlando,1971,"b""Hey girl what ya doing down there\nDancin' alone every night\nWhile I live right above you\nI can hear your music playing\nI can feel your body swaying\nOne floor below me\nYou don't even know me\nI love you\nOh my darling\nKnock three times on the ceiling if you want me\nTwice on the pipe if the answer is no\nOh my sweetness\nMeans you'll meet me in the hallway\nTwice on the pipe means you ain't gonna show\nIf you look out your window tonight\nPull in the string with the note\nThat's attached to my heart\nRead how many times I saw you\nHow in my silence I adored you\nOnly in my dreams did\nThat wall between us come apart\nOh my darling\nI can hear your music playing\nI can feel your body swaying\nOne floor below me you don't even know me\nI love you\nOh my darling"""
11,Me and Bobby McGee,Janis Joplin,1971,"b""Busted flat in Baton Rouge waiting for a train\nWhen I was feeling nearly faded as my jeans\nBobby thumbed a diesel down just before it rained\nAnd rode us all the way to New Orleans\nI pulled my harpoon out of my dirty red bandana\nI was playing soft while Bobby sung the blues yeah\nWindshield wipers slapping time I was holding Bobby's hand in mine\nWe sang every song that driver knew\nFreedom's just another word for nothing left to lose\nNothing I mean nothing honey if it isn't free no no\nYeah feeling good was easy Lord when he sang the blues\nYou know feeling good was good enough for me\nGood enough for me and my Bobby McGee\nFrom the Kentucky coal mines to the California sun\nYeah Bobby shared the secrets of my soul\nThrough all kinds of weather through everything we done\nYeah Bobby baby kept me from the cold\nOne day up near Salinas Lord I let him slip away\nHe's lookin' for that home and I hope he finds it\nBut I'd trade all of my tomorrows for one single yesterday\nTo be holdin' Bobby's body next to mine\nFreedom's just another word for nothing left to lose\nNothing and that's all that Bobby left me\nFeeling good was easy Lord when he sang the blues\nYou know feeling good was good enough for me\nGood enough for me and my Bobby McGee\nLa da la la la la da la la la da la\nLa da da la la la Bobby McGee yeah\nLa da la la la la da la la la da la\nLa da da la la la Bobby McGee yeah\nLa da la la la la da la la la da la\nLa da da la la la Bobby McGee yeah\nLa da la la la la da la la la da la\nLa da da la la la Bobby McGee yeah\nLord I called him my lover I called him my man\nI said called him my lover just the best I can and come on\nAnd and a Bobby oh and a Bobby McGee yeah\nLo lo lo lo lo lo lo lo lo lo lo lo\nHey hey hey Bobby McGee lord\nLa da la la la la da la la la la la\nHey hey hey Bobby McGee yeah"""
12,Tired of Being Alone,Al Green,1971,b'I\xe2\x80\x99m so tired of being alone\nI\xe2\x80\x99m so tired of on-my-own\nWon\xe2\x80\x99t you help me girl\nJust as soon as you can\nPeople say that I\xe2\x80\x99ve found a way\nTo make you say that you love me\nHey baby you didn\xe2\x80\x99t go for that\nIt\xe2\x80\x99s a natural fact\nThat I wanna come back\nShow me where it\xe2\x80\x99s at baby\nI\xe2\x80\x99m so tired of being alone\nI\xe2\x80\x99m so tired of on-my-own\nWon\xe2\x80\x99t you help me girl\nSoon as you can\nI guess you know that I uh I love you so\nEven though you don\xe2\x80\x99t want me no more\nHey hey hey hey I\xe2\x80\x99m cryin\xe2\x80\x99 tears\nAll through the years\nI\xe2\x80\x99ll tell ya like it is\nHoney love me if you will\nYeah baby\nTired of being alone here by myself now\nI tell ya I\xe2\x80\x99m tired baby\nI\xe2\x80\x99m tired of being all wrapped up late at night\nIn my dreams nobody but you baby\nSometimes I wonder\nIf you love me like you say you do\nYou see baby I been thinkin\xe2\x80\x99 about it yeah\nI been I been wantin\xe2\x80\x99 to get next to you baby\nYa see sometimes I hold my arms I say mmmm hmmm hmmm\nYeah baby\nMeeting you has proven to me\nTo be my greatest dream yeah\nTired baby\nYeah you don\xe2\x80\x99t know what I\xe2\x80\x99m talkin\xe2\x80\x99 about\nSometimes late at night I get to wonderin\xe2\x80\x99 about you baby\nOh baby baby\nI\xe2\x80\x99m so tired of being alone\nI\xe2\x80\x99m so tired of being alone\nI\xe2\x80\x99m so tired of being alone\xe2\x80\xa6'
13,Want Ads,Honey Cone,1971,"b""Wanted young man single and free\nExperience in love preferred but will accept a young trainee\nOh I'm gonna put it in the want ads I need a love that's true\nGonna put it in the want ads my man and I are through\nAt home I find myself lost and all alone\nMy man is playing the field the thrill is gone\nHe stays out all night says he's with the boys\nBut lipstick on his collar perfume on it too\nTells me he's been lying tell ya what I'm gonna do\nI'm gonna put it in the want ads this girl's in misery\nGonna put it in the want ads somebody rescue me\nI spend my nights alone cryin' bitter tears\nAlthough I cry aloud nobody really hears\nAnd when I need him most he's never by my side\nHe's either playing cards or drinking at the bar\nHe thinks that I'm a fool I'm going to the evening news\nGonna put it in the want ads I need somebody new\nGonna put it in the want ads my man and I are through\nExtra extra read all about it\nWanted young man single and free\nExperience in love preferred\nBut will accept a young trainee\nLipstick on his collar perfume on it too\nTells me he's been lying I'm going to the evening news\nGonna put it in the want ads I need somebody new\nGonna put it in the want ads my man and I are through\nGonna put it in the want ads this girl's in misery\nGonna put it in the want ads somebody rescue me"""
14,Smiling Faces Sometimes,The Undisputed Truth,1971,"b""Smiling faces sometimes\nPretend to be your friend\nSmiling faces show no traces\nOf the evil that lurks within\nSmiling faces smiling faces sometimes\nThey don't tell the truth\nSmiling faces smiling faces\nTell lies and I got proof\nThe truth is in the eyes\nCause the eyes don't lie amen\nRemember a smile is just\nA frown turned upside down\nMy friend let me tell you\nSmiling faces smiling faces sometimes\nThey don't tell the truth\nSmiling faces smiling faces\nTell lies and I got proof\nBeware beware of the handshake\nThat hides the snake\nI'm telling you beware\nBeware of the pat on the back\nIt just might hold you back\nJealousy \nMisery \nEnvy\nI tell you you can't see behind\nSmiling faces smiling faces sometimes\nThey don't tell the truth\nSmiling faces smiling faces\nTell lies and I got proof\nSmiling faces smiling faces sometimes\nThey don't tell the truth\nSmiling faces smiling faces\nTell lies and I got proof\nYour enemy won't do you no harm\n'Cause you'll know where he's coming from\nDon't let the handshake and the smile fool ya\nTake my advice I'm only try' to school ya\nSmiling faces smiling faces sometimes\nThey don't tell the truth\nSmiling faces smiling faces\nTell lies and I got proof"""
15,Treat Her Like a Lady,Cornelius Brothers,1971,"b""All my friends had to ask me\nSomething they didn't understand\nHow I get all the women\nIn the palms of my hand\nAnd I told them\nTreat her like a lady \nDo the best you can do \nYou got to treat her like a lady and she'll give in to you\nLord look and see\nYou know what I mean\nI know you've heard that a woman \nWill soon take advantage of you \nLet me tell you my friend \nThere just ain't no substitute \nSo you ought to\nTreat her like a lady \nDo the best you can do \nYou got to treat her like a lady and she'll give in to you\nLord look and see\nYou know what I mean\nOh you got to love her  tease her \nBut most of all you got to please her \nYou got to hold her  and want her \nAnd make her feel you'll always need her \nYou know a woman  is sentimental \nAnd so easy  to upset \nSo make her feel  that she's for real yeah \nAnd she'll give you happiness whoa\nStrange as it seems \nYou know you can't treat a woman mean \nSo my friends there you have it\nI said it's the easy simple way\nIf you fail to do this\nDon't blame her if she looks my way\n'Cause I'm gonna\nTreat her like a lady \nSo affectionately \nI'm gonna treat her like a lady and she'll give in to me\nLord look and see\nYou know what I mean\nOh you gotta\nTreat her like a lady \nDo the best you can do \nYou got to treat her like a lady"""
16,You've Got a Friend,James Taylor,1971,"b""When you're down and troubled\nAnd you need a helping hand\nAnd nothing whoa nothing is going right\nClose your eyes and think of me\nAnd soon I will be there\nTo brighten up even your darkest nights\nYou just call out my name\nAnd you know wherever I am\nI'll come running oh yeah baby\nTo see you again\nWinter spring summer or fall\nAll you got to do is call\nAnd I'll be there yeah yeah yeah\nYou've got a friend\nIf the sky above you\nShould turn dark and full of clouds\nAnd that old north wind\nShould begin to blow\nKeep your head together\nAnd call my name out loud now\nSoon I be knocking\nUpon your door\nYou just call out my name\nAnd you know where ever I am\nI'll come running oh yes I will\nTo see you again\nWinter spring summer or fall yeah\nAll you got to do is call\nAnd I'll be there yeah yeah yeah\nHey ain't it good to know\nThat you've got a friend?\nPeople can be so cold\nThey'll hurt you\nAnd desert you\nWell they'll take your soul\nIf you let them\nOh yeah but don't you let them\nYou just call out my name\nAnd you know wherever I am\nI'll come running\nTo see you again oh baby don't you know 'bout\nWinter spring summer or fall\nAin't now all you got to do is call\nLord I'll be there yes I will\nYou've got a friend\nYou've got a friend yes\nAin't it good to know\nYou've got a friend\nAin't it good to know\nYou've got a friend\nOh yeah yeah\nYou've got a friend"""
17,Mr. Big Stuff,Jean Knight,1971,"b""Mr. Big Stuff\nWho do you think you are?\nMr. Big Stuff\nYou're never gonna get my love\nNow because you wear all those fancy clothes \nAnd have a big fine car oh yes you do now\nDo you think I can afford to give you my love \nYou think you're higher than every star above\nNow I know all the girls I've seen you with\nI know you broke their hearts one after another now bit by bit\nYou made 'em cry many poor girls cry\nWhen they tried to keep you happy they just tried to keep you satisfied\nI'd rather give my love to a poor guy that has a love that's true \nThan to be fooled around and get hurt by you\nCause when I give my love I want love in return \nNow I know this is a lesson Mr. Big Stuff you haven't learned\nMr. Big Stuff\nYou're never gonna break my heart\nMr. Big Stuff\nYou're never gonna make me cry"""
18,Brown Sugar,The Rolling Stones,1971,"b""Gold coast slave ship bound for cotton fields\nSold in the market down in New Orleans\nScarred old slaver knows he's doing alright\nHear him whip the women just around midnight\nBrown sugar how come you taste so good? Uh huh\nBrown sugar just like a young girl should uh huh oh \nDrums beating cold English blood runs hot\nLady of the house wonderin' when it's gonna stop\nHouse boy knows that he's doing alright\nYou shoulda heard 'em just around midnight\nBrown sugar how come you taste so good now?\nBrown sugar just like a young girl should now \nAh get on brown sugar how come you taste so good?\nAh got me craving the the brown sugar\nJust like a black girl should yeah\nAh and I bet your mama was a tent show queen\nAnd all her boyfriends were sweet sixteen\nI'm no schoolboy but I know what I like\nYou shoulda heard me just around midnight\nBrown sugar how come you taste so good baby?\nAh come down brown sugar\nJust like a young girl should yeah\nI said yeah yeah yeah woo\nHow come you how come you taste so good?\nYeah yeah yeah woo\nJust like a just like a black girl should\nYeah yeah yeah woo"""
19,Do You Know What I Mean,Lee Michaels,1971,"b""Been forty days since I don't know when\nI just saw her with my best friend\nDo you know what I mean?\nDo you know know what I mean?\nI just saw her yesterday\nI just saw her asked her to stay\nDo you know what I mean?\nLord Do you know what I mean?\nHer and Bobby were steppin' out\nHer and Bobby didn't know I found out\nDo you know what I mean?\nDo you know know what I mean?\nSo I asked her if she still cared\nShe didn't hear me she just stared\nDo you know what I mean?\nLord Do you know what I mean?\nAnd then she said\nLee you haven't loved me in nearly four years\nYou haven't noticed that I held back my tears\nAnd now you have but it's really too late\nBetter find yourself another girl\nBetter find another girl\nBetter find uh another place\n{Pause}\nShe just left me yesterday\nShe just left me had nothing to say\nDo you know what I mean?\nOh do you know what I mean?\nShe's a dandy yes indeed\nShe's a dandy but now she's free\nDo you know what I mean?\nLord do you know what I mean? Yeah\nBeen forty days since I don't know when\nI just saw her with my best friend\nDo you know what I mean?\nLord do you know what I mean?\nI just saw her yesterday\nI just saw her learn how to stay\nDo you know what I mean?\nLord Do you know what I mean?\nYeah here comes it now..\n{outro}"""
20,The Night They Drove Old Dixie Down,Joan Baez,1971,"b""Virgil Caine is my name and I drove on the Danville train\nTill Stonewall's cavalry came and tore up the tracks again\nIn the winter of 'sixty-five we were hungry just barely alive\nI took the train to Richmond that fell\nIt was a time I remember oh so well\nThe night they drove old Dixie down\nAnd all the bells were ringin';\nThe night they drove old Dixie down\nAnd all the people were singin'; they went:\nLa la la la la la la\nLa la la la la la\nLa la la\nBack with my wife in Tennessee\nAnd one day she said to me\nVirgil quick come see\nThere goes the Robert E. Lee\nNow I don't mind chopping wood\nAnd I don't care if the money's no good\nJust take what you need and leave the rest\nBut they should never have taken the very best\nThe night they drove old Dixie down\nAnd all the bells were ringin';\nThe night they drove old Dixie down\nAnd all the people were singin'; they went:\nLa la la la la la la\nLa la la la la la\nLa la la\nLike my father before me I'm a working man\nAnd like my brother before me I took a rebel stand\nOh he was just 18 proud and brave\nBut a yankee laid him in his grave\nI swear by the blood below my feet\nYou can't raise a Caine back up when he's in defeat\nThe night they drove old Dixie down\nAnd all the bells were ringin';\nThe night they drove old Dixie down\nAnd all the people were singin'; they went:\nLa la la la la la la\nLa la la la la la\nLa la la"""
21,What's Going On,Marvin Gaye,1971,"b""Mother mother\nThere's too many of you crying\nBrother brother brother\nThere's far too many of you dying\nYou know we've got to find a way\nTo bring some loving here today - Ya\nFather father\nWe don't need to escalate\nYou see war is not the answer\nFor only love can conquer hate\nYou know we've got to find a way\nTo bring some loving here today\nPicket lines and picket signs\nDon't punish me with brutality\nTalk to me so you can see\nOh what's going on\nWhat's going on\nYa what's going on\nAh what's going on\nIn the mean time\nRight on baby\nRight on\nRight on\nMother Mother everybody thinks we're wrong\nOh but who are they to judge us\nSimply because our hair is long\nOh you know we've got to find a way\nTo bring some understanding here today\nOh\nPicket lines and picket signs\nDon't punish me with brutality\nTalk to me\nSo you can see\nWhat's going on\nYa what's going on\nTell me what's going on\nI'll tell you what's going on - Uh\nRight on baby\nRight on baby"""
22,Uncle Albert/Admiral Halsey,Paul,1971,"b""We're so sorry Uncle Albert\nWe're so sorry if we caused you any pain\nWe're so sorry Uncle Albert\nBut there's no one left at home and I believe I'm gonna rain\nWe're so sorry but we haven't heard a thing all day\nWe're so sorry Uncle Albert\nBut if anything should happen we'll be sure to give a ring\nWe're so sorry Uncle Albert\nBut we haven't done a bloody thing all day\nWe're so sorry Uncle Albert\nBut the kettle's on the boil and we're so easily called away\nHands across the water \nHeads across the sky\nHands across the water \nHeads across the sky\nAdmiral Halsey notified me\nHe had to have a berth or he couldn't get to sea\nI had another look and I had a cup of tea and a butter pie\nHands across the water \nHeads across the sky\nHands across the water \nHeads across the sky\nLive a little be a gypsy get around \nGet your feet up off the ground\nLive a little get around\nLive a little be a gypsy get around \nGet your feet up off the ground\nLive a little get around\nHands across the water \nHeads across the sky\nHands across the water \nHeads across the sky"""
