Rank,Song,Artist,Year,Lyrics
19,On Our Own,Bobby Brown,1989,b' Yeah You want somethin done You gotta do it yourself OW Uhh Yeah I think this is gonna be another one of those funky ones Heart Soul d d dance If I was you and you were me you d want to be winning If you want something bad ya you gotta wanna give your all Cause I believe so much in we and know we re not kidding If you feel the same as me yo you gotta want to take the ball Now I find out that nothing is given Don t know where the cards may fall All I know is that we ve gotta get it We ve gotta make it on our own Well I guess we re gonna have to take control If it s up to us we ve got to take it home Now can t you see that all we need to be a go getter Gotta make your own decisions you gotta go for what you know There comes a time in our lives you wanna be bigger Gotta keep keep on pushing you gotta learn to take control yeah Now I find out that nothing is given Don t know where the cards may fall All I know is that we ve gotta get it We ve gotta make it on our own Well I guess we re gonna have to take control If it s up to us we ve got to take it home Gotta gotta take it home gotta gotta gotta take it home Ow Uh Heart Soul d d dance Too hot to handle too cold to hold They re called the Ghostbusters and they re in control Had em throwin a party for a bunch of children While all the while the slime was under the building So they packed up their group got a grip came equipped Grabbed their proton packs off their back and they split Found about Vigo the master of evil Try to battle my boys That s not legal They re in control Y Y Ya know it I said they re in control Y Y Ya know it Y Y Ya know it Well I guess we re gonna have to take control We got we got we got We got we got we got If it s up to us we ve got to take it home Too hot to handle too cold to hold they re the Ghostbusters and they re in control Well I guess we re gonna have to take control Gotta gotta take it home Gotta gotta take it home If it s up to us we ve got to take it home Gotta gotta take it home Gotta gotta gotta take it home ow Y Y Ya know it Uh Y Y Ya know it Too hot to handle too cold to hold They re called the Ghostbusters and they re in control Had em throwin a party for a bunch of children While all the while the slime was under the building So they packed up their group got a grip came equipped Grabbed their proton packs off their back and they split Found about Vigo the master of evil Try to battle my boys That s not legal They re in control Ya ya ya know it I said they re in control'
20,Two Hearts,Phil Collins,1989,b' Well there was no reason to believe she d always be there But if you don t put faith in what you believe in It s getting you nowhere Cause it hurts you never let go Don t look down just look up Cause she s always there to behind you just to remind you Two hearts believing in just one mind You know we re two hearts believing in just one mind Cause there s no easy way to to understand it There s so much of my life in her and it s like i m blinded And it teaches you to never let go There s so much love you ll never know She can reach you no matter how far Wherever you are Two hearts believing in just one mind Beating together till the end of time You know we re two hearts believing in just one mind Together forever till the end of time She knows There will always be a special place in my heart for her She knows she knows she knows Yeah she knows No matter how far apart we are She knows i m always right there beside her Two hearts believing in just one mind Beating together till the end of time You know we re two hearts believing in just one mind Together forever till the end of time '
21,Blame It on the Rain,Milli Vanilli,1989,b' You said you didn t need her You told her good bye You sacrificed a good love To satisfy your pride Now you wished that you should have her And you feel like such a fool You let her walk away Now it just don t feel the same Gotta blame it on something Gotta blame it on something Blame it on the rain that was falling falling Blame it on the stars that shine at night Whatever you do Don t put the blame on you Blame it on the rain yeah yeah You can blame it on the rain Should ve told her you were sorry Could have said you were wrong But no you couldn t do that You had to prove you were strong If you hadn t been so blinded She might still be there with you You want her back again But she just don t feel the same Gotta blame it on something Gotta blame it on something Cause the rain don t mind And the rain don t care You got to blame it on something '
22,Listen to Your Heart,Roxette,1989,b' I know there s something in the wake of your smile I get a notion from the look in your eyes yeah You ve built a love but that love falls apart Your little piece of Heaven turns too dark Listen to your heart when he s calling for you Listen to your heart there s nothing else you can do I don t know where you re going and I don t know why But listen to your heart before you tell him goodbye Sometimes you wonder if this fight is worthwhile The precious moments are all lost in the tide yeah They re swept away and nothing is what is seems The feeling of belonging to your dreams Listen to your heart when he s calling for you Listen to your heart there s nothing else you can do I don t know where you re going and I don t know why But listen to your heart before you tell him goodbye And there are voices that want to be heard So much to mention but you can t find the words The scent of magic the beauty that s been When love was wilder than the wind Listen to your heart when he s calling for you Listen to your heart there s nothing else you can do I don t know where you re going and I don t know why But listen to your heart before Listen to your heart when he s calling for you Listen to your heart there s nothing else you can do I don t know where you re going and I don t know why But listen to your heart before you tell him goodbye Listen to your heart Listen to your heart Listen to your heart'
23,I'll Be There for You,Bon Jovi,1989,b' I guess this time you re really leavin I heard your suitcase say goodbye Well as my broken heart lies bleedin You say true love is suicide You say you ve cried a thousand rivers And now you re swimmin for the shore You left me drownin in my tears And you won t save me anymore I m prayin to God you ll give me one more chance girl I ll be there for you these five words I swear to you When you breathe I want to be the air for you I ll be there for you I d live and I d die for you I d steal the sun from the sky for you Words can t say what love can do I ll be there for you I know you know we ve had some good times Now they have their own hidin place Well I can promise you tomorrow But I can t buy back yesterday And baby you know my hands are dirty But I wanted to be your valentine I ll be the water when you get thirsty baby When you get drunk I ll be the wine I ll be there for you these five words I swear to you When you breathe I want to be the air for you I ll be there for you I d live and I d die for you I d steal the sun from the sky for you Words can t say what love can do I ll be there for you And I wasn t there when you were happy I wasn t there when you were down I didn t mean to miss your birthday baby I wish I d seen you blow those candles out I ll be there for you these five words I swear to you When you breathe I want to be the air for you I ll be there for you I d live and I d die for you I d steal the sun from the sky for you Words can t say what love can do I ll be there for I ll be there for you these five words I swear to you When you breathe I want to be the air for you I ll be there for you I d live and I d die for you I d steal the sun from the sky for you Words can t say what love can do I ll be there for you Woah oh oh woah oh oh woah oh oh woah Woah oh oh woah oh oh woah oh oh woah Woah oh oh woah oh oh woah oh oh woah'
24,If You Don't Know Me by Now,Simply Red,1989,b'If you don t know me by now You will never never never know me All the things that we ve been through You should understand me like I understand you Now girl I know the difference between right and wrong I ain t gonna do nothing to break up our happy home Don t get so excited when I come home a little late at night Cause we only act like children when we argue fuss and fight If you don t know me by now You will never never never know me If you don t know by now You will never never never know me We ve all got our own funny moods I ve got mine woman you ve got yours too Just trust in me like I trust in you As long as we ve been together it should be so easy to do Just get yourself together or we might as well say goodbye What good is a love affair when we can t see eye to eye If you don t know me by now You will never never never know me '
25,Like a Prayer,Madonna,1989,b' Life is a mystery Everyone must stand alone I hear you call my name And it feels like home When you call my name It s like a little prayer I m down on my knees I want to take you there In the midnight hour I can feel your power Just like a prayer You know I ll take you there I hear your voice It s like an angel sighing I have no choice I hear your voice Feels like flying I close my eyes Oh God I think I m falling Out of the sky I close my eyes Heaven help me When you call my name It s like a little prayer I m down on my knees I wanna take you there In the midnight hour I can feel your power Just like a prayer You know I ll take you there Like a child You whisper softly to me You re in control Just like a child Now I m dancing It s like a dream No end and no beginning You re here with me It s like a dream Let the choir sing When you call my name It s like a little prayer I m down on my knees I wanna take you there In the midnight hour I can feel your power Just like a prayer You know I ll take you there When you call my name It s like a little prayer I m down on my knees I wanna take you there In the midnight hour I can feel your power Just like a prayer You know I ll take you there Life is a mystery Everyone must stand alone I hear you call my name And it feels like home Just like a prayer Your voice can take me there Just like a muse to me You are a mystery Just like a dream You are not what you seem Just like a prayer no choice Your voice can take me there Just like a prayer I ll take you there It s like a dream to me Just like a prayer I ll take you there It s like a dream to me Just like a prayer I ll take you there It s like a dream to me Just like a prayer I ll take you there It s like a dream to me Just like a prayer Your voice can take me there Just like a muse to me You are a mystery Just like a dream You are not what you seem Just like a prayer no choice Your voice can take me there Just like a prayer Your voice can take me there Just like a muse to me You are a mystery Just like a dream You are not what you seem Just like a prayer no choice Your voice can take me there Your voice can take me there Like a prayer Like a prayer Just like a prayer your voice can take me there It s like a dream to me Just like a prayer your voice can take me there It s like a dream to me Just like a prayer your voice can take me there It s like a dream to me Just like a prayer your voice can take me there It s like a dream to me'
26,I'll Be Loving You (Forever),New Kids on the Block,1989,b'Yeah I m not that kind of guy who can take a broken heart So don t ever leave I don t want to see us part The very thought of losing you means That everything Would go down under I ll be loving you forever Just as long as you want me to be I ll be loving you forever All this love s for you and me yeah I ll be Loving you Yeah it s forever I ll be Loving you Yeah I count the blessings that keep our love new There s one for me And a million for you There s just so much that I wanna say But when I look at you All my thoughts get in the way I ll be loving you forever Just as long as you want me to be I ll be loving you forever All this love s for you and me yeah I ll be Loving you Yeah it s forever I ll be Loving you Yeah We ve learned to fall to every turn back now This love will last forever I can see it all now I ll be Loving you Yeah is forever I ll be Loving only you girl Yeah girl Oh girl I ll be loving only you Be loving you girl'
27,How Can I Fall?,Breathe,1989,b' Give me time to care The moment s here for us to share Still my heart Is not always there What more can I say to you Could I lie to you I m just too weak to face the truth Now I know I should make a move What more can I say How can I fall How can I fall When you just won t give me reasons When you just won t Give me reasons at all When all faith is gone I fight myself to carry on Yet I know of the harm I do What more can I say to you Now I hold this line I know the choice to leave is mine I can t help What I feel inside What more can I say I ll follow through I ll see I do When the time is far more Right for you I ll make that move And when I do Will I doubt again the way I do How can I fall How can I fall When you just won t give me reasons When you just won t give me reasons at all How can I fall How can I fall When you just won t give me reasons When you just won t give me reasons Just won t give me reasons Just won t give me reasons at all How can I fall I fall I fall How can I fall for you How can I fall How can I fall When you just won t give me reasons When you just won t give me reasons'
28,Baby Don't Forget My Number,Milli Vanilli,1989,b' Babe don t be shy When you re holding my hand Cause this time goes back You got to understand It s you Ba ba ba baby In your eyes I see it so clearly That our love it s so strong And you never go wrong I got the best for you So I m waiting down If you need someone Baby call my line Call me anytime I ll be there for you You you I ve been searching high High high I ve been searching low Ba ba ba ba baby Don t forget my number Baby don t be stronger than a thunder Ba ba ba ba baby Don t forget my number Love will see you through I ve been searching high I ve been searching low I want to spend spend my life with you Ba ba ba ba ba ba ba ba My desper youth Ba ba ba ba ba ba ba ba Love will see you through Ba ba baby In your eyes I see it so clearly '
29,Toy Soldiers,Martika,1989,b' Step by step Heart to heart Left right left We all fall down Like toy soldiers It wasn t my intention to mislead you It never should have been this way What can I say It s true I did extend the invitation I never knew how long you d stay When you hear temptation call It s your heart that takes Takes the fall Step by step Heart to heart Left right left We all fall down Like toy soldiers Bit by bit Torn apart We never win But the battle wages on For toy soldiers It s getting hard to wake up in the morning My head is spinning constantly How can it be How could I be so blind to this addiction If I don t stop The next one s gonna be me Only emptiness remains It replaces all All the pain Step by step Heart to heart Left right left We all fall down Like toy soldiers Bit by bit Torn apart We never win But the battle wages on For toy soldiers Only emptiness remains It replaces all All the pain Step by step Heart to heart Left right left We all fall down Like toy soldiers Bit by bit Torn apart We never win But the battle wages on For toy soldiers Step by step Heart to heart Left right left We all fall down Like toy soldiers Bit by bit Torn apart We never win But the battle wages on For toy soldiers'
30,Forever Your Girl,Paula Abdul,1989,b' Hey baby You gotta remember I m forever your girl And baby forever and ever and ever Baby pick your head up Come on and look me in the face Cause I can tell that somethin is bringin you down Is it the rumour that another boy wants to take your place Have you been hearin the stories They re goin around Baby just remember I gave you my heart Ain t no one gonna tear us apart He could promise the moon and the stars above Even if he promised me the world Just remember I m forever your girl He could promise the world You gotta remember I m forever your girl Honey listen to me Your love is all I need You should know that I don t need nothin that money can buy So if a boy were to come along And try to make me leave you There d be no need to worry I m tellin you why Baby don t you know that I love ya And I d never put nobody above ya He could promise the moon and the stars above Even if he promised me the world Just remember I m forever your girl He could promise the world You gotta remember I m forever your girl I m forever your baby Just remember I m forever your girl He could promise the world Hey baby just remember I m forever your girl When the mountains crumble into the sea That s the day someone ll come between you and me Baby just remember I gave you my heart Ain t no one gonna tear us apart Baby he could promise me diamonds Even if he promised me pearls Honey you know I ain t lyin Listen as I tell it to the world Just remember baby remember Just remember Baby forever and ever and ever We ll be together I m forever your girl Baby forever and ever and ever We ll be together I m forever your girl Baby forever and ever and ever We ll be together I m forever your girl Hey baby he could promise the world Girl you know I love you And I always will If we live til forever I ll be lovin you I ll be lovin you still Just remember I m forever your girl Forever your girl Just remember I m forever your girl'
31,The Living Years,Mike + The Mechanics,1989,b'Every generation Blames the one before And all of their frustrations Come beating on your door I know that I m a prisoner to all my father held so dear I know that I m a hostage to all his hopes and fears I just wish I could have told him in the living years Crumpled bits of paper Filled with imperfect thought Stilted conversations I m afraid that s all we ve got You say you just don t see it He says it s perfect sense You just can t get agreement In this present tense We all talk a different language Talking in defence Say it loud say it clear You can listen as well as you hear It s too late when we die To admit we don t see eye to eye So we open up a quarrel Between the present and the past We only sacrifice the future It s the bitterness that lasts So don t yield to the fortunes You sometimes see as fate It may have a new perspective On a different day And if you don t give up and don t give in You may just be OK I wasn t there that morning When my father passed away I didn t get to tell him All the things I had to say I think I caught his spirit Later that same year I m sure I heard his echo In my baby s new born tears I just wish I could have told him in the living years '
32,Eternal Flame,The Bangles,1989,b'Close your eyes give me your hand darling Do you feel my heart beating Do you understand Do you feel the same Am I only dreaming Is this burning an eternal flame I believe it s meant to be darling I watch you when you are sleeping You belong with me Do you feel the same Am I only dreaming Or is this burning an eternal flame Say my name Sun shines through the rain A whole life so lonely And then come and ease the pain I don t want to lose this feeling oh Say my name Sun shines through the rain A whole life so lonely And then come and ease the pain I don t want to lose this feeling oh Close your eyes give me your hand Do you feel my heart beating Do you understand Do you feel the same Am I only dreaming Or is this burning an eternal flame Close your eyes give me your hand darling Do you feel my heart beating Do you understand Do you feel the same Am I only dreaming Is this burning an eternal flame Close your eyes give me your hand darling Do you feel my heart beating Do you understand Do you feel the same Am I only dreaming ah An eternal flame Close your eyes give me your hand darling Do you feel my heart beating Do you understand Do you feel the same Am I only dreaming ah Is this burning an eternal flame Close your eyes give me your hand darling'
33,Wild Thing,Tone Lōc,1989,b' Let s do it Workin all week 9 to 5 for my money So when the weekend comes I go get live with the honey Rollin down the street I saw this girl and she was pumpin I winked my eye she got into the ride went to a club was jumpin Introduce myself as Loc she said You re a liar I said I got it goin on baby doll and I m on fire Took her to the hotel she said You re the king I said Be my queen if you know what I mean and let us do the wild thing Wild thing Wild thing Shoppin at the mall looking for some gear to buy I saw this girl she cool rocked my world and I had to adjust my fly She looked at me and smiled and said You have plans for the night I said Hopefully if things go well I ll be with you tonight So we journeyed to her house one thing led to another I keyed the door we cold hit the floor looked up and it was her mother I didn t know what to say I was hanging by a string She said Hey you two I was once like you and I liked to do the wild thing Wild thing She loved to do the wild thing Wild thing Please baby baby please Posse in effect hangin out is always hype And when me and the crew leave the shindig I want a girl who s just my type Saw this luscious little frame I ain t lyin fellas she was fine The sweet young miss go gave me a kiss and I knew that she was mine Took her to the limousine still parked outside I tipped the chauffeur when it was over and I gave her my own ride Couldn t get her off my jock she was like static cling But that s what happens when body start slappin from doin the wild thing Wild thing She wanna do the wild thing Please baby baby please Wild thing Doin a little show at the local discotheque This fine young chick was on my jock so I say what the heck She want to come on stage and do her little dance So I said chill for now but maybe later you ll get your chance So when the show was finished I took her around the way And what do you know she was good to go without a word to say We was all alone and she said Tone let me tell you one thing I need 50 to make you holler I get paid to do the wild thing Say what Yo love you must be kidding You re walkin babe Just break out of here Hasta la vista baby Wild thing'
34,When I See You Smile,Bad English,1989,b'Sometimes I wonder How I d ever make it through Through this world without having you I just wouldn t have a clue Cause sometimes it seems Like this world is closing in on me And there s no way of breaking free And then I see you reach for me Sometimes I want to give up wanna give in I wanna quit the fight And then I see you baby And everything s alright Everything s alright When I see you smile I can face the world Oh you know I can do anything When I see you smile see a ray of light Oh see it shining right through the rain When I see you smile Baby when I see you smile at me Oh yeah Baby there s nothing In this world that could ever do What the touch of your hand can do It s like nothing that I ever knew Hey And when the rain is falling I don t feel it Cause you re here with me now I want your answer baby It s all I ll ever need It s all I ll ever need When I see you smile I can face the world Oh you know I can do anything When I see you smile I see a ray of light Oh I see it shining right through the rain When I see you smile baby Baby when I see you smile at me Sometimes I want to give up I wanna give in I wanna quit the fight Then one look at you baby And everything s alright Hey everything s alright so right When I see you smile I can face the world Oh you know I can do anything yeah When I see you smile I see a ray of light Oh I see it shining right through the rain yeah When I see you smile yeah I can face the world Oh you know I can do anything now When I see you smile oh yeah Baby when I see you smile Smile at me'
35,If I Could Turn Back Time,Cher,1989,b' If I could turn back time If I could find a way I d take back those words that ve hurt you and you d stay I don t know why I did the things I did I don t know why I said the things I said Pride s like a knife it can cut deep inside Words are like weapons they wound sometimes I didn t really mean to hurt you I didn t wanna see you go I know I made you cry but baby If I could turn back time if I could find a way I d take back those words that ve hurt you you d stay If I could reach the stars I d give em all to you Then you d love me love me like you used to do If I could turn back time My world was shattered I was torn apart Like someone took a knife and drove it deep in my heart When you walked out that door I swore that I didn t care But I lost everything darlin then and there Too strong to tell you I was sorry Too proud to tell you I was wrong I know that I was blind and darlin If I could turn back time if I could find a way I d take back those words that ve hurt you and you d stay If I could reach the stars I d give em all to you Then you d love me love me like you used to do If I could turn back time If I could turn back time If I could turn back time Oh baby I didn t really mean to hurt you I didn t wanna see you go I know I made you cry but If I could turn back time if I could find a way I d take back those words that hurt you If I could reach the stars I d give em all to you Then you d love me love me like you used to do If I could turn back time if I could find a way And maybe maybe maybe you d stay If I could reach the stars'
