Rank,Song,Artist,Year,Lyrics
67,Miss You Like Crazy,Natalie Cole,1989,b' Even though it s been so long My love for you keeps going strong I remember the things that we used to do A kiss in the rain till the sun shine through I tried to deny it but I m still in love with you I miss you like crazy I miss you like crazy Ever since you went away every hour of every day I miss you like crazy I miss you like crazy No matter what I say or do There s just no getting over you I can see the love shining in your eyes And it comes as such a sweet surprise If seeing s believing it s worth the wait So hold me and tell me it s not too late We re so good together we re starting forever now And I miss you like crazy I miss you like crazy Ever since you went away every hour of every day I miss you like crazy I miss you baby A love like ours will never end Just touch me and we re there again Just one night And we ll have that magic feeling like we used to do Hold on tight And whatever comes our way we re gonna make it through If seeing s believing it s worth the wait So hold me and tell me it s not too late We re so good together we re starting forever now And I miss you like crazy I miss you like crazy No matter what I say or do There s just no getting over you And I miss you baby I miss you baby All the tender love you gave me When a feeling gets this strong You know the real thing come along And I miss you I miss you like crazy baby Only your sweet love can save me I miss you like crazy A love like ours will never end Just touch me and we re there again Miss you like crazy I miss you like crazy'
68,Lovesong,The Cure,1989,b' Whenever I m alone with you You make me feel like I am home again Whenever I m alone with you You make me feel like I am whole again Whenever I m alone with you You make me feel like I am young again Whenever I m alone with you You make me feel like I am fun again However far away I will always love you However long I stay I will always love you Whatever words I say I will always love you I will always love you Fly me to the moon Whenever I m alone with you You make me feel like I am free again Whenever I m alone with you You make me feel like I am clean again However far away I will always love you However long I stay I will always love you Whatever words I say I will always love you I will always love you'
69,Secret Rendezvous,Karyn White,1989,b' Happiness is when I I think of you And when we get together and rendezvous I ll be on time you bring the wine And when we lock the door you ll be all mine Alone in my room Thoughts of you in my head As I wait The time is soon You ll arrive Together then We ll escape Into the night on wings of love And do the things that we once dreamed of All aboard a luxury A first class ticket to ecstasy It won t stop It don t stop Our non stop secret rendezvous It won t stop It don t stop Our non stop secret rendezvous Hey hey hey Oh oh oh From a penthouse view We ll make love Drink champagne by candlelight I m so glad I m in your arms Baby I am yours tonight To be with you is all I need So lock the door and throw away the key No one will disturb this groove We could not stop it if we wanted to It won t stop It don t stop Our non stop secret rendezvous It won t stop It don t stop Our non stop secret rendezvous Hey hey hey Hey hey hey Oh oh oh Secret rendezvous Happiness is when I I think of you And when we get together and rendezvous I ll be on time you bring the wine And when we lock the door you ll be all mine I want you Do you want me I wanna lock the door Throw away the key Ecstasy yeah No Baby I just wanna be with you It won t stop It don t stop Our non stop secret rendezvous I wanna rendezvous by candlelight I wanna hug and squeeze you through the night So lock the door throw away the key Ecstasy I can t let no one disturb this groove I couldn t stop it if I wanted to It s you for me And me for you In a secret rendezvous It won t stop It don t stop Our non stop secret rendezvous It won t stop It don t stop Our non stop secret rendezvous I wanna rendezvous by candlelight I wanna hug and squeeze you through the night So lock the door throw away the key Ecstasy I can t let no one disturb this groove I couldn t stop it if I wanted to It s you for me And me for you In a secret rendezvous It won t stop It don t stop Our non stop secret rendezvous It won t stop It don t stop Our non stop secret rendezvous'
70,Angel Eyes,The Jeff Healey Band,1989,b'Girl you re looking fine tonight And every guy has got you in his sight What you re doing with a clown like me Is surely one of life s little mysteries So tonight I ll ask the stars above How did I ever win your love What did I do What did I say To turn your angel eyes my way Well I m the guy who never learned to dance Never even got one second glance Across a crowded room was close enough I could look but I could never touch So tonight I ll ask the stars above How did I ever win your love What did I do What did I say To turn your angel eyes my way Don t anyone wake me If it s just a dream Cause she s the best thing Ever happened to me All you fellows You can look all you like But this girl you see She s leavin here with me tonight There s just one more thing that I need to know If this is love why does it scare me so It must be somethin only you can see Cause girl I feel it when you look at me So tonight I ll ask the stars above How did I ever win your love What did I do What did I say To turn your angel eyes my way Hey hey hey yeah awww'
71,Patience,Guns N' Roses,1989,b' One two one two three four Whistling Shed a tear cause I m missin you I m still alright to smile Girl I think bout you every day now Was a time when I wasn t sure but you set my mind at ease There is no doubt you re in my heart now Said woman take it slow and it ll work itself out fine All we need is just a little patience Said sugar make it slow and we ll come together fine All we need is just a little patience Patience hm yeah I sit here on the stairs cause I d rather be alone If I can t have you right now I ll wait dear Sometimes I get so tense but I can t speed up the time But you know love there s one more thing to consider Said woman take it slow and things will be just fine You and I ll just use a little patience Said sugar take the time cause the lights are shinin bright You and I ve got what it takes to make it We won t fake it aw I ll never break it cause I can t take it Little patience hm yeah hm yeah Need a little patience yeah Just a little patience yeah Some more patience Yeah A little patience Yeah Could use some patience Yeah Gotta have more patience Yeah All it takes is patience Just a little patience Is all you need'
72,Walk on Water,Eddie Money,1989,b'Well if I could walk on water And if I could find some way to prove If I could walk on water would you believe in me My love is so true Well I m no angel now I ll admit I made a few bad moves I should regret I hurt you once or so you said Just one more chance is all you get Didn t mean to do you wrong again Worse things have been done by better men Baby baby don t don t treat me this way I know yes I ve got to pay now I m still paying Well if I could walk on water And if I could find some way to prove If I could walk on water would you believe in me My love is true Na na na na na na na na oh All along I told you lies To err is human forgive is divine Don t be a fool don t settle the score Cause I can t take it no more I can t take it Well if I could walk on water And if I could find some way to prove If I could walk on water would you believe in me My love is true Well if I could walk on water Is that what I m gonna have to do If I could walk on water would be you believe in me My love is so true Do I have to walk walk walk on water for you Hey baby baby there s a little time Let s spend it together We ll get over what we left behind There s our future together Yeah well let s stay together I keep walking and walking and walking For you for you Well if I could walk on water And if I could find some way to prove If I could walk on water would you believe in me My love is true My love is so true Do I have to walk oh walk on water for you Baby please If I had to walk girl If I had to walk walk walk Do I have to walk on water walk on water for you Do I have to walk on water Do I have to find some way to prove Do I have to walk on water walk on water for you Do I have to walk on water Do I have to find some way to prove Yeah yeah walk on water walk on water for you '
73,Cover Girl,New Kids on the Block,1989,b'I get up in the morning and I see your face girl You re looking so good everything s in place Don t you know I could never leave your side girl Won t you stay here with me and be my bride Don t you your my kind your just what i like Girl you re everything don t you know you re alright The only girl I ve always needeed for so long Chorus Oh oh oh she s my cover girl Oh oh oh oh oh Oh oh oh she s my cover girl Oh oh oh oh oh When I look through the pages of a magazine Still your pretty face is the prettiest I ve seen Don t you know I only want to be with you No other girl could make me feel the way you do You re my everything It s alright Oh yeah it s out of sight Let me say it s alright Ah yeah Don t you know I only want to be with you No other girl could make me feel the way you do You re my everthing '
74,Welcome to the Jungle,Guns N' Roses,1989,b' Oh my god Jump Welcome to the jungle we got fun and games We got everything you want honey we know the names We are the people that can find whatever you may need If you got the money honey we got your disease In the jungle welcome to the jungle Watch it bring you to your shun n n n n n n n n knees knees Ohhh ah I wanna watch you bleed Welcome to the jungle we take it day by day If you want it you re going to bleed but it s the price you pay And you re a very sexy girl very hard to please You can taste the bright lights but you won t get there for free In the jungle welcome to the jungle Feel my my my my serpentine Ohhh ah I wanna hear you scream Welcome to the jungle it gets worse here everyday You learn to live like an animal in the jungle where we play If you got a hunger for what you see you ll take it eventually You can have anything you want but you better not take it from me In the jungle welcome to the jungle Watch it bring you to your shun n n n n n n n n knees knees Uh oh I wanna watch you bleed And when you re high you never Ever want to come down So down so down so down yeah You know where you are You re in the jungle baby You re gonna die In the jungle welcome to the jungle Watch it bring you to your shun n n n n n n n n knees knees In the jungle welcome to the jungle Feel my my my my serpentine In the jungle welcome to the jungle Watch it bring you to your shun n n n n n n n n knees knees In the jungle welcome to the jungle Watch it bring you to your it s going to bring you down huh'
75,Shower Me With Your Love,Surface,1989,b'My heart is filled with so much love And I need someone I can call my own To fall in love that s what everyone s dreaming of I hold this feeling oh so strong Life is too short to live alone Without someone to call my own I will care for you you will care for me Our love will live forever Shower me with your love Shower me with the love that I long for Shower me with your love Shower me with the love I ve been waiting for I close my eyes and pray all my wishes come true Every night I go to sleep Until you re mine I ll wait for you endlessly Can t you see Fairy tales they do sometimes come true If you believe it could happen to you Like the stars that shine way up in the sky Our love will live forever Shower me with your love Shower me with the love that I long for Shower me with your love Shower me with the love I ve been waiting for Like the stars that shine way up in the sky Our love will live forever Live forever Shower me with your love Shower me with the love that I long for Shower me with your love Shower me with the love I ve been waiting for Shower me with your love Shower me with the love I ve been waiting for'
76,Stand,R.E.M.,1989,b' Stand in the place where you live Now face north Think about direction Wonder why you haven t before Now stand in the place where you were Now face west Think about the place where you live Wonder why you haven t before If you are confused check with the sun Carry a compass to help you along Your feet are going to be on the ground Your head is there to move you around Stand in the place where you live Now face north Think about direction Wonder why you haven t before Now stand in the place where you were Now face west Think about the place where you live Wonder why you haven t before Your feet are going to be on the ground Your head is there to move you around If wishes were trees the trees would be falling Listen to reason the season is calling Stand in the place where you live Now face north Think about direction Wonder why you haven t before Now stand in the place where you were Now face west Think about the place where you live Wonder why you haven t before If wishes were trees the trees would be falling Listen to reason reason is calling Your feet are going to be on the ground Your head is there to move you around So stand Now face north Think about direction Wonder why you haven t before Now stand Now face west Think about the place where you live Wonder why you haven t Stand in the place where you live Now face north Think about direction Wonder why you haven t before Now stand in the place where you were Now face west Think about the place where you live Wonder why you haven t before Stand in the place where you are Now face north Stand in the place where you are Now face west Your feet are going to be on the ground Your head is there to move you around so stand'
77,Close My Eyes Forever,Lita Ford,1989,b' Baby I get so scared inside And I don t really understand Is it love that s on my mind Or is it fantasy Heaven is in the palm of my hand And it s waiting here for you What am I supposed to do With a childhood tragedy If I close my eyes forever Will it all remain unchanged If I close my eyes forever Will it all remain the same Sometimes it s hard to hold on So hard to hold on to my dreams It isn t always what it seems When you re face to face with me You re like a dagger You stick me in the heart And taste the blood from my blade And when we sleep Would you shelter me in Your warm and darkened grave Will you ever take me No I just can t take the pain Would you ever trust me No I ll never feel the same I know I been so hard on you I know I told you lies If I could have just one more wish I d wipe the cobwebs from my eyes Oh yeah Close your eyes Close your eyes You gotta close your eyes for me'
78,All This Time,Tiffany,1989,b'All this time I knew someday you d need to find Something that you left behind Something I can t give you All these tears And like a light Love disappears But hearts are good for souvenirs And memories are forever All this time All in all I ve no regrets The sun still shines The sun still sets The heart forgives The heart forgets But what will I do now With all this time One more kiss Even though it s come to this I ll close my eyes And make a wish Hoping you remember All this time All in all I ve no regrets The sun still shines The sun still sets The heart forgives The heart forgets But what will I do now With all this time Say goodbye Apart We ll make another try But don t be sorry If you cry I ll be crying too On this day All this time All in all I ve no regrets The sun still shines The sun still sets The heart forgives The heart forgets But what will I do now With all this time'
79,After All,Cher,1989,b' Well here we are again I guess it must be fate We ve tried it on our own But deep inside we ve known We d be back to set things straight I still remember when Your kiss was so brand new Every memory repeats Every step I take retreats Every journey always brings me back to you After all the stops and starts We keep coming back to these two hearts Two angels who ve been rescued from the fall And after all that we ve been through It all comes down to me and you I guess it s meant to be Forever you and me after all When love is truly right It lives from year to year It changes as it goes Oh and on the way it grows But it never disappears After all the stops and starts We keep comin back to these two hearts Two angels who ve been rescued from the fall After all that we ve been through It all comes down to me and you I guess it s meant to be forever you and me after all Always just beyond my touch Though I needed you so much After all what else is living for After all the stops and starts We keep coming back to these two hearts Two angels who ve been rescued from the fall And after all that we ve been through It all comes down to me and you I guess it s meant to be Forever you and me After all the stops and starts We keep coming back to these two hearts Two angels who ve been rescued from the fall And after all that we ve been through It all comes down to me and you I guess it s meant to be Forever you and me after all'
80,Roni,Bobby Brown,1989,b' The truth about a Roni she s a sweet little girl You can treat her right feel nice and hold her tight Only tenderonis can give a special love A special kind of love that makes you feel good inside If you believe in love and all that it can do for you Give it a chance girl You ll find romance And if you find a tenderoni that is right for you Make it official Give her your love My heart belongs to a Roni She s my only love My only heart baby My heart belongs to a Roni She s my only love The truth about a Roni she s always on the phone Talking to her homeboy wishing they were home alone She sends you lovely letters with the smell of sweet perfume This is what a real tenderoni likes to do for you If you believe in love and all that it can do for you Give it a chance girl You ll find romance And if you find a tenderoni that is right for you Make it official Give her your love My heart belongs to a Roni She s my only love My only heart baby My heart belongs to a Roni She s my only love The truth about Roni she s a sweet ol girl About the sweetest little girl in the whole wide world She d make the toughest homeboy fall deep in love So once you ve had a Roni you will never give her up She s a special kind of girl that makes her daddy feel proud You know the kind of girl that stands out in crowds If you found a tenderoni and a Roni is so right I think I m gonna love her for the rest of my life If you believe in love and all that it can do for you And if you find a tenderoni that is right for you Make it official Give her your love yeah My heart belongs to a Roni She s my only love My only heart My heart belongs to a Roni She s my only love The truth about Roni she s a sweet ol girl About the sweetest little girl in the whole wide world She d make the toughest homeboy fall deep in love So once you ve had a Roni you will never give her up She s a special kind of girl that makes her daddy feel proud You know the kind of girl that stands out in crowds If you found a tenderoni and a Roni is so right I think I m gonna love her for the rest of my life My only heart She s my only love The truth about Roni she s a sweet ol girl About the sweetest little girl in the whole wide world She d make the toughest homeboy fall deep in love So once you ve had a Roni you will never give her up She s a special kind of girl that makes her daddy feel proud You know the kind of girl that stands out in crowds If you found a tenderoni and a Roni is so right I think I m gonna love her for the rest of my life'
81,Love in an Elevator,Aerosmith,1989,b' 2nd floor Hardware children s wear lady s lingerie Oh good morning Mr Tyler going down Workin like a dog for the boss man Workin for the company I m bettin on the dice I m tossin I m gonna have a fantasy But where am I gonna look They tell me that love is blind I really need a girl like an open book To read between the lines Love in an elevator Livin it up when I m goin down Love in an elevator Lovin it up till I hit the ground Jackey s in the elevator Lingerie second floor She said can I see you later And love you just a little more I kinda hope we get stuck Nobody gets out alive She said I ll show you how to fax In the mailroom honey And have you home by five Love in an elevator Livin it up when I m goin down Love in an elevator Lovin it up till I hit the ground Elevator in the air Honey one more time now it ain t fair Love in an elevator Livin it up when I m goin down Love in an Elevator Going down Haha haha haha haha Love in an elevator Livin it up when I m goin down Love in an elevator Lovin it up till I hit the ground Gonna be a penthouse pauper Gonna be a millionaire Gonna be a real fast talker And have me a love affair Gotta get my timing right It s a test that I got to pass I ll chase you all the way to the stairway honey Kiss your sassafras Love in an elevator Livin it up when I m goin down Love in an elevator Lovin it up till I hit the ground Will you care will you care Honey one more time now it ain t fair Love in an elevator Livin it up when I m goin down Will you care will you care Honey one more time now it ain t fair Love in an elevator Lovin it up till I hit the ground In the air in the air Honey one one one one one one one Love in an elevator Livin it up when I m goin down In the air in the air Honey one one one one one one one Love in an elevator Livin it up when I m goin down In the air in the air Honey one one one one one one one Love in an elevator Love in an elevator Livin it up when I m goin down In the air in the air In the air in the air Love in an elevator Livin it up when I m goin down'
82,Lay Your Hands on Me,Bon Jovi,1989,b' If you re ready I m willing and able Help me lay my cards out on the table You re mine and I m yours for the taking Right now the rules we made are meant for breaking What you get ain t always what you see But satisfaction s guaranteed They say what you give is always what you need So if you want me to lay my hands on you Lay your hands on me I m a fighter I m a poet I m a preacher I ve been to school and baby I ve been the teacher If you show me how to get up off the ground I can show you how to fly and never ever come back down Everything you want is what I need Satisfaction s guaranteed But the ride don t never ever come for free If you want me to lay my hands on you Don t you know I only aim to please If you want me to lay my hands on you Lay your hands on me'
83,The Promise,When in Rome,1989,b' If you need a friend Don t look to a stranger You know in the end I ll always be there But when you re in doubt And when you re in danger Take a look all around and I ll be there I m sorry but I m just thinking of the right words to say I know they don t sound the way I planned them to be But if you wait around a while I ll make you fall for me I promise I promise you I will When your day is through And so is your temper You know what to do I m gonna always be there Sometimes if I shout It s not what s intended These words just come out With no cross to bear I m sorry but I m just thinking of the right words to say I know they don t sound the way I planned them to be But if you wait around a while I ll make you fall for me I promise I promise you I will I m sorry but I m just thinking of the right words to say I know they don t sound the way I planned them to be And if I had to walk the world I d make you fall for me I promise you I promise you I will I gotta tell you Need to tell you Gotta tell you I ve gotta tell you I m sorry but I m just thinking of the right words to say I know they don t sound the way I planned them to be But if you wait around a while I ll make you fall for me I promise I promise you I m sorry but I m just thinking of the right words to say I know they don t sound the way I planned them to be And if I had to walk the world I d make you fall for me I promise you I promise you I will I will I will'
84,What I Am,Edie Brickell,1989,b' I m not aware of too many things I know what I know if you know what I mean Philosophy is the talk on a cereal box Religion is the smile on a dog I m not aware of too many things I know what I know if you know what I mean Choke me in the shallow water Before I get too deep What I am is what I am Are you what you are or what I m not aware of too many things I know what I know if you know what I mean Philosophy is a walk on the slippery rocks Religion is a light in the fog I m not aware of too many things I know what I know if you know what I mean Choke me in the shallow water Before I get too deep What I am is what I am Are you what you are or what Choke me in the shallow water Before I get too deep Choke me in the shallow water Before I get too deep Don t let me get too deep What I am is what I am Are you what you are or what '
