Rank,Song,Artist,Year,Lyrics
1,Look Away,Chicago,1989,b' When you called me up this morning Told me about the new love you found I said I m happy for you I m really happy for you Found someone else I guess I won t be coming around I guess it s over baby It s really over baby whoa And from what you said I know you ve gotten over me It ll never be the way it used to be So if it s got to be this way Don t worry baby I can take the news okay But if you see me walking by And the tears are in my eyes Look away baby look away If we meet on the streets someday And I don t know what to say Look away baby look away Don t look at me I don t want you to see me this way When we both agreed as lovers We were better off as friends That s how it had to be Yeah that s how it had to be I tell you I m fine But sometimes I just pretend Wish you were holding me Wish you were still holding me whoa I just never thought That I would be replaced so soon I wasn t prepared to hear those words from you I know I wanted to be free Yeah baby this is how we wanted it to be When you called me up this morning Told me about the new love you found I said I m happy for you I m really happy for you '
2,My Prerogative,Bobby Brown,1989,b'Get busy Everybody s talking all this stuff about me Why don t they just let me live I don t need permission Make my own decisions That s my prerogative They say I m crazy I really don t care That s my prerogative They say I m nasty but I don t give a damn Getting girls is how I live Some ask me questions Why am I so real But they don t understand me or really don t know the deal About a brother trying hard to make it right Not long ago before I win this fight Everybody s talking all this stuff about me Why don t they just let me live I don t need permission Make my own decisions That s my prerogative It s the way that I wanna live I can do just what I feel No one can tell me what to do Cause what I m doing I m doing for you now Don t get me wrong I m really not souped Ego trips is not my thing All these strange relationships really gets me down I see nothing wrong with spreading myself around Everybody s talking all this stuff about me Why don t they just let me live I don t need permission Make my own decisions That s my prerogative It s my prerogative I can do what I wanna do Can live my life I m doing it just for you Tell me tell me why can t I live my life Without all of the things that people say Yo Teddy kick it like this Oh no no I can do what I wanna do Me and you Together together together together together Everybody s talking all this stuff about me Why don t they just let me live I don t need permission Make my own decisions That s my prerogative Everybody s talking all this stuff about me Why don t they just let me live I don t need permission Make my own decisions That s my prerogative What is this a blizzard that I can t have money in my pocket And people not talk about me This world is a trip I don t know what s going on these days Got this person over here talking about me this person Ay listen let me tell you something it s my prerogative I can do what I wanna do I made this money you didn t right Ted We outta here It s my it s my it s my it s my It s my my my my my my my my my my my my my It s my WOO It s my prerogative it s my It s my it s my my my It s my prerogative can t you see baby doll Ha why you wanna talk about me Tell me tell me why '
3,Every Rose Has Its Thorn,Poison,1989,b' We both lie silently still in the dead of the night Although we both lie close together we feel miles apart inside Was it something I said or something I did Did my words not come out right Though I tried not to hurt you Though I tried But I guess that s why they say Every rose has its thorn Just like every night has its dawn Just like every cowboy sings a sad sad song Every rose has its thorn Yeah it does I listen to our favorite song playing on the radio Hear the DJ say love s a game of easy come and easy go But I wonder does he know Has he ever felt like this And I know that you d be here right now If I could have let you know somehow I guess Every rose has its thorn Just like every night has its dawn Just like every cowboy sings a sad sad song Every rose has its thorn Though it s been a while now I can still feel so much pain Like a knife that cuts you the wound heals But the scar that scar remains I know I could have saved a love that night If I d known what to say Instead of makin love We both made our separate ways And now I hear you found somebody new And that I never meant that much to you To hear that tears me up inside And to see you cuts me like a knife I guess Every rose has its thorn Just like every night has its dawn Just like every cowboy sings a sad sad song Every rose has its thorn'
4,Straight Up,Paula Abdul,1989,b' Lost in a dream I don t know which way to go If you are all that you seem Then baby I m movin way too slow I ve been a fool before Wouldn t like to get my love caught in the slammin door How about some information please Straight up now tell me Do you really wanna love me forever Or am I caught in a hit and run Straight up now tell me Is it gonna be you and me together Or are you just havin fun Time s standing still Waiting for some small clue I keep getting chills When I think your love is true I ve been a fool before Wouldn t like to get my love caught in the slammin door How about some information please Straight up now tell me Do you really wanna love me forever Or am I caught in a hit and run Straight up now tell me Is it gonna be you and me together Or are you just havin fun You are so hard to read You play hide and seek With your true intentions If you re only playin games I ll just have to say Abb b b bye b b b bye Do do you love me Do do you love me Do do you love me C mon now do do you love me Ah tell me baby I ve been a fool before Wouldn t like to get my love caught in the slammin door Are you more than hot for me Or am I a page in your history book I don t mean to make demands But the word and the deed go hand in hand How about some information please Straight up now tell me Straight up now tell me Straight up now tell me Straight up now tell me Straight up now tell me Straight up now tell me Do you really wanna love me forever Or am I caught in a hit and run Straight up now tell me Is it gonna be you and me together Or are you just havin fun Straight up now tell me Do you really wanna love me forever Or am I caught in a hit and run Now tell me Is it gonna be you and me together Or are you just havin fun '
5,Miss You Much,Janet Jackson,1989,b' Shot like an arrow going through my heart That s the pain I feel I feel whenever we re apart Not to say that I m in love with you But who s to say that I m not I just know that it feels wrong When I m away too long It makes my body hot So let me tell ya baby I ll tell your mama I ll tell your friends I ll tell anyone whose heart can comprehend Send it in a letter baby Tell you on the phone I m not the kinda girl Who likes to be alone I miss ya much Boy oh I miss you much I really miss you much M I S S you much I miss ya much Boy oh I miss you much Baby I really miss you much M I S S you much I m rushing home Just as soon as I can I m rushing home to see Your smiling face And feel your warm embrace It makes f feel so g g g good So I ll tell you baby I ll tell your mama I ll tell your friends I ll tell anyone whose heart can comprehend Send it in a letter baby Tell you on the phone I m not the kinda girl Who likes to be alone I miss ya much Boy oh I miss you much I really miss you much M I S S you much I miss ya much Boy oh I miss you much Baby I really miss you much M I S S you much I miss ya much Boy oh I miss you much I really miss you much M I S S you much I miss ya much Boy oh I miss you much Baby I really miss you much M I S S you much Miss you much I miss you much I really really miss you much Miss you much I miss you much I m not ashamed to tell the world I miss you I ll tell your mama I ll tell your friends I ll tell anyone whose heart can comprehend Send it in a letter baby Tell you on the phone I m not the kinda girl Who likes to be alone I miss ya much Boy oh I miss you much I really miss you much M I S S you much I miss ya much Boy oh I miss you much Baby I really miss you much M I S S you much I miss ya much Boy oh I miss you much I really miss you much M I S S you much I miss ya much Boy oh I miss you much Baby I really miss you much M I S S you much That s the end '
6,Cold Hearted,Paula Abdul,1989,b' He s a cold hearted snake Look into his eyes uh oh He s been tellin lies He s a lover boy at play He don t play by rules uh oh Girl don t play the fool no You re the one givin up the love Anytime he needs it But you turn your back and then he s off and runnin with the crowd You re the one to sacrifice Anything to please him Do you really think he thinks about you when he s out He s a cold hearted snake Look into his eyes uh oh He s been tellin lies He s a lover boy at play He don t play by rules uh oh Girl don t play the fool no It was only late last night He was out there sneakin Then he called you up to check that you were waiting by the phone All the world s a candy store He s been trick or treatin When it comes to true love girl with him there s no one home He s a cold hearted snake Look into his eyes uh oh He s been tellin lies He s a lover boy at play He don t play by rules uh oh Girl don t play the fool no You could find somebody better girl He could only make you cry You deserve somebody better girl He s c cold as ice He s cold as ice He s cold as ice Stay away from him girl C c c cold hearted ooh ah ah C c c cold hearted snnnnnake C c c cold hearted ooh ah ah C c c cold hearted snnnnnake He s a cold hearted snake Look into his eyes uh oh He s been tellin lies He s a lover boy at play He don t play by the rules uh oh Girl don t play the fool Ooh ahh look into his eyes Ooh ahh he s been tellin lies Ooh ahh he don t play by rules Ooh ahh girl don t play the fool He s a cold hearted snake Look into his eyes uh oh He s been tellin lies He s a lover boy at play He don t play by the rules uh oh Girl don t play the fool He s a cold hearted snake Look into his eyes uh oh He s been tellin lies'
7,Wind Beneath My Wings,Bette Midler,1989,b' Oh oh oh oh It must have been cold there in my shadow To never have sunlight on your face You were content to let me shine that s your way You always walked a step behind So I was the one with all the glory While you were the one with all the strength A beautiful face without a name for so long A beautiful smile to hide the pain Did you ever know that you re my hero And everything I would like to be I can fly higher than an eagle For you are the wind beneath my wings It might have appeared to go unnoticed But I ve got it all here in my heart I want you to know I know the truth of course I know it I would be nothing without you Did you ever know that you re my hero You re everything I wish I could be I could fly higher than an eagle For you are the wind beneath my wings Did I ever tell you you re my hero You re everything everything I wish I could be Oh and I I could fly higher than an eagle For you are the wind beneath my wings Cause you are the wind beneath my wings Oh the wind beneath my wings You you you you are the wind beneath my wings Fly fly fly away you let me fly so high Oh you you you the wind beneath my wings Oh you you you the wind beneath my wings Fly fly so high against the sky So high I almost touch the sky Thank you thank you Thank God for you the wind beneath my wings'
8,Girl You Know It's True,Milli Vanilli,1989,b' I m in love with you girl cause you re on my mind You re the one I think about most every time And when you crack a smile in everything you do Don t you understand girl this love is true You re soft silky hand long sweet and thin That candlelight complexion upon your skin It lightens up my day and that s oh so true Together we re one separated we re two To make you all mine all mine is my desire Cause you contain a quality that I admire You re pretty plain and simple you rule my world so try to understand I m in love girl I m in so love girl I m just in love girl and this is true Girl you know it s true Ooh Ooh Ooh I love you Yes you know it s true Ooh Ooh Ooh I love you Girl you know it s true My love is for you This is some sort of thing girl I can t explain My emotions starts up when I hear your name Maybe your sweet sweet voice would ring in my ear Then delay my system when you are near Come with your positive emotion love making enjoyin That s for me to bust it s like a girl and a boy These feelings I get I often wonder why So I thought I might discuss this girl just you and I Now what you re wearing I don t care as I ve said before No reason that I like you girl just for what you are If I said I d think about it you rule my world so try to understand I m in love girl I m in so love girl I m just in love girl and this is true'
9,Baby I Love Your Way/Freebird Medley,Will to Power,1989,b'Shadows grow so long before my eyes And they re moving across the page Suddenly the day turns into night Far away from the city But don t hesitate Cause your love Your love won t wait oh no no Baby I love your way every day Wanna tell you I love your way every day Wanna be with you night and day Hey I love your way If I leave here tomorrow Would you still remember me For I must be traveling on now There s so many places I ve gotta see But if I stayed here with you girl Things just wouldn t be the same Cause I m as free as a bird now And this bird will never change And this bird will never change Shadows grow so long before my eyes With the help of some fireflies I wonder how they have the power to shine I can see them under the pines But don t hesitate Cause your love Your love won t wait Ooh baby I love your way Wanna tell you I love your way Oh baby I love your way Every day now Ooh wanna tell you I love your way I love your way Ooh baby I love your way Give me you way Wanna tell you I love your way Ooh baby I love your ways Ooh baby I love your way Ooh wanna tell you I love your way Ooh baby I love your way Ooh wanna tell you I love your way Ooh baby I love your way '
10,Giving You the Best That I Got,Anita Baker,1989,b' Ain t there something I can give you In exchange for everything you give to me Read my mind And make me feel just fine When I think my peace of mind is out of reach The scales are sometimes unbalanced And you bear the weight of all that has to be I hope you see that you can lean on me And together We can calm a stormy sea We love so strong and so unselfishly And I tell you now that I made a vow I m giving you the best that I got baby Yes I tell you now That I made a vow I m giving you the best that I got honey Everybody s got opinions Bout the way they think our story s gonna end Some folks feel it s just a superficial thrill Everybody s gonna have to think again We love so strong and so unselfishly They don t bother me so I m gonna keep on Giving you the best that I got baby They don t bother me Said I m gonna keep on Giving you the best that I got Listen baby Somebody understands me Somebody gave his heart to me I stumbled my whole life long Always on my own Now I m home My weary mind is rested And I feel as if my home is in your arms Fears are all gone I like the sound of your song And I think I want to sing it forever We love so strong and so unselfishly And I made a vow so I tell you now I m giving you the best that I got Listen baby I bet everything on my wedding ring I m giving you the best that I got Giving it to you baby Giving you the best that I got'
11,Right Here Waiting,Richard Marx,1989,b' Oceans apart day after day And I slowly go insane I hear your voice on the line But it doesn t stop the pain If I see you next to never How can we say forever Wherever you go whatever you do I will be right here waiting for you Whatever it takes or how my heart breaks I will be right here waiting for you I took for granted all the times That I thought would last somehow I hear the laughter I taste the tears But I can t get near you now Oh can t you see it baby You ve got me going crazy Wherever you go whatever you do I will be right here waiting for you Whatever it takes or how my heart breaks I will be right here waiting for you I wonder how we can survive This romance But in the end if I m with you I ll take the chance Oh can t you see it baby You ve got me going crazy Wherever you go whatever you do I will be right here waiting for you Whatever it takes or how my heart breaks I will be right here waiting for you Waiting for you'
12,Waiting For a Star to Fall,Boy Meets Girl,1989,b' I hear your name whispered on the wind It s a sound that makes me cry I hear a song blow again and again Through my mind and I don t know why I wish I didn t feel so strong about you Like happiness and love revolve around you Trying to catch your heart Is like trying to catch a star So many people love you baby That must be what you are Waiting for a star to fall And carry your heart into my arms That s where you belong In my arms Baby yeah Waiting for a star to fall And carry your heart into my arms That s where you belong In my arms Baby yeah I ve learn to feel what I cannot see But with you I lose that vision I don t know how to dream your dream So I m all caught up in the superstition I want to reach out and pull you to me Who says I should let a wild one go free Trying to catch your heart Is like trying to catch a star But I can t love you this much baby And love you from this far Waiting for a star to fall And carry your heart into my arms That s where you belong In my arms Baby yeah Waiting for a star to fall And carry your heart into my arms That s where you belong In my arms Baby yeah Waiting I don t like waiting It s so hard waiting Seems like waiting Makes me love you even more Waiting for a star to fall And carry your heart into my arms That s where you belong In my arms Baby yeah Waiting for a star to fall And carry your heart into my arms That s where you belong In my arms Baby yeah'
13,Lost in Your Eyes,Debbie Gibson,1989,b' I get lost in your eyes And I feel my spirits rise And soar like the wind Is it love that I am in I get weak in a glance Isn t this what s called romance And now I know Cause when I m lost I can let go I don t mind not knowing What I m heading for You can take me to the skies It s like being lost in heaven When I m lost in your eyes I just fell Don t know why Something s there we can t deny And when I first knew Was when I first looked at you And if I can t find my way If salvation is worlds away Oh I ll be found When I am lost in your eyes I don t mind not knowing What I m heading for You can take me to the skies It s like being lost in heaven When I m lost in your eyes I don t mind not knowing What I m heading for You can take me to the skies Oh it s like being lost in heaven When I m lost in your eyes I get weak in a glance Isn t this what s called romance Oh I ll be found When I am lost in your eyes'
14,Don't Wanna Lose You,Gloria Estefan,1989,b' Sometimes it s hard to make things clear I know when to face the truth And I know when the moment is here I ll open my heart and show you inside My love has no pride I feel with you I ve got nothing to hide So open your eyes and see who I am And not who you want for me to be I am only myself myself I don t wanna lose you now We re gonna get through somehow I don t wanna lose you now forever Baby I finally found the courage To stand my ground But if you want me I ll be around forever We all make mistakes We all lose our way But we stood the test of time And I hope that s the way it will stay It s all up to you to tell me to go Cause it won t be me to walk away When you re all that I know And I know that I don t wanna lose you Lose you now We re gonna get through somehow I don t wanna lose you now I don t wanna lose you I don t wanna lose you'
15,Heaven,Warrant,1989,b'I ve got a picture of your house And you re standing by the door It s black and white and faded And it s looking pretty worn See the factory that I worked Silhouetted in the back The memories are gray But man they re really coming back I don t need to be the king of the world As long as I m the hero of this little girl Heaven isn t too far away Closer to it every day No matter what your friends might say We ll find a way How I love the way you move And the sparkle in your eyes There s a color deep inside them Like a blue surburban sky When I come home late at night And you re in bed asleep I wrap my arms around you So I can feel you breathe I don t need to be a superman ah ah As long as you will always be my biggest fan Heaven isn t too far away Closer to it every day No matter what your friends might say We ll find a way Now the lights are going out Along the boulevard The memories come rushing back And it makes it pretty hard I ve got nowhere left to go And no one really cares I don t know what to do But I m never giving up on you Heaven isn t too far away Closer to it every day No matter what your friends might say Yeah we re gonna find a way Heaven Whoa oh oh oh oh Heaven Whoa oh oh oh oh oh Heaven It s not too far away Eh yeah It s not too far away It s not too far away It s not too far away It s not too far away It s not too far away'
16,Girl I'm Gonna Miss You,Milli Vanilli,1989,b'I knew it from the start You would break my heart But you still I had to play this painful part You wrapped me round your itty bitty finger With your magic smile You kept me hangin on a lover s cross a while You put your spell on me Took my breath away But there was nothin I could do to make you stay I m gonna miss you All the love I feel for you Nothing could make me change my point of view Oh girl I m gonna miss you baby Giving all the love I feel for you Couldn t make you change your point of view You re leavin Now I m sittin here wasting my time I just don t know what I should do It s a tragedy for me To see the dream is over And I never will forget the day we met Girl I m gonna miss you Like a honey bee You took the best of me Now I can t erase those memories Like a fairy tale You are so unreal You left a scar that s so hard to heal When you had a taste of paradise Back on Earth can feel as cold as ice I m gonna miss you I m gonna miss you I miss you Giving all the love I feel for you Couldn t make you change your point of view You re leavin Now I m sittin here wasting my time I just don t know what I should do It s a tragedy for me To see the dream is over And I never will forget the day we met Girl I m gonna miss you It s a tragedy for me To see the dream is over And I never will forget the day we met Girl I m gonna miss you Giving all the love I feel for you Couldn t make you change your point of view You re leavin Now I m sittin here wasting my time I just don t know what I should do It s a tragedy for me To see the dream is over And I never will forget the day we met Girl I m gonna miss you It s a tragedy for me To see the dream is over And I never will forget the day we met Girl I m gonna miss you'
17,The Look,Roxette,1989,b'1 2 3 4 Walkin like a man Hitting like a hammer She s a juvenile scam Never was a quitter Tasted like a raindrop She s got the look Heavenly ah bound Cause heaven s got her number When she s spinnin me around Kissin is a color Her lovin is a wild dog She s got the look She s got the look She s got the look What in the world can make a Brown eyed girl turn blue When everything I ll ever do I ll do for you And I go la la la la la She s got the look Fire in the eyes Naked to the T bone Is a lover s disguise Bangin on the head drum Shakin like a mad bull She s got the look Swayin to the band Movin like a hammer She s a miracle man Lovin is the ocean And kissin is the wet sand She s got the look She s got the look She s got the look What in the world can make a Brown eyed girl turn blue When everything I ll ever do I ll do for you And I go la la la la la She s got the look Ow Walkin like a man Hitting like a hammer She s a juvenile scam Never was a quitter Tasted like a raindrop She s got the look And she goes A na na na na na Na na na na na Na na na na na na Na na na na na Na na na na na na na na She s got the look She s got the look She s got the look What in the world can make a Brown eyed girl turn blue When everything I ll ever do I ll do for you And I go la la la la la She s got the look What in the world Can make you so blue When everything I ll ever do I ll do for you And I go la la la la la Na na na na na Na na na na na Na na na na na na Na na na na na Na na na na na na na na She s got the look She goes Na na na na na Na na na na na Na na na na na na Na na na na na Na na na na na na na na She s got the look She s got the look She goes Na na na na na Na na na na na Na na na na na na Na na na na na Na na na na na na na na She s got the look She s got the look She goes Na na na na na Na na na na na Na na na na na na Na na na na na Na na na na na na na na'
18,She Drives Me Crazy,Fine Young Cannibals,1989,b' I can t stop the way I feel Things you do don t seem real Tell me what you ve got in mind Cause we re running out of time Won t you ever set me free This waiting round s killing me She drives me crazy Like no one else She drives me crazy And I can t help myself I can t get any rest People say I m obsessed Everything you say is lies But to me there s no surprise What I had for you was true Things go wrong they always do She drives me crazy Like no one else She drives me crazy And I can t help myself I won t make it on my own No one likes to be alone She drives me crazy Like no one else She drives me crazy And I can t help myself She drives me crazy Like no one else She drives me crazy And I can t help myself She drives me crazy Like no one else She drives me crazy And I can t help myself'
