Rank,Song,Artist,Year,Lyrics
64,Hey Mr. D.J.,Zhané,1993,b' What we re gonna do now is go back Everybody move your body now do it Here is something that s gonna make you move and groove Hey D J keep playing that song all night On and on and on Everybody move your body now do it Here is something that s gonna make you move and groove Hey D J keep playing that song all night On and on and on It s Friday night and the weekend s here I need to unwind where s the party Mr D J I am ready to call my friends So we could all get down Where s the party hey Mr D J Hey Mr D J Everybody s ready to party All the girls are ready So we can party till the break of dawn oh Everybody move your body now do it Here is something that s gonna make you move and groove Hey D J keep playing that song all night On and on and on Everybody move your body now do it Here is something that s gonna make you move and groove Hey D J keep playing that song all night On and on and on It s Friday night and the weekend s here I need to unwind where s the party Mr D J I am ready to call my friends So we could all get down Where s the party hey Mr D J Hey Mr D J Everybody s ready to party All the girls are ready So we can party till the break of dawn oh Once again it s on yo Zhan blow the horn Let the D J know to keep playing your song Maybe I ll browse snatch up the blouse Rip the foul ho And get rub a dub style Cause your body won t move If it can t feel the groove So can t boogie have to show and prove Hey now I m feeling the vibe Rolling with the flavor Feeling alright Ho yo there s a party over here Yo oh no the party s over there Call up your friends let em know Fam s tagging along Hey D J keep playing that song Everybody move your body now do it Here is something that s gonna make you move and groove Hey D J keep playing that song all night On and on and on Everybody move your body now do it Here is something that s gonna make you move and groove Hey D J keep playing that song all night On and on and on '
65,Insane in the Brain,Cypress Hill,1993,b' Who you trying to get crazy with se Don t you know I m loco To the one on the flamboyant tempa Just toss that ham in the frying pan Like spam get done when I come and slam Damn I feel like the Son of Sam Don t make me wreck shit hectic Next get the chair got me going like General Electric Aaaant the lights are blinking I m thinking It s all over when I go out drinking Ohh making my mind slow That s why I don t fuck with the big 4 O Bro I got to maintain Cause a nigga like me is going insane Insane in the membrane Insane in the brain Insane in the membrane Insane in the brain Insane in the membrane Crazy insane got no brain Insane in the membrane Insane in the brain Do my shit undercover now it s time for the blubba Blabber to watch that belly get fatter Fat boy on a diet don t try it I ll jack yo ass like a looter in a riot My shit s fat like a sumo slamming dat ass Leavin your face in the grass Cause you know I don t take a duro lightly Punks just jealous cause they can t outwrite me Or kick that style wicked wild Happy face nigga never seen me smile Rip that mainframe I ll explain A nigga like me is going insane Insane in the membrane Insane in the brain Insane in the membrane Insane in the brain Insane in the membrane Crazy insane got no brain Insane in the membrane Insane in the brain Like Louie Armstrong played the trumpet I ll hit that bong and break you off something Soon I got to get my props Cops come and try to snatch my crops These pigs wanna blow my house down Head underground to the next town They get mad when they come to raid my pad And I m out in the nine deuce Cad Yes I m the pirate pilot Of this ship if I get with the ultraviolet dream Hide from the red light beam Now do you believe in the unseen Look but don t make you eyes strain A nigga like me is going insane Insane in the membrane Insane in the brain Insane in the membrane Insane in the brain Insane in the membrane Crazy insane got no brain Insane in the membrane Insane in the brain '
66,Deeper and Deeper,Madonna,1993,b' Deeper and deeper and deeper and deeper Sweeter and sweeter and sweeter and sweeter I can t help falling in love I fall deeper and deeper the further I go Kisses sent from heaven above They get sweeter and sweeter the more that I know When you know the notes to sing You can sing most anything That s what my mama told me Round and round and round you go When you find love you ll always know I let my father mold me Daddy couldn t be all wrong Not gonna let you slip away I m gonna be there And my mama made me learn this song You re gonna bring your love to me I m gonna get you That s why I can t help falling in love I fall deeper and deeper the further I go Kisses sent from heaven above They get sweeter and sweeter the more that I know The deeper I go All is fair in love she said Think with your heart not with your head That s what my mama told me All the little things you do Will end up coming back to you I let my father mold me Daddy couldn t be all wrong Not gonna let you slip away I m gonna be there And my mama made me learn this song You re gonna bring your love to me I m gonna get you That s why I can t help falling in love I fall deeper and deeper the further I go Kisses sent from heaven above They get sweeter and sweeter the more that I know I can t help falling in love I fall deeper and deeper the further I go Kisses sent from heaven above They get sweeter and sweeter the more that I know Someone said that romance was dead And I believed it instead of remembering What my mama told me Let my father mold me Then you tried to hold me You remind me what they said This feeling inside I can t explain But my love is alive And I m never gonna hide it again Daddy couldn t be all wrong Not gonna let you slip away I m gonna be there And my mama made me learn this song You re gonna bring your love to me I m gonna get you That s why I can t help falling in love I fall deeper and deeper the further I go Kisses sent from heaven above They get sweeter and sweeter the more that I know Deeper and deeper and deeper and deeper Never gonna hide it again Sweeter and sweeter and sweeter and sweeter Never gonna have to pretend Deeper and deeper and deeper and deeper Never gonna hide it again Sweeter and sweeter and sweeter and sweeter Never gonna have to pretend You got to just let your body move to the music You got to just let your body go with the flow Falling in love falling in love falling in love I can t keep from falling in love with you You know there s nothing better that I d like to do'
67,Rain,Madonna,1993,b' I feel it it s coming Rain feel it on my finger tips Hear it on my window pane Your love s coming down like Rain wash away my sorrow Take away my pain Your love s coming down like rain When your lips are burning mine And you take the time to tell me how you feel When you listen to my words And I know you ve heard I know it s real Rain is what the thunder brings For the first time I can hear my heart sing Call me a fool but I know I m not I m gonna stand out here on the mountain top Till I feel your Rain feel it on my finger tips Hear it on my window pane Your love s coming down like Rain wash away my sorrow Take away my pain Your love s coming down like rain When you looked into my eyes And you said goodbye could you see my tears When I turned the other way Did you hear me say I d wait for all the dark clouds bursting in a perfect sky You promised me when you said goodbye That you d return when the storm was done And now I ll wait for the light I ll wait for the sun Till I feel your Rain feel it on my finger tips Hear it on my window pane Your love s coming down like Rain wash away my sorrow Take away my pain Your love s coming down like rain Here comes the sun here comes the sun And I say never go away Waiting is the hardest thing It s strange I tell myself that if I believe in you I feel like I ve known you before In the dream of you And I want to understand you With all my heart and all my soul More and more and more That by sheer force of will When I m with you I will raise you from the ground I feel like a magical child And without a sound you ll appear Everything strange And surrender to me to love Everything wild Rain is what the thunder brings For the first time I can hear my heart sing Call me a fool but I know I m not I m gonna stand out here on the mountain top Till I feel your Rain I feel it It s coming Your love s coming down like Rain I feel it It s coming Your love s coming down like Rain feel it on my finger tips Hear it on my window pane Your love s coming down like Rain wash away my sorrow Take away my pain Your love s coming down like rain Rain I feel it It s coming Your love s coming down like Rain I feel it It s coming Your love s coming down like Rain I ll stand out on the mountain top Until I hear you call My name Rain'
68,The Right Kind of Love,Jeremy Jordan,1993,b' It s the right kind of love It s the right kind of night You re the right kind of girl Ooh Oh yeah Hey hey Ooh It s the right kind of love Kind of love Daydreaming about you baby And it must be love Girl you make my heart go crazy High as the heavens above Oh yeah I hope you re thinking about me girl Because all of my thoughts are with you My love There s no reason to doubt me Believe me it s true Girl I know that I can give you The right kind of love It s the right kind of night You re the right kind of girl And we re right on time Oh now baby You know we can t go wrong no Why you trying to hold back baby Tell me what you feel yeah If you re having mixed emotions I ll show you that I m for real What can I do to make you see There s nobody but you And girl It s not magic or fantasy It s simple and true I know that I can give you The right kind of love It s the right kind of night You re the right kind of girl I m the right kind of guy It s the right kind of love On the right kind of night There s the right kind of stars In the right kind of sky Oh now baby You know we can t go wrong Girl I got a heart that s true I got the right kind of love I m gonna give it to you And you got me romantic Can t you see I m the guy for you And you re the girl for me I got a heart that s true And a soul that s deep I ll be the right kind of lover Baby can t you see I m gonna treat you The right kind of way You know it So come on girl Stay Kind of love Kind of night You re the right kind of girl And we re right on time It s the right kind of love On the right kind of night There s the right kind of stars Ooh I could do with a girl like you I could do with a girl like you I could do with a girl like you See what I can do with a girl like you Yeah It s you and me together It s the right kind of love Right kind of stars'
69,Bad Boys (theme from Cops),Inner Circle,1993,b'Huh Bad boys What cha want What cha want What cha gonna do When Sheriff John Brown come for you Tell me what cha ya wanna do what cha gonna do Yeah Bad boys bad boys What cha gonna do What cha gonna do when they come for you Bad boys bad boys What cha gonna do What cha gonna do when they come for you When you were eight and had bad traits You go to school and learn the golden rule So why are you acting like a bloody fool If you get hot then you must get cool Bad boys bad boys What cha gonna do What cha gonna do when they come for you Bad boys bad boys What cha gonna do What cha gonna do when they come for you You chuck it on that one ya chuck it on this one You chuck it on ya mother and ya chuck it on ya father You chuck it on ya brother and ya chuck it on ya sister And you chuck it on that one and ya chuck it on me Bad boys bad boys What cha gonna do What cha gonna do when they come for you Bad boys bad boys What cha gonna do What cha gonna do when they come for you Bad boys bad boys What cha gonna do What cha gonna do when they come for you Bad boys bad boys What cha gonna do What cha gonna do when they come for you Nobody naw give you no break Police naw give you no break Soldier naw give you no break Not even you idren naw give you no break Hey Bad boys bad boys What cha gonna do What cha gonna do when they come for you Bad boys bad boys What cha gonna do What cha gonna do when they come for you Why did you have to act so mean Don t you know you re human being Born from a mother with the love from a father Reflections come and reflections go I know sometimes you want to let go Hehehe I know sometimes you want to let go Bad boys bad boys What cha gonna do What cha gonna do when they come for you Bad boys bad boys What cha gonna do What cha gonna do when they come for you Bad boys bad boys What cha gonna do What cha gonna do when they come for you Bad boys bad boys What cha gonna do What cha gonna do when they come for you Bad boys bad boys What cha gonna do What cha gonna do when they come for you Bad boys bad boys What cha gonna do What cha gonna do when they come for you Bad boys bad boys What cha gonna do What cha gonna do when they come for you Bad boys bad boys What cha gonna do What cha gonna do when they come for you You chuck it on that one ya chuck it on this one You chuck it on ya mother and ya chuck it on ya father You chuck it on ya brother and ya chuck it on ya sister And you chuck it on that one and ya chuck it on me Bad boys bad boys What cha gonna do What cha gonna do when they come for you Bad boys bad boys What cha gonna do What cha gonna do when they come for you Bad boys bad boys What cha gonna do What cha gonna do when they come for you Bad boys bad boys What cha gonna do What cha gonna do when they come for you '
70,That's What Love Can Do,Boy Krazy,1993,b'That s what love can do I don t wanna break your heart in two And leave you crying That s what love can do oh no I want you to know I m letting you go You re just a fool You say that I m number one And you ll always be true How can this be You say you ve fallen in love You don t know what it means But look around and you will see Broken promises and jealousy Is that what you should want for us to be One time lover turned enemy But that s what love can do I don t wanna break your heart in two And leave you crying That s what love can do oh no I want you to know I m letting you go All I can say is that I m looking no further ahead than today Too young for this game On the road to forever we don t know the way So just forget about eternity All the promises we just can t keep Look down any street that s what you ll see I don t wanna bring you to your knees But that s what love can do I don t wanna break your heart in two And leave you crying That s what love can do oh no I want you to know I m letting you go That s what love can do I don t wanna break your heart in two And leave you crying That s what love can do oh no I want you to know I m letting you go'
71,Do You Believe in Us,Jon Secada,1993,b'I tremble inside Just thinking About the world around us Scared can t help to wonder Bout the way we feel Do you know what I mean Say it s gonna be alright It s gonna be alright I know that we belong Do you believe in us Just give it half a chance Yes our love Will still be strong Girl I believe in us I ll give you all I can Time has redefined the meaning Love the way we know it Love the way we show it When it comes to you I like us the way it is Say it s gonna be alright It s gonna be alright I know that we belong Do you believe in us Just give it half a chance Yes our love will still be strong Girl I believe in us I ll give you all I can I don t want any changes Unless you want them to Forever ain t long enough baby Say it s gonna be alright It s gonna be alright I know that we belong Do you believe in us Just give it half a chance Yes our love will still be strong Girl I believe in us I ll give you all I can I know that we belong Do you believe in us Just give it half a chance Yes our love will still be strong Girl I believe in us I ll give you all I can I know that we belong Do you believe in us Just give it half a chance Yes our love will still be strong Girl I believe in us I ll give you all I can '
72,Angel,Jon Secada,1993,b'I I can t read the future But I still wanna hold you close Right now I need that from you So give me the morning Sharing another day with you Is all I want to know And baby I I ve tried to forget you But the light of your eyes Still shines you shine like an angel A spirit that won t let me go And I I didn t wanna tell you Things I didn t wanna know myself I was afraid to show But you you gave me a reason A reason to face the truth oh yes you did To face the truth face the truth Face the truth And baby I I ve tried to forget you But the light of your eyes Still shines you shine like an angel A spirit that won t let me go Won t let me go let go of my heart'
73,Forever in Love,Kenny G,1993,b''
74,Again,Janet Jackson,1993,b' There are times when I look above and beyond There are times when I feel your love around me baby I ll never forget my baby I ll never forget you There are times when I look above and beyond There are times when I feel your love around me baby I ll never forget my baby When I feel that I don t belong Draw my strength from the words when you said Hey it s about you baby Look deeper inside you baby Dream about us together again What I want us together again baby I know we ll be together again cause Everywhere I go every smile I see I know you are there smilin back at me Dancin in moonlight I know you are free Cause I can see your star shinin down on me Good times we ll share again Makes me wanna dance Say it loud and proud All my love s for you Always been a true angel to me now above I can t wait for you to wrap your wings around me baby Oooh wrap them around me baby Sometimes hear you whisperin No more pain No worries will you ever see now baby I m so happy for my baby Dream about us together again What I want us together again baby I know we ll be together again cause Everywhere I go every smile I see I know you are there smilin back at me Dancin in moonlight I know you are free Cause I can see your star shinin down on me Good times we ll share again Makes me wanna dance Say it loud and proud All my love s for you There are times when I look above and beyond There are times when I feel you smile upon me baby I ll never forget my baby What I d give just to hold you close as on earth In heaven we will be together baby Together again my baby Everywhere I go every smile I see I know you are there smilin back at me Dancin in moonlight I know you are free Cause I can see your star shinin down on me Everywhere I go every smile I see I know you are there smilin back at me Dancin in moonlight I know you are free Cause I can see your star shinin down on me'
75,Boom! Shake the Room,DJ Jazzy Jeff,1993,b' Yo back up now and give a brother room The fuse is lit and I m about to go boom Mercy mercy mercy me Uh my life is a cage but on stage I m free Hyped up psyched up ready for wildin Standing in a crowd of girls like a island I see the one I want I said come here cutie I flip her around and then I work that booty Work the body work work the body Slow down girl you re bout to hurt somebody Hold up yo let s get just one thing clear There s only one reason why I came here Ya really done want me to tig a tig a tig a tell ya wassup Ya really done want me to tig a tig a tig a tell ya wassup Ya really done want me to tig a tig a tig a tell ya wassup I came here tonight to hear the crowd go Well yo are ya ll ready for me yet Well yo are ya ll ready for me yet Well yo are ya ll ready for me yet Well here I go here I go here I here I go Yo dance in the aisles when the Prince steps to it The rhyme is a football y all and I went and threw it Out in the crowd and yo it was a good throw How do I know because the crowd went In response to the way that I was kicking it Smooth an individual rhymes always original Like the Dr Jekyll man and this is my Hyde side I am the driver and you re on a rap ride So fellas Are y all with me I said fellas Are y all with me Why don t you tell the girls what y all wanna do Ya wanna That s right yo and I m in the flow So pump up the volume along with the tempo I want everybody in the house to know I came here tonight to hear the crowd go Yeah Break it on DOWN uh Yeah give em it Uh bring it back to em Yeah c mon now w ad libs Mix repeated Here I go The F f f f Fresh P p p p Prince is who I am So tell my mother that I never make a whack jam But sometimes I get n nervous and start to stutter And I f fumble every word for word I utter So I just try to ch ch ch ch ch chill But it gets worse a but worse a but but but worse still I need the c c c crowd to k k k kick into it They help me calm down and I can get through it So higher higher get your hands to the ceiling Let it go y all don t fight the feeling Mic in a strangle hold sweat pouring And like Jordan yo I m scoring Yeah that s right y all and I am in the flow So pump up the volume along with the tempo Many have died trying to stop my show I came here tonight to here the crowd go Yeah uh Kick it to em right here Don t stop All night long And I m outta here'
76,When She Cries,Restless Heart,1993,b'The road I have traveled on Is paved with good intentions It s littered with broken dreams That never quite came true When all of my hopes were dying Her love kept me trying She does her best to hide The pain that she s been through When she cries at night And she doesn t think that I can hear her She tries to hide All the fears she feels inside So I pray this time I can be the man that she deserves Cause I die a little each time When she cries She s always been there for me Whenever I ve fallen When nobody else believes She ll be there by my side I don t know how she takes it Just once I d like to make it Then there ll be tears of joy That fill her loving eyes So I pray this time I can be the man that she deserves Cause I die a little each time When she cries'
77,Sweat (A La La La La Long),Inner Circle,1993,b' I ve been watching you A La La La La Long A La La La La Long Long Li Long Long Long Come On A La La La La Long A La La La La Long Long Li Long Long Long Standing across the room I saw you smile I said I want to talk to you for a little while But before I make my move my emotions start running wild My tongue gets tied and that s no lie I m looking in your eyes I m looking in your big brown eyes Girl I want to make you sweat Sweat til you can t sweat no more And if you cry out I m gonna push it some more Girl I want to make you sweat Sweat til you can t sweat no more And if you cry out I m gonna push it Push it push it some more A La La La La Long A La La La La Long Long Li Long Long Long Come On A La La La La Long A La La La La Long Long Li Long Long Long So I say to myself if she loves me or not But the dread are known that love is here to get And with a little bit of this and a little bit of that The lyrics goes on the attack My tongue gets tied And that s no lie I m looking in your eyes I m looking in your big brown eyes Ooh yeah Oh girl Girl I want to make you sweat Sweat til you can t sweat no more And if you cry out I m gonna push it some more Girl I want to make you sweat Sweat til you can t sweat no more And if you cry out I m gonna push it Push it push it some more A La La La La Long A La La La La Long Long Li Long Long Long Oh yeah A La La La La Long A La La La La Long Long Li Long Long Long One more time A La La La La Long A La La La La Long Long Li Long Long Long Sing it A La La La La Long A La La La La Long Long Li Long Long Long eh Yeah Eyes I m Looking in your big brown eyes Oh yeah Girl I want to make you sweat Sweat til you can t sweat no more And if you cry out I m gonna push it some more Girl I want to make you sweat Sweat til you can t sweat no more And if you cry out I m gonna push it Push it push it some more A La La La La Long A La La La La Long Long Li Long Long Long Eh A La La La La Long A La La La La Long Long Li Long Long Long Push it push it some more A La La La La Long A La La La La Long Long Li Long Long Long Alright A La La La La Long A La La La La Long Long Li Long Long Long Push it push it some more'
