Rank,Song,Artist,Year,Lyrics
46,100% Pure Love,Crystal Waters,1994,b' It s twelve past midnight Don t close your eyes Your soul s half alive And I ll be by your side I ve come to take you there Show you how to care Just be aware That you ll have to share I want your love I want it tonight I m taking your heart So don t you fight I ll be your answer I ll be your wish I ll be your fantasy Your favorite dish From the back to the middle And around again I m gonna be there till the end 100 pure love From the back to the middle And around again I m gonna be there till the end 100 pure love You saw a brand new high Thought that you could fly Did I hear you cry Or did you like the ride You call my name again No it s not a sin I ll show you how to win And where I ve been I want your love I want it tonight I m taking your heart So don t you fight I ll be your answer I ll be your wish I ll be your fantasy Your favorite dish From the back to the middle And around again I m gonna be there till the end 100 pure love From the back to the middle And around again I m gonna be there till the end 100 pure love From the back to the middle And around again I m gonna be there till the end 100 pure love From the back to the middle And around again I m gonna be there till the end 100 pure love You ll never have to run away You ll always have a friend to play You ll never go out on your own In me You will find a home Home From the back to the middle And around again I m gonna be there till the end 100 pure love From the back to the middle And around again I m gonna be there till the end 100 pure love From the back to the middle And around again I m gonna be there till the end 100 pure love From the back to the middle And around again I m gonna be there till the end 100 pure love From the back to the middle And around again I m gonna be there till the end 100 pure love From the back to the middle And around again I m gonna be there till the end 100 pure love'
47,Anytime You Need a Friend,Mariah Carey,1994,b' If you re lonely And need a friend And troubles seem like They never end Just remember To keep the faith And love will be there To light the way Anytime you need a friend I will be here You ll never be alone again So don t you fear Even if you re miles away I m by your side So don t you ever be lonely Love will make it alright When the shadows are closing in And your spirit diminishing Just remember You re not alone And love will be there To guide you home Anytime you need a friend I will be here You ll never be alone again So don t you fear Even if you re miles away I m by your side Don t you ever be lonely Love will make it alright If you just believe in me I will love you endlessly Take my hand Take me into your heart I ll be there forever baby I won t let go I ll never let go Anytime you need a friend I will be here You ll never be alone again So don t you fear Even if you re miles away I m by your side So don t you ever be lonely It s alright it s alright Anytime you need a friend I will be here You ll never be alone again So don t you fear Even if you re miles away I m by your side So don t you ever be lonely It s alright it s alright Anytime you need a friend I will be here You ll never be alone again So don t you fear Even if you re miles away I m by your side So don t you ever be lonely It s alright it s alright'
48,Because of Love,Janet Jackson,1994,b' You got me singin Because of love I know you better Because of love We are together Because of love You have my heart Because of love We ll never part When I first met you I knew that my life would never be the same And I knew that you felt it too Never feel alone again boy Cause your love makes me feel so secure You got me singin Because of love I know you better Because of love We are together Because of love You have my heart Because of love We ll never part Because of love I know you better Because of love We are together Because of love You have my heart Because of love We ll never part I don t care what people say You re the one that brings me so much joy When I look at your smiling eyes my heart wants to dance boy There s only you on my mind And I never wanna leave your side It feels right so let s stay together Never feel alone again boy Cause your love makes me feel so secure You got me singin Because of love I know you better Because of love We are together Because of love You have my heart Because of love We ll never part It s cause of love We ve shared great memories And the way you make me feel brand new It s cause of love I feel so high I don t need nobody else Because of love Because of love Be be because of Be be because of love Be be because of love I know you better Be be because of Be be because of love I know you better Because of love I know you better Because of love We are together Because of love You have my heart Because of love We ll never part Because of love I know you better Because of love We are together Because of love You have my heart Because of love We ll never part'
49,Linger,The Cranberries,1994,b' If you if you could return Don t let it burn Don t let it fade I m sure I might be rude But it s just your attitude It s tearing me apart It s ruining every day And I swore I swore I would be true And honey so did you So why were you holding her hand Is that the way we stand Were you lying all the time Was it just a game to you But I m in so deep You know I m such a fool for you You ve got me wrapped around your finger Do you have to let it linger Do you have to do you have to do you have to let it linger Oh I thought the world of you I thought nothing could go wrong But I was wrong I was wrong If you if you could get by Trying not to lie Things wouldn t be so confused And I wouldn t feel so used But you always really knew I just want to be with you And I m in so deep You know I m such a fool for you You ve got me wrapped around your finger Do you have to let it linger Do you have to do you have to do you have to let it linger And I m in so deep You know I m such a fool for you You ve got me wrapped around your finger Do you have to let it linger Do you have to do you have to do you have to let it linger You know I m such a fool for you You ve got me wrapped around your finger Do you have to let it linger Do you have to do you have to do you have to let it linger '
50,Loser,Beck,1994,b' In the time of chimpanzees I was a monkey Butane in my veins and I m out to cut the junkie With the plastic eyeballs spray paint the vegetables Dog food skulls with the beefcake pantyhose Kill the headlights and put it in neutral Stock car flaming with the loser in the cruise control Baby s in Reno with the vitamin D Got a couple of couches sleep on the love seat Someone came in saying I m insane to complain About a shotgun wedding and a stain on my shirt Don t believe everything that you breathe You get a parking violation and a maggot on your sleeve So shave your face with some mace in the dark Saving all your food stamps and burning down the trailer park Yo cut it Soy un perdedor I m a loser baby so why don t you kill me Soy un perdedor I m a loser baby so why don t you kill me The forces of evil in a bozo nightmare Ban all the music with the phony gas chamber Cause one s got a weasel and the other s got a flag One s on the pole shove the other in a bag With the rerun shows and the cocaine nose job The daytime crap of the folksinger slob He hung himself with a guitar string A slab of turkey neck and it s hanging from a pigeon wing You can t get right if you can t relate Trade the cash for the beat for the body for the hate And my time is a piece of wax falling on a termite Who s choking on the splinters Soy un perdedor I m a loser baby so why don t you kill me Soy un perdedor I m a loser baby so why don t you kill me I m a driver I m a winner Things are gonna change I can feel it Soy un perdedor I m a loser baby so why don t you kill me Soy un perdedor I m a loser baby so why don t you kill me Soy un perdedor I m a loser baby so why don t you kill me Soy un perdedor I m a loser baby so why don t you kill me '
51,Found Out About You,Gin Blossoms,1994,b'All last summer in case you don t recall I was yours and you were mine forget it all Is there a line that I could write That s sad enough to make you cry And all the lines you wrote to me were lies Months roll past the love that you struck dead Did you love me only in my head There were things you said and did to me They seem to come so easily The love I thought I d won you give for free Whispers at the bus stop Well I ve heard about nights out in the school yard I found out about you I found out about you Rumors follow everywhere you go Like when you left and I was last to know Well you re famous now and there s no doubt In all the places you hang out They know your name and they know what you re about Whispers at the bus stop Well I ve heard about nights out in the school yard I found out about you I found out about you Street lights blink on through the car window I get the time too often on AM radio Well you know it s all I think about I write your name drive past your house Your boyfriend s over I watch your lights go out Whispers at the bus stop Well I ve heard about nights out in the school yard I found out about you I found out about you Whispers at the bus stop Well I ve heard about nights out in the school yard I found out about you I found out about you I found about you'
52,Gin and Juice,Snoop Doggy Dogg,1994,b' Ha ha ha I m serious nigga One of y all niggas got some bad motherfuckin breath Aye baby aye baby aye baby Get some bubblegum in this motherfucker or somethin Aye nigga get somethin to eat dog Aye nigga study long study wrong nigga With so much drama in the L B C It s kind of hard bein Snoop D O double G But I somehow some way Keep comin up with funky ass shit like every single day May I kick a little something for the G s And make a few ends as I breach through Two in the mornin and the party s still jumpin Cause my momma ain t home I got bitches in the livin room gettin it on And they ain t leavin till six in the mornin So what you wanna do Shit I got a pocket full of rubbers and my homeboys do too So turn off the lights and close the doors But we don t love them hoes yeah So we gon smoke a ounce to this G s up hoes down while you motherfuckers bounce to this Rollin down the street smokin indo Sippin on gin and juice laid back With my mind on my money And my money on my mind Rollin down the street smokin indo Sippin on gin and juice laid back With my mind on my money And my money on my mind Now that I got me some Seagram s gin Everybody got they cups but they ain t chipped in Now this type of shit happens all the time You got to get yours but fool I gotta get mine Everything is fine when you listening to the D O G I got the cultivating music that be captivating he Who listens to the words that I speak As I take me a drink to the middle of the street And get to mackin to this bitch named Sadie She used to be the homeboy s lady 80 degrees when I tell that bitch please Raise up off these N U T s cause you gets none of these At ease as I mob with the Dogg Pound Feel the breeze beyotch I m just Rollin down the street smokin indo Sippin on gin and juice laid back With my mind on my money And my money on my mind Rollin down the street smokin indo Sippin on gin and juice laid back With my mind on my money And my money on my mind Later on that day my homie Dr Dre Came through with a gang of Tanqueray And a fat ass J of some bubonic chronic That made me choke shit this ain t no joke I had to back up off of it and sit my cup down Tanqueray and chronic yeah I m fucked up now But it ain t no stoppin I m still poppin Dre got some bitches from the city of Compton To serve me not with a cherry on top Cause when I bust my nut I m raising up off the cot Don t get upset girl that s just how it goes I don t love you hoes I m out the door and I ll be Rollin down the street smokin indo Sippin on gin and juice laid back With my mind on my money And my money on my mind Rollin down the street smokin indo Sippin on gin and juice laid back With my mind on my money And my money on my mind Rollin down the street smokin indo Sippin on gin and juice beyotch With my mind on my money And my money on my mind Rollin down the street smokin indo Sippin on gin and juice beyotch With my mind on my money And my money on my mind'
53,Never Lie,Immature,1994,b' Friends come a dime a dozen But I know that I will never find a friend like you And that s why I wanna sing this song Wherever you are Wherever I just want to let you know That I will never lie again I promise I will never lie again Cause you ll always be my friend I will never lie again Cause a friend like you will last forever Sitting in my window I m thinking of you All the fun things we used to do I feel the pain please come back to me Cause a friend like you will only come once in a lifetime I will never lie again Cause you ll always be my friend I will never lie again Cause a friend like you will last forever On the phone when you were here Laughing and joking crying and sulking In my dreams you re still with me Cause a friend like you only comes once in a lifetime I will never lie again Cause you ll always be my friend I will never lie again Cause a friend like you will last forever When I think of you I think of someone special And how it used to be yeah I know you ll always be my friend I m so sad it had to end I will never lie again Cause you ll always be my friend I will never lie again Cause a friend like you will last forever I will never lie again Cause you ll always be my friend I will never lie again Cause a friend like you will last forever I will never lie again Cause you ll always '
54,Streets of Philadelphia,Bruce Springsteen,1994,b'I was bruised and battered I couldn t tell what I felt I was unrecognizable to myself I saw my reflection in a window I didn t know my own face Oh brother are you gonna leave me wastin away On the Streets of Philadelphia I walked the avenue til my legs felt like stone I heard the voices of friends vanished and gone At night I could hear the blood in my veins It was just as black and whispering as the rain On the Streets of Philadelphia Ain t no angel gonna greet me It s just you and I my friend My clothes don t fit me no more I walked a thousand miles Just to slip this skin The night has fallen I m lyin awake I can feel myself fading away So receive me brother with your faithless kiss Or will we leave each other alone like this On the Streets of Philadelphia'
55,Getto Jam,Domino,1994,b' Here we go here we go as the tune starts to bloom With a phat phat phat chorus 1 2 3 if this is O G The freaks would ya move ya booties The getto jam is about to slam With some notes from the diggady D E As I key what s really goin on Would ya reminisce with me e Saturday mornin just gettin up With a hangover smellin like I fucked I really can t remember cause I m still kinda faded So I close my eyes and thank God that I made it Now I m gettin flashbacks of some O J With a green glass says Tanqueray Took it to the head gulped it down with the quickness Now I need a bitch so I can handle my business What do you know a freak s in my reach Threw her on the flo stuck it in her deep She s screamin and she s screamin and she s screamin gettin hoarse But then I busted a nut and that was that So kick the chorus My homies are down chillin in the hood But them hood bitches well they ain t no good To another man well she might be some good cat But homies in the hood label her as a hood rat She s scandalous So those with game can fuck And ooh she ll clown your ass real fast if you re quick to nut And when you re in that thi ing She ll make a nigga si ng Duh du dway duh dum dway duh dum dway But you don t hear me doe Ain t nuthin wrong with being a Trojan man when ya ridin So let s kick the chorus please if ya like it My homie s clownin in his dope yellow chevy Too O D ed to be dropped Kenwood s kickin that funk in the trunk Clean with the rag on top yeah Rollin down the Shaw guess what we saw some bitches The finest one is on my nuts she s blowing kisses So I approached the freak of the week And I played it like a game of blackjack And for all that ass that she toted around Well I offered a backpack And since I m a mack Well you know how the story goes So all ya hoes and their bros here we go '
56,Endless Love,Luther Vandross,1994,b' My love There s only you in my life The only thing that s right Ooh yeah My first love You re every breath that I take You re every step I make And I I want to share All my love with you hey No one else will do you know it And your eyes They tell me how much you care Oh yes You will always be My endless love Oh yeah Two hearts Two hearts that beat as one Our lives have just begun And forever I ll hold you close in my arms I can t resist your charms No no no no And I I ll be a fool for you I m sure You know I don t mind Cause baby you You mean the world to me yeah I know I found in you My endless love Yeah yeah yeah Do do do do do do do do Do do do do do Whoa and I I ll be that fool for you I m sure That you know I don t mind Oh yeah yeah yes You d be the only one Cause no no one can deny This love I have inside And I ll give it all to you My love My my my endless love Mmm my love'
57,I Miss You,Aaron Hall,1994,b'I miss you I m talking to you baby I miss you I miss you I m talking to you baby I miss you We used to talk And laugh all night girl What happened to those days Did they all just fade away Holding you in my arms Made me feel so happy Then you said you had to go What s wrong baby I need to know But now it s a dream That I wish you could come Back and make come true But you re long gone away But now I m missing you I miss you yes I do From the bottom of my heart I miss you I m talking to you baby I miss you I miss you I m talking to you baby I miss you I thought you d be with me forever But I guess someone took my place Took the place of me loving you And making love to you all through the night I wish you were still here So I can see your pretty face again Please come back and rescue me From all this pain and misery But now it s a dream And I wish you Could come back to make us true But you re long gone away But now I m missing you missing you Missing you Please understand how much I really miss you I ll do anything in this world To have you back again Missing you Missing you I miss you through winter spring The summer the fall When we were together I miss you I miss you From the bottom of my heart To the depths of my soul baby I miss you oh Give me the love back baby The way you used to hold me The way you used to kiss me I I I miss you I miss you Yes I do Yes I do I miss you Yes I do yes I do I miss you I really really do I really really do I miss you yes I do yes I do I miss you so bad Everytime I lay at night all I do is cry I do love you baby I miss you I miss you yes I do yes I do I m talking to you baby call me Call me baby call me baby come Give your loving back to me yes I do yes I do I miss you I m talking to you baby I miss you I miss you I miss you I miss you I miss you I miss you'
58,Understanding,Xscape,1994,b' What I need from you is understanding How can we communicate If you don t hear what I say What I need from you is understanding So simple as 1 2 3 Understanding is what we need You don t really know me You just wanna do what you wanna do That s not the way it should be No you should listen to me boy I try so very hard to make you understand But the choices you make baby they re all demands I try so very hard to keep our love alive But you don t wanna meet me half way Then the understanding dies There s no way that we can work it out If we don t pull together I don t mean to be demanding But I want some understanding I want to be with you I listen to you baby And I know the things you re going through I try to understand That s why I m still with you baby See everyday we re living Is one thing that will always be unsure That s why I need you baby pleading baby Please let our love endure '
59,This D.J.,Warren G,1994,b' It s kind of easy when you listen to the G d up sound Pioneer speakers bumpin as I smoke on a pound I got the sound fo yo ass and it s easy to see That this D J be Warren G Can I get in where I fit in Sit in listen Let me conversate better yet Regulate Shake the spot with my knot may fade Cause I don t like to dream about gettin paid I played ball through the halls of CIS With Snoop Dogg s big brother call him Dirty Left Rack em up crack em up stack em up against the gate The homies tryin ta catch me but they cain t wait Damn the street lights just came on And my momma s in the streets tellin me to come home I hit the gate and I hops on my Schwinn And I tell the homies Aight then yeah It s kind of easy when you listen to the G d up sound Pioneer speakers bumpin as I smoke on a pound I got the sound fo yo ass and it s easy to see That this D J be Warren G It s kind of easy when you listen to the G d up sound Pioneer speakers bumpin as I smoke on a pound I got the sound fo yo ass and it s easy to see That this D J be Warren G Verse two now what the fuck I do Catch the bus to Cal State or chill with the Voltron crew And make a few ends on the side Here comes a baby blue van time to ride So I hops in the van with my nigga Tick And Baby Poppa back then that was my clique We groovin to Santa Ana And we plan on makin hellafied mount of money And what I did for extra fees Was break niggas after work playin get like me I was fourteen years old havin a sack Just a young motherfucker eatin ValuPaks Shootin dice in the halls of the public schools And I used to gangbang but now it s a G thang And I still know how to make those ends You don t believe me go ask The Twinz motherfucker It s kind of easy when you listen to the G d up sound Pioneer speakers bumpin as I smoke on a pound I got the sound fo yo ass and it s easy to see That this D J be Warren G It s kind of easy when you listen to the G d up sound Pioneer speakers bumpin as I smoke on a pound I got the sound fo yo ass and it s easy to see That this D J be Warren G Yeah check dis out this is I m O G L B KnowhatI msayin I m on my little O G Warren G And he just droppin this to let you BG s know What s happen y all got to recognize Cause this is y know a Long Beach thang 21st Street but check this out G gonna go out there yaknowhatI msayin And handle that shit y now Yeah It s kind of easy when you listen to the G d up sound Pioneer speakers bumpin as I smoke on a pound I got the sound fo yo ass and it s easy to see That this D J be Warren G It s kind of easy when you listen to the G d up sound Pioneer speakers bumpin as I smoke on a pound I got the sound fo yo ass and it s easy to see That this D J be Warren G Hey Greg I hope you was tapin that shit '
60,Cry for You,Jodeci,1994,b' Without you baby I feel worthless I m living on the edge It s been an hour since you ve been gone And that s too long so come back home I can t live without you So I ll cry for you Do anything that I can To feel that touch from your hand Sorry that I want you Lady what do I do You know You re everything I knew Ooh yeah Do what you want me to I would do anything Get on my knees for you Ooh baby What else is there to do I don t know I don t know But I ll cry Lady I will cry for you tonight tonight Lady I will cry for you tonight tonight Well l l well Help me out Help me out yeah You spoil me girl like a child When you re not here I can t even smile I can t think without you My mind is always with you It s amazing what you do To keep me falling in love with you Girl you all that I know Where else can I go I say Lady I will cry for you tonight Lady I will cry for you tonight tonight Help me out baby Help me out baby yes I don t know how else to say it I don t know what else to say K Ci help me sing it JoJo I m right here yes I am I will cry for you lady Sometimes my pillow gets so wet with tears I don t have no one to call my own I want you back baby Ooh yeah Baby I m begging baby I m begging begging baby Baby I m begging baby I m begging begging baby Baby I m begging baby I m begging begging baby I just can t take it no more I don t give a damn anymore baby Baby I m begging baby I m begging begging baby Is there anybody out there know what I m talking about Somebody anybody Jodeci let me here you say YEAH a a ah Baby I m begging baby I m begging begging baby'
