Rank,Song,Artist,Year,Lyrics
61,Keep Ya Head Up,2Pac,1994,b' Little something for my godson Elijah And a little girl named Corin Some say the blacker the berry the sweeter the juice I say the darker the flesh then the deeper the roots I give a holla to my sisters on welfare 2Pac cares if don t nobody else care And I know they like to beat you down a lot When you come around the block brothers clown a lot But please don t cry dry your eyes never let up Forgive but don t forget girl keep ya head up And when he tells you you ain t nothin don t believe him And if he can t learn to love you you should leave him Cause sister you don t need him And I ain t tryin to gas you up I just call em how I see em You know what makes me unhappy When brothers make babies And leave a young mother to be a pappy And since we all came from a woman Got our name from a woman and our game from a woman I wonder why we take from our women Why we rape our women do we hate our women I think it s time to kill for our women Time to heal our women be real to our women And if we don t we ll have a race of babies That will hate the ladies that make the babies And since a man can t make one He has no right to tell a woman when and where to create one So will the real men get up I know you re fed up ladies but keep ya head up Keep ya head up ooh child Things are gonna get easier Keep ya head up ooh child Things ll get brighter Keep ya head up ooh child Things are gonna get easier Keep ya head up ooh child Things ll get brighter Ayo I remember Marvin Gaye used to sing to me He had me feelin like black was the thing to be And suddenly the ghetto didn t seem so tough And though we had it rough we always had enough I huffed and puffed about my curfew and broke the rules Ran with a local crew and had a smoke or two And I realize Mama really paid the price She nearly gave her life to raise me right And all I had to give her was my pipe dream Of how I d rock the mic and make it to the bright screen I m tryin to make a dollar out of fifteen cents It s hard to be legit and still pay the rent And in the end it seems I m headin for the pen I try to find my friends but they re blowin in the wind Last night my buddy lost his whole family It s gonna take the man in me to conquer this insanity It seems the rain ll never let up I try to keep my head up and still keep from gettin wet up You know it s funny when it rains it pours They got money for wars but can t feed the poor Say there ain t no hope for the youth And the truth is it ain t no hope for the future And then they wonder why we crazy I blame my mother for turnin my brother into a crack baby We ain t meant to survive cause it s a set up And even though you re fed up huh you got to keep ya head up Keep ya head up ooh child Things are gonna get easier Keep ya head up ooh child Things ll get brighter Keep ya head up ooh child Things are gonna get easier Keep ya head up ooh child Things ll get brighter And uh to all the ladies havin babies on they own I know it s kinda rough and you re feelin all alone Daddy s long gone and he left you by your lonesome Thank the Lord for my kids even if nobody else want em Cause I think we can make it in fact I m sure And if you fall stand tall and come back for more Cause ain t nothin worse than when your son Wants to know why his daddy don t love him no mo You can t complain you was dealt this Hell of a hand without a man feelin helpless Because there s too many things for you to deal with Dyin inside but outside you re lookin fearless While tears is rollin down your cheeks You steady hopin things don t fall down this week Cause if it did you couldn t take it And don t blame me I was given this world I didn t make it And now my son s gettin older and older And cold from havin the world on his shoulders While the rich kids is drivin Benz I m still tryin to hold on to survivin friends And it s crazy it seems it ll never let up But please you got to keep ya head up'
62,What's My Name?,Snoop Doggy Dogg,1994,b' EeeyiyiyiyiyahtheDoggPound sinthehou owwse EeeyiyiyiyiyeahtheDoggPound sinthehou oww owse Snoop Doggy Do owww ohhhh oggg Snoop Doggy Do owww ohhhh oggg From the depths of the sea back to the block Snoop Doggy Dogg funky as the the The D O C Went solo on that ass but it s still the same Long Beach is the spot where I serve my caine Follow me follow me follow me follow me but don t lose your grip Nine trizzay s the yizzear for me to fuck up shit So I ain t holdin nuttin back And motherfucker I got five on that twenty sack It s like that and as a matter of fact Cause I never hesitate to put a nigga on his back Yeah so peep out the manuscript You see that it s a must we drop gangsta shit What s my motherfuckin name Snoop Doggy Dogg Snoop Doggy Dogg Dah dah dah dah hey hey hey hey hey hey hey dah dah It s the bow to the wow creepin and crawlin Yiggy yes y allin Snoop Doggy Dogg in The motherfuckin house like everyday Droppin shit with my nigga Mr Dr Dre Like I said niggas can t FUCK with this And niggas can t FUCK with that Shit that I drop cause ya know it don t stop Mr One Eight Seven on a motherfuckin cop Tic toc never the Glock just some nuts and a cock Robbin motherfuckers then I kill dem bloodclots Then I step through the fog and I creep through the smog Cause I m Snoop Doggy Doggy Doggy Snoop Doggy Dogg Snoop Doggy Dogg Bow wow wow yuppie yo yupie ye Bow wow wow yuppie yo Bow wow wow yuppie yo yupie ye Bow wow wow yuppie yo yo yo yo Now just throw your hands in the motherfuckin air And wave the motherfuckers like ya just don t care Yeah roll up the dank and pour the drank And watch your step cause Doggy s on the gank My bank roll s on swoll My shit s on hit legit now I m on parole stroll With the Dogg Pound right behind me And up in yo bitch is where ya might find me Layin that playin that G Thang She want the nigga with the biggest nuts and guess what He is I and I am him slim with the tilted brim What s my motherfuckin name Oh Snoopy Dogg Snoopy Dogg Snoopy Dogg Yeah yeah I know his name C mon Snoopy c mon Snoopy And the Dogg Pound Snoopy Dogg Snoopy Dogg Snoopy Dogg '
63,Another Night,Real McCoy,1994,b' Another night another dream but always you It s like a vision of love that seems to be true Another night another dream but always you In the night I dream of love so true Just another night another vision of love You feel joy you feel pain Cause nothing will be the same Just another night is all that it takes To understand the difference between lovers and fakes So baby I talk talk I talk to you In the night in your dream of love so true I talk talk I talk to you In the night in your dream of love so true In the night in my dreams I m in love with you Cause you talk to me like lovers do I feel joy I feel pain Cause it s still the same When the night is gone I ll be alone Another night another dream but always you It s like a vision of love that seems to be true Another night another dream but always you In the night I dream of love so true Just another night another dream another vision Of love with me I m here to set you free I am your lover your brother Hey sister let me cover your body with my love is with my lovin just another Vision of love that seems to be true all we do all the things that only lovers do Vision of love that seems to be true all we do all the things that only lovers do In the night in my dreams I m in love with you Cause you talk to me like lovers do I feel joy I feel pain Cause it s still the same when the night is gone I ll be alone Another night another dream but always you It s like a vision of love that seems to be true Another night another dream but always you In the night I dream of love so true I talk talk I talk to you in the night In your dream of love so true I talk talk I talk to you in the night in your dream of love so true In the night in my dreams I m in love with you Cause you talk to me like lovers do I feel joy I feel pain Cause it s still the same when the night is gone I ll be alone Another night another dream but always you It s like a vision of love that seems to be true Another night another dream but always you In the night I dream of love so true'
64,Your Body's Callin',R. Kelly,1994,b' Yeah girl I don t want you to hold back any longer baby Cause tonight I m gonna give you all the things I know you ve been waiting for So brace yourself and listen I hear you calling here I come baby to save you oh oh Baby no more stalling these hands have been longing to touch you baby woo And now that you ve come around to seeing it my way You won t regret it baby and you surely won t forget it baby It s unbelievable how your body s calling for me I can just hear it calling calling calling for me My body s calling for you My body s calling for you My body s calling for you My body s calling for you Tell me what s your desire baby your wish is my will oh yes it is Baby let me take you higher and show you how you should feel baby Oh so I speak now and forever hold your body Whatever it is you want from me lady You see you don t have to say nothing I know when your body wants something And it s easy for me to see that your body s calling for me My body s calling for you My body s calling for you My body s calling for you My body s calling for you I m listening baby I hear you calling me I m listening baby I hear you calling me I m listening baby I hear you calling me I m listening baby I hear you calling me Hear your body calling me My body s calling for you My body s calling for you My body s calling for you My body s calling for you My body s calling for you My body s calling for you My body s calling for you My body s calling for you My body s calling for you My body s calling for you My body s calling for you My body s calling for you My body s calling for you My body s calling for you'
65,Tootsee Roll,69 Boyz,1994,b'The butterfly Uh uh that s old Let me see the Tootsee Roll Yeah 199Quad 69 Boyz backed up by the Quad City DJ s One time Cotton candy sweetie go let me see the Tootsee Roll Tootsee Roll To the left To the right To the front To the back Slide To the left To the right To the front To the back Dip baby dip Cotton candy sweetie go Let me see the Tootsee Roll I don t know what you ve been told It ain t the butterfly it s the Tootsee Roll A brand new dance SO Grab a partner and get on the dance FLO And work them hips a lil bit Then do that dip a lil bit Oh yeah you got it now whip baby no buts about it And you over there with the long hair Keep rollin that derriere Cause it ain t hard Just a brand new dance for the 199Quad 69 in the place to be Hey yo Ski What we came to see Cotton candy sweetie go Let me see the Tootsee Roll Chorus 1 Bridge I feel a whoop comin on a whoop comin on Whoop Tootsee Roll To the left To the right To the front To the back Slide I feel a whoop comin on a whoop comin on Whoop Cotton candy sweetie go Let me see the Tootsee Roll Chorus 2 I don t know what you ve been told It ain t the butterfly it s the Tootsee Roll A brand new dance SO Grab a partner and get on the dance FLO 69 in the place to be Hey yo Ski What we came to see The butterfly Uh uh that s old The butterfly Uh uh that s old Let me see the Tootsee Roll Tootsee Roll To the left To the right To the front To the back Slide To the left To the right To the front To the back Dip baby dip I feel a whoop comin on a whoop comin on Whoop Just roll '
66,I Can See Clearly Now,Jimmy Cliff,1994,b'I can see clearly now the rain is gone I can see all obstacles in my way Gone are the dark clouds that had me blind It s gonna be a bright Bright sun shining day It s gonna be a bright Bright sun shining day Oh yes I can make it now the pain is gone All of the bad feelings have disappeared Here is that rainbow I ve been praying for It s gonna be a bright Bright sun shining day Look all around there s nothing but blue skies Look straight ahead there s nothing but blue skies I can see clearly now the rain is gone I can see all obstacles in my way Here is that rainbow I ve been praying for It s gonna be a bright Bright sun shining day It s gonna be a bright Bright sun shining day It s going to be a bright Bright sun shining day It s gonna be a bright Bright sun shining day It s gonna be a bright Bright sun shining day It s gonna be a bright Bright sun shining day It s gonna be a bright Bright sun shining day'
67,Never Keeping Secrets,Babyface,1994,b'I never meant to lie to you But I needed me an easy way out I couldn t face the truth with you Because I didn t want to lose my clout I always have been good to you Girl I promise you that nothing has changed Momentary insanity Must be the reason why I did you that way So now I m telling everybody That I know I was a fool To take a chance of ever losing And I can t take losing you So I m Never keeping secrets And I m never telling lies I wanna make it up to you No I m Never keeping secrets Girl I swear it s all behind I only wanna be with you I didn t want to lie to you But I didn t want to let you down It never did occur to me Sooner or later that you would find out You know how much I care for you And I would never want to cause you pain I know that there is no excuse How could I ever treat my baby that way That s why I m telling everybody That I know I was a fool But I don t give a damn about it Cause I wanna get back wit you If you wanna go I want you to know Girl that I understand it But I don t recommened it Cause I love you more I know you can t ignore That I will die for you Even lay down my life for you girl Girl I wanna see You standing next to me Girl I apologize For each and every lie I want you to be The only one for me Forever and ever and ever and ever and ever '
68,Crazy,Aerosmith,1994,b' Come here baby You know you drive me up a wall The way you make good on all the nasty tricks you pull Seems like we re makin up more than we re makin love And it always seems you got somethin on your mind other than me Girl you got to change your crazy ways You hear me Say you re leavin on a seven thirty train and that you re headin Out to Hollywood Girl you been givin me that line so many times it kinda gets like Feelin bad looks good That kinda loving Turns a man to a slave That kinda loving Sends a man right to his grave I go crazy crazy baby I go crazy You turn it on Then you re gone Yeah you drive me Crazy crazy crazy for you baby What can I do honey I feel like the color blue You re packing up your stuff and talking like it s tough and trying To tell me that it s time to go But I know you ain t wearing nothing underneath that overcoat And it s all a show That kind of loving Makes me want to pull Down the shade yeah That kind of loving Yeah now I m never never never never gonna be the same I go crazy crazy baby I go crazy You turn it on Then you re gone Yeah you drive me Crazy crazy crazy for you baby What can I do honey I feel like the color blue I m losing my mind girl Cause I m going crazy I need your love honey I need your love Crazy crazy crazy I go crazy You turn it on Then you re gone Yeah you drive me Crazy crazy crazy for you baby I m losing my mind girl Cause I m going crazy Crazy crazy crazy for you baby You turn it on then your gone Yeah you drive me'
69,Just Kickin' It,Xscape,1994,b' Every man wants a woman Where him and her can just go hang Just the two of them along kick back Doing their own thing And every man wants a woman That can always keep him in the mood And I m that kind of girl So this is what I tell my dude I tell him to kick off your shoes and relax your feet Party on down to the Xscape beat Just kick it Just kick it just kick it just kick it I tell him to kick off your shoes and relax your feet Party on down to the Xscape beat Just kick it Just kick it just kick it just kick it Every man wants a woman That can cook him up a good meal A woman he can treat like his homie And take her out on the Ave and just chill Every man wants a woman That ain t good for just laying on her back And I m that kind of woman So before me and my man get in the sack I tell him to kick off your shoes and relax your feet Party on down to the Xscape beat Just kick it Just kick it just kick it Kick off your shoes and relax your feet Party on down to the Xscape beat Just kick it Just kick it just kick it Kick off your shoes and relax your feet Party on down to the Xscape beat Just kick it Just kick it just kick it Kick off your shoes and relax your feet Party on down to the Xscape beat Just kick it Just kick it just kick it This is for the niggas strictly for the niggas This is for the niggas the real niggas This is for the niggas strictly for the niggas This is for the niggas the real niggas This is for the niggas strictly for the niggas This is for the niggas the real niggas This is for the niggas strictly for the niggas This is for the niggas the real niggas Kick off your shoes and relax your feet Party on down to the Xscape beat Just kick it Just kick it just kick it Kick off your shoes and relax your feet Party on down to the Xscape beat Just kick it Just kick it just kick it'
70,(At Your Best) You Are Love,Aaliyah,1994,b' Let me know let me know Ahhh let me know Let me know let me know When I feel what I feel Sometimes it s hard to tell you so You may not be in the mood to learn what you think you know There are times when I find You want to keep yourself from me When I don t have the strength I m just a mirror of what I see But at your best you are love You re a positive motivating force within my life Should you ever feel the need to wonder why Let me know let me know When you feel what you feel Oh how hard for me to understand So many things have taken place before this love affair began But when you feel oh like I feel Confusion can give way to doubt For there are times when I fall short of what I say What I say I m all about all about But at your best you are love You re a positive motivating force within my life Should you ever feel the need to wonder why Let me know let me know Tell me what it is Make believe no need to make believe Look beyond your own Try and find another place for me Cause At your best you are love You re a positive motivating force within my life Should you ever feel the need to wonder why Let me know let me know Let me know let me know let me know See at your best baby'
71,Rock and Roll Dreams Come Through,Meat Loaf,1994,b'You can t run away forever But there s nothing wrong with getting a good head start You want to shut out the night You want to shut down the sun You want to shut away the pieces of a broken heart Think of how we d lay down together We d be listening to the radio so loud and so strong Every golden nugget coming like a gift of the gods Someone must have blessed us when he gave us those songs I treasure your love I never want to lose it You ve been through the fires of hell And I know you ve got the ashes to prove it I treasure your love I want to show you how to use it You ve been through a lot of pain in the dirt And I know you ve got the scars to prove it Remember everything that I told you And I m telling you again that it s true When you re alone and afraid And you re completely amazed To find there s nothing anybody can do Keep on believing And you ll discover baby There s always something magic There s always something new And when you really really need it the most That s when rock and roll dreams come through The beat is yours forever The beat is always true And when you really need it the most That s when rock and roll dreams come through for you Once upon a time was a backbeat Once upon a time all the chords came to life And the angels had guitars even before they had wings If you hold onto a chorus you can get through the night I treasure your love I never want to lose it And you ve been through the fires of hell And I know you ve got the ashes to prove it I treasure you love I want to show you how to use it You ve been through a lot of pain in the dirt And I know you ve got the scars to prove it Remember everything that I told you And I m telling you again that it s true You re never alone cause you can put on the phones And let the drummer tell your heart what to do Keep on believing And you ll discover baby There s always something magic There s always something new And when you really really need it the most That s when rock and roll dreams come through The beat is yours forever The beat is always true And when you really really need it the most That s when rock and roll dreams come through for you The beat is yours forever That s when rock and roll dreams come through The beat is yours forever That s when rock and roll dreams come through The beat is yours forever That s when rock and roll dreams come through The beat is yours forever That s when rock and roll dreams come through The beat is yours forever That s when rock and roll dreams come through The beat is yours forever That s when rock and roll dreams come through '
72,Amazing,Aerosmith,1994,b' I kept the right ones out And let the wrong ones in Had an angel of mercy to see me through all my sins There were times in my life When I was goin insane Tryin to walk through the pain When I lost my grip and I hit the floor Yeah I thought I could leave but couldn t get out the door I was so sick and tired of livin a lie I was wishin that I would die It s amazing With the blink of an eye you finally see the light It s amazing When the moment arrives that you know you ll be alright It s amazing And I m sayin a prayer for the desperate hearts tonight That one last shot s a permanent vacation And how high can you fly with broken wings Life s a journey not a destination And I just can t tell just what tomorrow brings You have to learn to crawl Before you learn to walk But I just couldn t listen to all that righteous talk oh yeah I was out on the street Just tryin to survive Scratchin to stay alive It s amazing With the blink of an eye you finally see the light It s amazing When the moment arrives that you know you ll be alright It s amazing And I m sayin a prayer for the desperate hearts tonight Desperate hearts desperate hearts So from all of us at Aerosmith to all of you out there wherever you are remember the light at the end of the tunnel may be you Good night '
73,Always,Erasure,1994,b' Open your eyes I see Your eyes are open Wear no disguise for me Come into the open When it s cold outside Am I here in vain Hold on to the night There will be no shame Always I want to be with you And make believe with you And live in harmony harmony oh love Melting the ice for me Jump into the ocean Hold back the tide I see Your love in motion When it s cold outside Am I here in vain Hold on to the night There will be no shame Always I want to be with you And make believe with you And live in harmony harmony oh love When it s cold outside Am I here in vain Hold on to the night There will be no shame Always I want to be with you And make believe with you And live in harmony harmony oh love'
74,Groove Thang,Zhané,1994,b' Well it s a groove thang It s got a funky swing Well it s a groove thang a groove thang Come on We re moving on keeping strong Don t you let them steer you wrong It s a groove thang We re gonna give you what you want Just as long as you re around It s a groove thang We re moving on keeping strong Don t you let them steer you wrong It s a groove thang We re gonna give you what you want Just as long as you re around It s a groove thang People there s really nothing to it Let your body rest my friend and do it Remember it ain t over til it s really over A groove thang groove thang Relax your mind listen to the rhythm It s got you flowing but it s in precision Music is life and we are living Groove thang groove thang groove thang We re moving on keeping strong Don t you let them steer you wrong It s a groove thang We re gonna give you what you want Just as long as you re around It s a groove thang It s gonna make you touch the sky Your body s moving left to right You re grooving to the morning light It s a groove thang oh yeah It takes some time to realize Your body s moving left to right The feeling s oh so dynamite It s a groove thang So whatcha gonna do whatcha gonna do Keep your body move moving So whatcha gonna do whatcha gonna do Keep your body move moving Party people it s a silky fun and groove thang Party people it s a silky fun and groove thang Oh yeah We re moving on keeping strong Don t you let them steer you wrong It s a groove thang We re gonna give you what you want Just as long as you re around It s a groove thang We re moving on keeping strong Don t you let them steer you wrong It s a groove thang We re gonna give you what you want Just as long as you re around It s a groove thang yeah'
