Rank,Song,Artist,Year,Lyrics
1,"Breathe",Faith Hill,2000,b' I can feel the magic floating in the air Being with you gets me that way I watch the sunlight dance across your face and I ve Never been this swept away All my thoughts just seem to settle on the breeze When I m lying wrapped up in your arms The whole world just fades away The only thing I hear Is the beating of your heart Cause I can feel you breathe it s washing over me And suddenly I m melting into you There s nothing left to prove Baby all we need is just to be Caught up in the touch slow and steady rush Baby isn t that the way that love s supposed to be I can feel you breathe Just breathe In a way I know my heart is waking up As all the walls come tumbling down I m closer than I ve ever felt before And I know and you know There s no need for words right now Cause I can feel you breathe it s washing over me And suddenly I m melting into you There s nothing left to prove Baby all we need is just to be Caught up in the touch slow and steady rush Baby isn t that the way that love s supposed to be I can feel you breathe Just breathe Caught up in the touch The slow and steady rush Baby isn t that the way that love s supposed to be I can feel you breathe Just breathe I can feel the magic floating in the air Being with you gets me that way'
2,"Smooth",Santana,2000,b' Man it s a hot one Like seven inches from the midday sun I hear you whisper and the words melt everyone But you stay so cool My mu equita my Spanish Harlem Mona Lisa You re my reason for reason the step in my groove And if you say this life ain t good enough I would give my world to lift you up I could change my life to better suit your mood Because you re so smooth And it s just like the ocean under the moon It s the same as the emotion that I get from you You got the kind of loving that can be so smooth Gimme your heart make it real or else forget about it I ll tell you one thing If you would leave it would be a crying shame In every breath and every word I hear your name calling me out Out from the barrio you hear my rhythm from your radio You feel the turning of the world so soft and slow Turning you round and round And if you say this life ain t good enough I would give my world to lift you up I could change my life to better suit your mood Because you re so smooth And it s just like the ocean under the moon It s the same as the emotion that I get from you You got the kind of loving that can be so smooth Gimme your heart make it real or else forget about it And it s just like the ocean under the moon It s the same as the emotion that I get from you You got the kind of loving that can be so smooth Gimme your heart make it real or else forget about it Or else forget about it Or else forget about it Oh let s don t forget about it Let s don t forget about it Let s don t forget about it Let s don t forget about it Let s don t forget about it Let s don t forget about it '
3,"Maria Maria",Santana,2000,b' Ladies and gents turn up your sound systems to the sound of Carlos Santana and the G B it s The Product of get away blues from the refugee camp Oh Maria Maria She reminds me of a west side story Growing up in Spanish Harlem She s living the life just like a movie star Oh Maria Maria She fell in love in East L A To the sounds of the guitar yeah yeah Played by Carlos Santana Stop the looting stop the shooting Pick pocking on the corner See as the rich is getting richer The poor is getting poorer Se mira Maria on the corner Thinking of ways to make it better In my mailbox there s an eviction letter Signed by the judge said see you later Ahora vengo mama chula mama chula Ahora vengo mama chula Ahora vengo mama chula mama chula Ahora vengo mama chula Oh Maria Maria She reminds me of a west side story Growing up in Spanish Harlem She s living the life just like a movie star Oh Maria Maria She fell in love in East L A To the sounds of the guitar yeah yeah Played by Carlos Santana I said a la favella los colores The streets are getting hotter There is no water to put out the fire Ni gota de esperanza Se mira Maria on the corner Thinking of ways to make it better Then I looked up in the sky Hoping of days of paradise Ahora vengo mama chula mama chula Ahora vengo mama chula Ahora vengo mama chula mama chula Ahora vengo mama chula Ahora vengo mama chula mama chula Ahora vengo mama chula Ahora vengo mama chula mama chula Ahora vengo mama chula Maria you know you re my lover When the wind blows I can feel you Through the weather and even when we re apart It feels like we re together Maria yeah She reminds me of a west side story Growing up in Spanish Harlem She s living the life just like a movie star Oh Maria Maria She fell in love in East L A To the sounds of the guitar yeah yeah Played by Carlos Santana Put em up y all Carlos Santana with the Refugee Camp Wyclef Jerry Wonda Mr Santana G B Yo Carlos man you re making that guitar cry'
4,"I Wanna Know",Joe,2000,b' Yeah oh yeah Alright oh oh oh It s amazing how you knock me off my feet mmm Every time you come around me I get weak oh yeah Nobody ever made me feel this way oh You kiss my lips and then you take my breath away So I wanna know I wanna know what turns you on So I can be all that and more I d like to know what makes you cry So I can be the one who always makes you smile Girl he never understood what you were worth And he never took the time to make it work no Baby I m the kind of man who shows concern yes I do oh Anyway that I can please you let me learn So I wanna know I wanna know what turns you on So I can be all that and more I d like to know what makes you cry So I can be the one who always makes you smile Tell me what I gotta do to please you Baby anything you say I ll do Cause I only wanna make you happy From the bottom of my heart it s true Tell me what I gotta do to please you Baby anything you say I ll do Cause I only wanna make you happy From the bottom of my heart it s true I wish that I could take a journey through your mind alright And find emotions that you always try to hide babe oh I do believe that there s a love you wanna share oh oh I ll take good care of you lady have no fear oh So I wanna know I wanna know what turns you on So I can be all that and more I d like to know what makes you cry So I can be the one who always makes you smile Tell me what I gotta do to please you Baby anything you say I ll do Cause I only wanna make you happy From the bottom of my heart it s true Tell me what I gotta do to please you Baby anything you say I ll do Cause I only wanna make you happy From the bottom of my heart it s true I wanna know what turns you on So I can be all that and more I d like to know what makes you cry So I can be the one who always makes you smile I wanna know what turns you on So I can be all that and more'
5,"Everything You Want",Vertical Horizon,2000,b' Somewhere there s speaking It s already coming in Oh and it s rising at the back of your mind You never could get it Unless you were fed it Now you re here and you don t know why But under skinned knees and the skid marks Past the places where you used to learn You howl and listen Listen and wait for the Echoes of angels who won t return He s everything you want He s everything you need He s everything inside of you That you wish you could be He says all the right things At exactly the right time But he means nothing to you And you don t know why You re waiting for someone To put you together You re waiting for someone to push you away There s always another wound to discover There s always something more you wish he d say He s everything you want He s everything you need He s everything inside of you That you wish you could be He says all the right things At exactly the right time But he means nothing to you And you don t know why But you ll just sit tight And watch it unwind It s only what you re asking for And you ll be just fine With all of your time It s only what you re waiting for Out of the island Into the highway Past the places where you might have turned You never did notice But you still hide away The anger of angels who won t return He s everything you want He s everything you need He s everything inside of you That you wish you could be He says all the right things At exactly the right time But he means nothing to you And you don t know why I am everything you want I am everything you need I am everything inside of you That you wish you could be I say all the right things At exactly the right time But I mean nothing to you and I don t know why And I don t know why Why I don t know'
6,"Say My Name",Destiny's Child,2000,b' Say my name say my name If no one is around you Say baby I love you If you ain t runnin game Say my name say my name You actin kinda shady Ain t callin me baby Why the sudden change Say my name say my name If no one is around you Say baby I love you If you ain t runnin game Say my name say my name You actin kinda shady Ain t callin me baby Better say my name Any other day I would call you would say Baby how s your day But today it ain t the same Every other word is uh huh yeah ok Could it be that you are at the crib with another lady If you took it there first of all let me say I am not the one to sit around and be played So prove yourself to me if I m the girl that you claim Why don t you say the things that you said to me yesterday Something s going down that s the way it seems If nobody s holding you back from me When you say everything to me times two If somebody s there then tell me who Say my name say my name If no one is around you Say baby I love you If you ain t runnin game Say my name say my name You actin kinda shady Ain t callin me baby Why the sudden change Say my name say my name If no one is around you Say baby I love you If you ain t runnin game Say my name say my name You actin kinda shady Ain t callin me baby Better say my name What is up with this Tell the truth who you with How would you like it if I came over with my clique Don t try to change it now saying you gotta bounce When two seconds ago you said you just got in the house It s hard to believe that you are at home by yourself When I just heard the voice heard the voice of someone else Just this question why do you feel you gotta lie Gettin caught up in your game when you cannot say my name Something s going down that s the way it seems If nobody s holding you back from me When you say everything to me times two If somebody s there then tell me who Say my name say my name If no one is around you Say baby I love you If you ain t runnin game Say my name say my name You actin kinda shady Ain t callin me baby Why the sudden change Say my name say my name If no one is around you Say baby I love you If you ain t runnin game Say my name say my name You actin kinda shady Ain t callin me baby Better say my name Yeah yeah yeah yeah yeah Yeah yeah yeah yeah Yeah yeah yeah yeah Yeah yeah yeah yeah Yeah yeah yeah yeah yeah yeah yeah yeah Yeah yeah yeah yeah Yeah yeah yeah yeah Ooh ooh oh Something s going down that s the way it seems If nobody s holding you back from me When you say everything to me times two If somebody s there then tell me who Say my name say my name If no one is around you Say baby I love you If you ain t runnin game Say my name say my name You actin kinda shady Ain t callin me baby Why the sudden change Say my name say my name If no one is around you Say baby I love you If you ain t runnin game Say my name say my name You actin kinda shady Ain t callin me baby Better say my name Say my name say my name If no one is around you Say baby I love you If you ain t runnin game Say my name say my name You actin kinda shady Ain t callin me baby Why the sudden change Say my name say my name If no one is around you Say baby I love you If you ain t runnin game Say my name say my name You actin kinda shady Ain t callin me baby Better say my name Thou shall know if she can t love you'
7,"I Knew I Loved You",Savage Garden,2000,b' Maybe it s intuition But some things you just don t question Like in your eyes I see my future in an instant And there it goes I think I ve found my best friend I know that it might sound more than a little Crazy but I believe I knew I loved you before I met you I think I dreamed you into life I knew I loved you before I met you I have been waiting all my life There s just no rhyme or reason Only this sense of completion And in your eyes I see the missing pieces I m searching for I think I found my way home I know that it might sound more than a little Crazy but I believe I knew I loved you before I met you I think I dreamed you into life I knew I loved you before I met you I have been waiting all my life I am complete now that I found you I knew I loved you before I met you I think I dreamed you into life I knew I loved you before I met you I have been waiting all my life I knew I loved you before I met you I think I dreamed you into my life I knew I loved you before I met you I have been waiting all my life'
8,"Amazed",Lonestar,2000,b' Every time our eyes meet This feeling inside me Is almost more than I can take Baby when you touch me I can feel how much you love me And it just blows me away I ve never been this close to anyone or anything I can hear your thoughts I can see your dreams I don t know how you do what you do I m so in love with you It just keeps getting better I want to spend the rest of my life With you by my side Forever and ever Every little thing that you do Baby I m amazed by you The smell of your skin The taste of your kiss The way you whisper in the dark Your hair all around me Baby you surround me You touch every place in my heart Oh it feels like the first time every time I want to spend the whole night in your eyes I don t know how you do what you do I m so in love with you It just keeps getting better I want to spend the rest of my life With you by my side Forever and ever Every little thing that you do Baby I m amazed by you Every little thing that you do I m so in love with you It just keeps getting better Oh girl I want to spend the rest of my life With you by my side Forever and ever Every little thing that you do Oh every little thing that you do Every little thing that you do Baby I m amazed by By you'
9,"Bent",Matchbox Twenty,2000,b' And if I fall along the way Pick me up and dust me off And if I get too tired to make it Be my breath so I can walk And if I need some other love then Give me more than I can stand And when my smile gets old and faded Wait around I ll smile again Shouldn t be so complicated Just hold me and then Oh just hold me again Can you help me I m bent I m so scared that I ll never Get put back together Keep breaking me in And this is how we will end With you and me bent And if I couldn t sleep could you sleep Could you paint me better off And could you sympathize with my needs I know you think I need a lot I started out clean but I m jaded Just phoning it in Oh just breaking the skin Can you help me I m bent I m so scared that I ll never Get put back together Keep breaking me in And this is how we will end With you and me bent Start bending me It s never enough till I feel all your pieces Start bending me Keep bending me until I m completely broken in Shouldn t be so complicated Just touch me and then Oh just touch me again Can you help me I m bent I m so scared that I ll never Get put back together Keep breaking me in And this is how we will end With you and me landin without understanding Hell I d go there again Can you help me I m bent I m so scared that I ll never Get put back together Yeah you re breaking me in And this is how we will end With you and me bent'
10,"He Wasn't Man Enough",Toni Braxton,2000,b' Darkchild Oh yeah yeah Toni Braxton oh Ha ha uh huh Yeah uh uh Darkchild yeah Listen girl Who do you think I am Don t you know that he was my man But I chose to let him go So why do you act like I still care about him Looking at me like I m hurt When I m the one who said I didn t want it to work Don t you forget I had him first What you thinkin Stop blaming me He wasn t man enough for me If you don t know now here s your chance I ve already had your man Do you wonder just where he s been yeah And not be worried about him Now it s time you know the truth I think he s just the man for you What are you thinking Did you know about us back then Do you know I dumped your husband girlfriend I m not thinking bout him But you married him Do you know I made him leave Do you know he begged to stay with me He wasn t man enough for me Listen girl Didn t he tell you the truth If not then why don t you ask him Then maybe you can be more into him Instead of worryin about me And hopefully you won t find All of the reasons why his love didn t count And why we couldn t work it out What you thinkin Stop blaming me He wasn t man enough for me If you don t know now here s your chance See I ve already had your man Do you wonder just where he s been yeah And not be worried about him yeah Now it s time you know the truth I think he s just the man for you What are you thinking Did you know about us back then Do you know I dumped your husband girlfriend I m not thinking bout him But you married him Do you know I made him leave Do you know he begged to stay with me He wasn t man enough for me What are you thinking Did you know about us back then Do you know I dumped your husband girlfriend I m not thinking bout him But you married him Do you know I made him leave Do you know he begged to stay with me He wasn t man enough for me Oh yeah So many reasons why our love is through yeah What makes you think he ll be good to you no It makes no sense cause he will never change Girl you better recognize the game oh yeah What are you thinking Did you know about us back then Do you know I dumped your husband girlfriend I m not thinking bout him But you married him Do you know I made him leave Do you know he begged to stay with me He wasn t man enough for me What are you thinking Did you know about us back then Do you know I dumped your husband girlfriend I m not thinking bout him But you married him Do you know I made him leave Do you know he begged to stay with me He wasn t man enough for me What are you thinking Did you know about us back then Do you know I dumped your husband girlfriend I m not thinking bout him But you married him Do you know I made him leave Do you know he begged to stay with me He wasn t man enough for me'
11,"Higher",Creed,2000,b' When dreaming I m guided to another world Time and time again At sunrise I fight to stay asleep Because I don t want to leave the comfort of this place Because there s a hunger a longing to escape From the life I live when I m awake So let s go there Let s make our escape Come on let s go there Let s ask Can we stay Can you take me higher To a place where blind men see Can you take me higher To a place with golden streets Although I would like our world to change It helps me to appreciate Those nights and those dreams But my friend I d sacrifice all those nights If I could make the Earth and my dreams the same The only difference is To let love replace all our hate So let s go there Let s make our escape Come on let s go there Let s ask Can we stay Can you take me higher To a place where blind men see Can you take me higher To a place with golden streets So let s go there Let s make our escape Come on let s go there Let s ask Can we stay Up high I feel like I m alive for the very first time Set up high I m strong enough to take these dreams and make them mine Set up high I m strong enough to take these dreams and make them mine Can you take me higher To a place where blind men see Can you take me higher To a place with golden streets Can you take me higher To a place where blind men see Can you take me higher To a place with golden streets'
12,"Try Again",Aaliyah,2000,b' It s been a long time we shouldn t have left you Without a dope beat to step to Step to step to step to step to step to scratching It s been a long time we shouldn t have left you Without a dope beat to step to Step to step to step to step to scratching Baby girl oh What would you do to get to me What would you say to have your way Would you give up or try again If I hesitated to let you in Now would you be yourself or play your role Tell all the boys I keep it low If I say no would you turn away Or play me off or would you stay And if at first you don t succeed Then dust yourself off and try again You can dust it off and try again try again Cause if at first you don t succeed You can dust it off and try again Dust yourself off and try again try again I m into you you into me But I can t let it go so easily Not til I see whether this could be Could be eternity or just a week Ayo our chemistry is off the chain It s perfect now but will it change This ain t a yes this ain t a no Just do your thing we ll see how it goes And if at first you don t succeed Then dust yourself off and try again You can dust it off and try again try again Cause if at first you don t succeed You can dust it off and try again Dust yourself off and try again try again You don t wanna throw it all away I might be shy on the first date what about the next date Huh huh huh huh I said you don t wanna throw it all away I might be bugging on the first date what about the next date Huh huh huh huh And if at first you don t succeed Then dust yourself off and try again You can dust it off and try again try again Cause if at first you don t succeed You can dust it off and try again Dust yourself off and try again try again And if at first you don t succeed Then dust yourself off and try again You can dust it off and try again try again Cause if at first you don t succeed You can dust it off and try again Dust yourself off and try again try again And if at first you don t succeed Then dust yourself off and try again You can dust it off and try again try again Cause if at first you don t succeed You can dust it off and try again Dust yourself off and try again try again It s been a long time we shouldn t have left you Without a dope beat to step to Step to step to step to step to Step to step to freaky freaky It s been a long time we shouldn t have left you Without a dope beat to step to Step to step to step to step to Step to step to freaky freaky And if at first you don t succeed Then dust yourself off and try again You can dust it off and try again try again Cause if at first you don t succeed You can dust it off and try again Dust yourself off and try again try again It s been a long time we shouldn t have left you Without a dope beat to step to Step to step to step to step to Step to step to freaky freaky It s been a long time we shouldn t have left you Without a dope beat to step to Step to step to step to step to Step to step to freaky freaky'
