Rank,Song,Artist,Year,Lyrics
67,"Only God Knows Why",Kid Rock,2000,b'I ve been sitting here trying to find myself I get behind myself I need to rewind myself Looking for the payback listen for the playback They say that every man bleeds just like me And I feel like number one yet I m last in line I watch my youngest son and it helps to pass the time I take too many pills that helps to ease the pain I made a couple dollar bills still I feel the same Everybody knows my name they say it way out loud A lot of folks fuck with me it s hard to hang out in crowds I guess that s the price you pay to be some big shot like I am Outstretched hands and one night stands Still I can t find love And when your walls come tumbling down I will always be around And when your walls come tumbling down I will always be around People don t know about the things I say and do They don t understand about the shit I ve been through Its been so long since I ve been home I ve been gone I ve been gone way too long Maybe I ve forgotten all the things I miss Oh somehow I know there s more to life than this I ve said it too many times and I still stand firm You get what you put in and people get what they deserve Still I ain t seen mine no I ain t seen mine I ve been givin just ain t been gettin I ve been walkin that there line So I think I ll keep walking with my head held high I keep moving on and only God knows why Only God Only God Only God knows why Only God knows why why why Only God knows why Take me to the river ey Won t you take me to the river hey hey yeah'
68,"Shake Ya Ass",Mystikal,2000,b'Mmm Mmm mmm mmm Oooh OOOH Shake ya ass but watch yourself Shake ya ass show me what you working with I came here with my dick in my hand Don t make me leave here with my foot in yo ass be cool And don t worry bout how I m ripping this shit When I m flipping what I m kicking nigga that s just what I do I m effervescent and I m off that crescent Nastier than a full grown German Shepherd motherfucker keep stepping They don t fuck with me and they don t Y all bitches can t catch me and you won t Pay ya fare fix your hair throw that pussy Got a Prada for bonapalies and Donna for my babooski You think I m tricking Bitch I ain t trippin I m buyin if you got nice curves for your iceberg Drinkin Henn and acting like it do something to me Hope this indecent proposal make you do somethin with me Fuck a dollar girl pick up fifty And fuck that coward girl you need a real nigga Off top knick a boxers hurting shit Bend over ho show me what you workin with Shake ya ass but watch yourself Shake ya ass show me what you working with Attention all y all players and pimps Right now in the place to be I thought I told y all niggas before Y all niggas can t fuck with me Now this ain t for no small booties No sir cause that won t pass But if you feel you got the biggest one Then momma come shake ya ass Shake ya ass but watch yourself Shake ya ass show me what you working with I like my women fire like CAY ENNE Chocolate and bowlegged when I m runnin up behind her Go head do your job pop the lock let the cock out For girl don t lie you know you wanna go back to my house The Man Right Chea wanna get under that dress right there You spicy cajun we gon a good time over there You better suck the head on them there crawfish And you gotta bend all the way over to dance off this Handle yo business but I know you do it way better you dead wrong So if you talking bout how niggas make noise when you pass by Get yo fine ass on the floor girl this yo fuckin song Do yo thang dont be scared cause you gon get served You get mine then you gon get yours Bout to make yo ass love it Raise it up show the G string hustling hustling Attention all y all players and pimps Right now in the place to be I thought I told y all niggas before Y all niggas can t fuck with me Now this ain t for no small booties No sir cause that won t pass But if you feel you got the biggest one Then momma come shake ya ass Shake ya ass but watch yourself Shake ya ass show me what you working with Stop yo cryin heffer I don t need all that I got a job for you the braided up pimp is back Break them handcuffs fuck you nigga move something And if they ask you what you doin say Ooohh nuttin And we been doin for the past 2 somethin And I ve been beatin that pussy up not smooth fucking You can betcha bottom dollar if that pussy fire You gon holla Michael Tyler So don t act like you don t be backin that stuff up Girl in the club cause that s what you got ass for Wobble wobble I m infatuated Bitch ride a dick like she making a baby And I see that we gon have to go to a quiet corner for just us two an Don t worry about who looking just keep on doing what you doing Cause a nigga like me gon get to work before I know the girl Bitch what s happening let em see show the world Attention all y all players and pimps Right now in the place to be I thought I told y all niggas before Y all niggas can t fuck with me Now this ain t for no small booties No sir cause that won t pass But if you feel you got the biggest one Then momma come shake ya ass Shake ya ass but watch yourself Shake ya ass show me what you working with Uhh OOOH WEE Good lawd Damn '
69,"Bag Lady",Erykah Badu,2000,b'Bag lady you gone hurt your back Dragging all them bags like that I guess nobody ever told you All you must hold onto Is you is you is you One day all them bags gone get in your way One day all them bags gone get in your way I said one day all them bags gone get in your way One day all them bags gone get in your way So pack light Ooh Ooh Bag Lady you gone miss your bus You can t hurry up Cause you got too much stuff When they see you coming Niggas take off running From you it s true oh yes they do One day he gone say you crowding my space One day he gone say you crowding my space I said one day he gone say you crowding my space One day he gone say you crowding my space So pack light Ooh Ooh Girl I know sometimes it s hard And we can t let go Oh when someone hurts you oh so bad inside You can t deny it you can t stop crying So oh oh oh If you start breathin So where my garbage bag lady What about my grocery bag lady I m talking to my Gucci bag lady What about my paper sack lady What about my nickel bag lady Backpack on ya back back lady What about my booty bag lady And what about the cheeba sack babies So what about the plastic bag lady And my baby bag mamas yeah All my bookbag ladies Ziploc bag lady What about my Fendi bag ladies All of my shopping bag ladies '
70,"Meet Virginia",Train,2000,b'She doesn t own a dress Her hair is always a mess If you catch her stealin she won t confess She s beautiful Smokes a pack a day No wait that s me but anyway She doesn t care a thing about that hey She thinks I m beautiful Meet Virginia She never compromises Loves babies and surprises Wears high heels when she exercises Ain t that beautuiful Meet Virginia Well she wants to be the Queen Then she thinks about her scene Pulls her hair back as she screams I don t really wanna be the Queen Daddy wrestles alligators Mama works on carburetors Her brother is a fine mediator For the President And here she is again on the phone Just like me hates to be alone We just like to sit at home And rip on the President Meet Virginia Mmmm Well she wants to live her life Then she thinks about her life Pulls her hair back as she screams I don t really wanna live this life No mama No mama No mama No mama She only drinks coffee at midnight When the moment is not right Her timing is quite unusual You see her confidence is tragic But her intuition magic And the shape of her body Unusual Meet Virgina I can t wait to Meet Virginia Yeah e yeah hey hey hey Well she wants to be the queen And she thinks about her scene Well she wants to live her life Then she thinks about her life Pulls her hair back as she screams I don t really wanna be the queen I I don t really wanna be the queen I I don t really wanna be the queen I I don t really wanna live this'
71,"Party Up (Up in Here)",DMX,2000,b' Y all gon make me lose my mind Up in here up in here Y all gon make me go all out Up in here up in here Y all gon make me act a fool Up in here up in here Y all gon make me lose my cool Up in here up in here If I gotsta bring it to you cowards then it s gonna be quick Aight all your mans up in the jail before sucked my dick And all them other cats you run with Get done with dumb quick How the fuck you gonna cross the dog with some bum shit Aight there go the gun click 911 shit All over some dumb shit ain t that some shit Y all niggas remind me of a strip club Cause every time you come around it s like what I just gotta get my dick sucked And I don t know who the fuck you think you talking to But I m not him aight Slim So watch what you do Or you gon find yourself buried next to someone else And we all thought you loved yourself But that couldn t have been the issue Or maybe they just saying that now cause they miss you Shit a nigga tried to diss you That s why you laying on your back Looking at the roof of the church Preacher telling the truth and it hurts Y all gon make me lose my mind Up in here up in here Y all gon make me go all out Up in here up in here Y all gon make me act a fool Up in here up in here Y all gon make me lose my cool Up in here up in here Off the chain I leave niggas soft in the brain Cause niggas still want the fame off the name First of all you ain t rapped long enough To be fucking with me and you you ain t strong enough So whatever it is you puffin on That got you think that you Superman I got the Kryptonite Should I smack him with my dick and the mic Y all niggas is characters not even good actors What s gon be the outcome Hmm let s add up all the factors You re wack you re twisted your girl s a ho You re broke the kid ain t yours and e rybody know Your old man say you stupid you be like So I love my baby mother I ll never let her go I m tired of weak ass niggas whining over puss That don t belong to them fuck is wrong with them They fuck it up for real niggas like my mans and them Who get it on on the strength of the hands with them man Y all gon make me lose my mind Up in here up in here Y all gon make me go all out Up in here up in here Y all gon make me act a fool Up in here up in here Y all gon make me lose my cool Up in here up in here I bring down rains so heavy it hurts the head No more talking put him in the dirt instead You keep walking lest you tryin to end up red Cause if I end up fed y all end up dead Cause you s a soft type nigga Fake up North type nigga push like a soft white nigga Dog is a dog blood s thicker than water We done been through the mud and we quicker to slaughter The bigger the order the more guns we brung out We run up in there e rybody come out don t nobody run out Sun in to sun out I ma keep the gun out Nigga running his mouth I ma blow his lung out Listen Your ass is about to be missin You know who gon find you Some old man fishin Grandma wishin your soul s at rest But it s hard to digest with the size of the hole in your chest Y all gon make me lose my mind Up in here up in here Y all gon make me go all out Up in here up in here Y all gon make me act a fool Up in here up in here Y all gon make me lose my cool Up in here up in here One two meet me outside Meet me outside meet me outside All my Ruff Ryders gon meet me outside Meet me outside meet me outside All my big ballers gon meet me outside Meet me outside meet me outside All my fly ladies gon meet me outside Meet me outside meet me outside All my street street peoples meet me outside Meet me outside outside motherfucker X has got y all bouncin again Bouncin again bounce bouncin again Dark Man X got y all bouncin again Bouncin again bounce bouncin again Swizz Beatz got y all bouncin again Bouncin again bounce bouncin again Ruff Ryders got y all bouncin again Bouncin again bounce bouncin again Dark Man keep you bouncin again Bouncin again bounce bouncin again Dark Man keep you bouncin again Bouncin again bounce bouncin again All my streets they bouncin again Bouncin again we re bouncin again Swizz Swizz Beatz we re bouncin again Bouncin again and we bouncin again Double R keep it comin Ain t nothin y all ain t nothin y all can do now'
72,"Case of the Ex",Mýa,2000,b' It s after midnight And she s on your phone Saying come over Cause she s all alone I could tell it was Your ex by your tone Why is she calling now After so long Now what is it that she wants Tell me what is it that she needs Did she hear about the brand new Benz That you just bought for me Cause y all didn t have no kids Didn t share no mutual friends And you told me that she turned trick When y all broke up in 96 What you gon do when you can t say no When the feelings start to show boy I really need to know and How you gonna act How you gonna handle that What you gon do when she wants you back What you gon do when you can t say no When the feelings start to show boy I really need to know and How you gonna act How you gonna handle that What you gon do when she wants you back There s no need to Reminisce bout the past Obviously cause That shit did not last I know how a woman Will try to game you Don t get caught up Because baby you ll lose Tell me why she on the phone in the middle of the night Tell me why she in your life tryna get what s mine She don t know me she s about to know me I m in your life and that s how it s gon be I saw a photo she ain t even all that So if you want her back then take her back Cause game recognize game I can do the same thing Get it right change or take back this ring '
73,"Forgot About Dre",Dr. Dre,2000,b' Y all know me still the same OG But I been low key Hated on by most these niggas With no cheese no deals and no G s No wheels and no keys No boats no snowmobiles and no skis Mad at me cause I can finally afford To provide my family with groceries Got a crib with a studio And it s all full of tracks To add to the wall full of plaques Hangin up in the office in back of my house like trophies Did y all think I ma let my dough freeze Ho please You better bow down on both knees Who you think taught you to smoke trees Who you think brought you the oldies Eazy E s Ice Cube s and D O C s The Snoop D O double G s And the group that said Motherfuck the police Gave you a tape full of dope beats To bump when you stroll through in your hood And when your album sales weren t doin too good Who s the Doctor they told you to go see Y all better listen up closely All you niggas that said that I turned pop Or The Firm flopped Y all are the reason that Dre ain t been gettin no sleep So fuck y all all of y all If y all don t like me blow me Y all are gon keep fuckin around with me And turn me back to the old me Nowadays everybody wanna talk Like they got somethin to say But nothin comes out when they move their lips just a bunch of gibberish And motherfuckers act like they forgot about Dre Nowadays everybody wanna talk Like they got somethin to say But nothin comes out when they move their lips just a bunch of gibberish And motherfuckers act like they forgot about Dre So what do you say to somebody you hate Or anyone tryna bring trouble your way Wanna resolve things in a bloodier way Just study a tape of N W A One day I was walkin by With a Walkman on when I caught a guy Gave me an awkward eye And strangled him up in the parking lot with his Karl Kani I don t give a fuck if it s dark or not I m harder than me tryna park a Dodge When I m drunk as fuck Right next to a humongous truck in a two car garage Hoppin out with two broken legs Tryna walk it off Fuck you too bitch Call the cops I ma kill you and them loud ass motherfuckin barkin dogs And when the cops came through Me and Dre stood next to a burnt down house With a can full of gas and a hand full of matches And still weren t found out So from here on out it s the Chronic II Startin today and tomorrow s anew And I m still loco enough To choke you to death with a Charleston Chew Chicka chicka chicka Slim Shady Hotter than a set of twin babies In a Mercedes Benz with the windows up When the temp goes up to the mid 80s Callin men ladies Sorry Doc but I been crazy There s no way that you can save me It s okay go with him Hailie Nowadays everybody wanna talk Like they got somethin to say But nothin comes out when they move their lips just a bunch of gibberish And motherfuckers act like they forgot about Dre Nowadays everybody wanna talk Like they got somethin to say But nothin comes out when they move their lips just a bunch of gibberish And motherfuckers act like they forgot about Dre If it was up to me you motherfuckers d stop Comin up to me with your hands out Lookin up to me like you want somethin free When my last CD was out you weren t bumpin me But now that I got this little company Everybody wanna come to me Like it was some disease but you won t get a crumb from me Cause I m from the streets of C Compton I told em all All em little gangstas who you think helped mold em all Now you wanna run around talkin bout guns like I ain t got none What you think I sold em all Cause I stay well off Now all I get is hate mail all day sayin Dre fell off What cause I been in the lab With a pen and a pad tryin to get this damn label off I ain t havin that This is the millennium of Aftermath It ain t gon be nothin after that So give me one more platinum plaque and fuck rap you can have it back So where s all the Mad Rappers at It s like a jungle in this habitat But all you savage cats know that I was strapped with gats While you were cuddlin a Cabbage Patch Nowadays everybody wanna talk Like they got somethin to say But nothin comes out when they move their lips just a bunch of gibberish And motherfuckers act like they forgot about Dre Nowadays everybody wanna talk Like they got somethin to say But nothin comes out when they move their lips just a bunch of gibberish And motherfuckers act like they forgot about Dre Nowadays everybody wanna talk Like they got somethin to say But nothin comes out when they move their lips just a bunch of gibberish And motherfuckers act like they forgot about Dre'
74,"That's the Way",Jo Dee Messina,2000,b' Everybody wants an easy ride On the merry go round that we call life Take a drive on cruise control Then you wait to find it s a winding road I had my dreams in view When the money ran out and the engine blew Hung my tears out to dry Then my dreams fell out of that clear blue sky And I I was walkin the clouds Feelin so safe and sound Somethin else knocks me down Well oh that s the way it is You gotta roll with the punches That s the way it goes You gotta bend when the wind blows You live you learn You crash and burn It s hit or miss And that s the way it is One fine day you wake up Completely hoplessly fallin in love He s just what you re lookin for The only problem is that the man s not sure Another guy ll give you everything The only problem is you don t feel a thing Well I know from experience Nothin s ever gonna make perfect sense Oh one day you get what you want But it s not what you think Then you get what you need Well oh that s the way it is You gotta roll with the punches That s the way it goes You gotta bend when the wind blows You live you learn You crash and burn It s hit or miss And that s the way it is Yeah They say your soul is growin but Sometimes I feel like throwin somethin And that s the way it is You gotta roll with the punches And that s the way it goes You gotta bend when the wind blows That s the way it is You gotta roll with the punches That s the way it goes You gotta bend when the wind blows You live you learn You crash and burn It s hit or miss Oh and that s the way it is Oh that s the way it is Yeah That s the way it is That s the way it is You gotta roll with the punches Oh you gotta bend when the wind blows Oh that s the way it goes That s the way it is That s the way it goes Oh yeah You gotta roll with the punches'
75,"Swear It Again",Westlife,2000,b' I wanna know Who ever told you I was letting go Of the only joy that I have ever known Girl they were lying Just look around And all of the people that we used to know Have just given up they wanna let it go But we re still trying So you should know this love we share was never made to die I m glad we re on this one way street just you and I Just you and I I m never gonna say goodbye Cause I never wanna see you cry I swore to you my love would remain And I swear it all over again and I I m never gonna treat you bad Cause I never wanna see you sad I swore to share your joy and your pain And I swear it all over again All over again Some people say That everything has got its place in time Even the day must give way to the night But I m not buying Cause in your eyes I see a love that burns eternally And if you see how beautiful you are to me You ll know I m not lying Sure there ll be times we wanna say goodbye but even if we try There are some things in this life won t be denied Won t be denied I m never gonna say goodbye Cause I never wanna see you cry I swore to you my love would remain And I swear it all over again and I I m never gonna treat you bad Cause I never wanna see you cry I swore to share your joy and your pain And I swear it all over again The more I know of you is the more I know I love you And the more that I m sure I want you forever and ever more And the more that you love me the more that I know Oh that I m never gonna let you go Gotta let you know that I I m never gonna say goodbye Cause I never wanna see you cry I swore to you my love would remain And I swear it all over again and I I m never gonna treat you bad Cause I never wanna see you sad I swore to share your joy and your pain And I swear it all over again All over again All over again And I swear it all over again'
76,"The Next Episode",Dr. Dre,2000,b' La da da da dah It s the motherfuckin D O double G La da da da dah You know I m mobbin with the D R E yeah yeah yeah You know who s back up in this motherfucker What What What What So blaze the weed up then blaze it up blaze it up Just blaze that shit up nigga Yeah sup Snoop Top Dogg bite em all nigga burn the shit up D P G C my nigga turn that shit up C P T L B C yeah we hookin back up And when they bang this in the club baby you got to get up Thug niggas drug dealers yeah they givin it up Lowlife yo life boy we livin it up Takin chances while we dancin in the party for sure Slipped my ho a forty fo when she got in the back do Bitches lookin at me strange but you know I don t care Step up in this motherfucker just a swangin my hair Bitch quit talkin Crip walk if you down with the set Take a bullet with some dick and take this dope on this jet Out of town put it down for the Father of Rap And if yo ass get cracked bitch shut yo trap Come back get back that s the part of success If you believe in the X you ll be relievin your stress La da da da dah It s the motherfuckin D R E La da da da dah You know I m mobbin with the D O double G Straight off the fuckin streets of C P T King of the beats you ride to em in your Fleet Or Coupe DeVille rollin on dubs How you feel Whoopty whoop nigga what Dre and Snoop chronic d out in the llac With D O C in the back sippin on gnac Clip in the strap dippin through hoods Compton Long Beach Inglewood South Central out to the West Side it s California Love This California bud got a nigga gang of pub I m on one I might bail up in the Century Club With my jeans on and my team strong Get my drink on and my smoke on Then go home with somethin to poke on Loc it s on for the two triple oh Comin real it s the next episode Hold up hey For my niggas who be thinkin we soft we don t play We gonna rock it til the wheels fall off Hold up hey For my niggas who be actin too bold take a seat Hope you ready for the next episode Hey hey hey hey Smoke weed every day '
77,"From the Bottom of My Broken Heart",Britney Spears,2000,b' Never look back we said How was I to know I d miss you so Loneliness up ahead emptiness behind Where do I go And you didn t hear All my joy through my tears All my hopes through my fears Did you know still I miss you somehow From the bottom of my broken heart There s just a thing or two I d like you to know You were my first love you were my true love From the first kisses to the very last rose From the bottom of my broken heart Even though time may find me somebody new You were my real love I never knew love til there was you From the bottom of my broken heart Baby I said Please stay Give our love a chance for one more day We could ve worked things out Taking time is what love s all about But you put a dart Through my dreams through my heart And I m back where I started again Never thought it would end From the bottom of my broken heart There s just a thing or two I d like you to know You were my first love you were my true love From the first kisses to the very last rose From the bottom of my broken heart Even though time may find me somebody new You were my real love I never knew love til there was you From the bottom of my broken heart You promised yourself But to somebody else And you made it so perfectly clear Still I wish you were here From the bottom of my broken heart There s just a thing or two I d like you to know You were my first love you were my true love From the first kisses to the very last rose From the bottom of my broken heart Even though time may find me somebody new You were my real love I never knew love til there was you From the bottom of my broken heart Never look back we said How was I to know I d miss you so '
