Rank,Song,Artist,Year,Lyrics
53,"Wifey",Next,2000,b' You never try me Always stood right by me Make living lively highly Spoken of my only love the only one You re my wifey Make my life complete Sweet but you know when to flip it street Freak but only when it comes to me See that s why you re my wifey This you should know Cause you had my mind blown oh oh Da jump at the club on bump like what I had to have you babe Saw you outside passenger side Cause I let my best friend drive You was in line That s when you caught my eyes girl You were so beautiful girl It was so critical girl You looked so crucial girl Something about you is everything You are mine You never try me Always stood right by me Make living lively highly Spoken of my only love the only one You re my wifey Make my life complete Sweet but you know when to flip it street Freak but only when it comes to me See that s why you re my wifey You know you re sexy too I like your attitude I ain t even mad at you Girl you re still my boo Either braids or weave Skirt or jeans you re still my queen Baby girl go do your thing I m so glad you re on my team You are so beautiful girl It is so critical girl You look so crucial girl Something about you is everything You are mine You never try me Always stood right by me Make living lively highly Spoken of my only love the only one You re my wifey Make my life complete Sweet but you know when to flip it street Freak but only when it comes to me See that s why you re my wifey Someone I can spend my life with Leave the keys to the Benz Wedding band with the gems You re someone I feel all right with Someone to have my kids The one I can depend on You never try me Always stood right by me Make living lively highly Spoken of my only love the only one You re my wifey Make my life complete Sweet but you know when to flip it street Freak but only when it comes to me See that s why you re my wifey Skinny designer fit real jiggy Ain t afraid to hump with me when we get busy Ride out I licky licky til I get dizzy Toes done fresh scent I think it s sizzy Hoes none she was the one down with me Used to struggle now we bubble countin G s with me Pop the champagne let s take a sippy sippy Describe you I try to You re my wifey Will you be my wifey Say you ll be my wifey Will you be my wifey Say you ll be my wifey '
54,"Wonderful",Everclear,2000,b' Hey ain t life wonderful Wonderful wonderful wonderful Isn t it wonderful now I close my eyes when I get too sad I think thoughts that I know are bad Close my eyes and I count to ten Hope it s over when I open them I want the things that I had before Like a Star Wars poster on my bedroom door I wish I could count to ten Make everything be wonderful again Hope my mom and I hope my dad Will figure out why they get so mad Hear them scream I hear them fight They say bad words that make me wanna cry Close my eyes when I go to bed And I dream of angels who make me smile I feel better when I hear them say Everything will be wonderful someday Promises mean everything when you re little And the world s so big I just don t understand how You can smile with all those tears in your eyes Tell me everything is wonderful now Please don t tell me everything is wonderful now I go to school and I run and play I tell the kids that it s all okay I laugh aloud so my friends won t know When the bell rings I just don t wanna go home Go to my room and I close my eyes I make believe that I have a new life I don t believe you when you say Everything will be wonderful someday Promises mean everything when you re little And the world is so big I just don t understand how You can smile with all those tears in your eyes When you tell me everything is wonderful now No No I don t wanna hear you tell me everything is wonderful now No No I don t wanna hear you tell me everything is wonderful now I don t wanna hear you say That I will understand someday No no no no I don t wanna hear you say You both have grown in a different way No no no no I don t wanna meet your friends And I don t wanna start over again I just want my life to be the same Just like it used to be Some days I hate everything I hate everything Everyone and everything Please don t tell me everything is wonderful now I don t wanna hear you tell me everything is wonderful now'
55,"Oops!... I Did It Again",Britney Spears,2000,b' Yeah yeah Yeah yeah yeah yeah yeah yeah Yeah yeah yeah yeah yeah yeah I think I did it again I made you believe we re more than just friends oh baby It might seem like a crush But it doesn t mean that I m serious Cause to lose all my senses That is just so typically me ooh baby baby Oops I did it again I played with your heart Got lost in the game Oh baby baby Oops you think I m in love That I m sent from above I m not that innocent You see my problem is this I m dreaming away Wishing that heroes they truly exist I cry watching the days Can t you see I m a fool in so many ways But to lose all my senses That is just so typically me oh baby oh Oops I did it again I played with your heart Got lost in the game Oh baby baby Oops you think I m in love That I m sent from above I m not that innocent Yeah yeah yeah yeah yeah yeah Yeah yeah yeah yeah yeah yeah All aboard Britney before you go there s something I want you to have Oh it s beautiful But wait a minute isn t this Yeah yes it is But I thought the old lady dropped it into the ocean in the end Well baby I went down and got it for ya Aw you shouldn t have Oops I did it again to your heart Got lost in this game oh baby Oops you think that I m sent from above I m not that innocent Oops I did it again I played with your heart Got lost in the game Oh baby baby Oops you think I m in love That I m sent from above I m not that innocent Oops I did it again I played with your heart Got lost in the game Oh baby baby Oops you think I m in love That I m sent from above I m not that innocent'
56,"I Wanna Love You Forever",Jessica Simpson,2000,b' You set my soul at ease Chased darkness out of view Left your desperate spell on me Say you feel it too I know you do I ve got so much more to give This can t die I yearn to live Pour yourself all over me And I ll cherish every drop here on my knees I wanna love you forever And this is all I m asking of you 10 000 lifetimes together Is that so much for you to do Cause from the moment that I saw your face And felt the fire in your sweet embrace I swear I knew I m gonna love you forever My mind fails to understand What my heart tells me to do And I d give up all I have just to be with you And that would do I ve always been taught to win And I never thought I d fall Be at the mercy of a man I ve never been Now I only want to be right where you are I wanna love you forever And this is all I m asking of you 10 000 lifetimes together Is that so much for you to do Cause from the moment that I saw your face And felt the fire in your sweet embrace I swear I knew I m gonna love you forever In my life I ve learned that heaven never waits no Let s take this now before it s gone like yesterday Cause when I m with you there s nowhere else That I would ever want to be no I m breathing for the next second I can feel you Loving me I m gonna love I wanna lover you forever And this is all I m asking of you 10 000 lifetimes together Is that so much for you to do Cause from the moment that I saw your face And felt the fire in your sweet embrace I swear I knew I m gonna love you forever forever Ooh I wanna love you forever Everyday everyday 10 000 lifetimes together'
57,"Give Me Just One Night (Una Noche)",98 Degrees,2000,b' You keep telling me you want me Hold me close all through the night I know that deep inside you need me No one else can make it right Don t you try to hide the secret I can see it in your eyes You said the words without speaking Now I m gonna make you mine Give me just one night una noche A moment to be by your side Give me just one night una noche I ll give you the time of your life Your rustic passion makes me crazy You existance makes me wild I wanna loosen up your feelings See what s hiding inside Just give me one night una noche A moment to be by your side Give me just one night una noche I ll give you the time of your life Girl Aye que rico me pone loca Como te mueves como me toca Tu movimiento tu sentimiento Si yo te quiero te doy la noche Toda la noche Aye vamos Give me just one night A moment to be by your side Give me just one night I ll give you the time of your life Give me just one night Give me just one night una noche A moment to be by your side Give me just one night una noche I ll give you the time of your life Come on come on come on now baby Give me just one night una noche A moment to be by your side Give me just one night una noche I ll give you the time of your life Ooh yeah'
58,"Take a Picture",Filter,2000,b' Awake on my airplane awake on my airplane My skin is bare my skin is theirs Awake on my airplane awake on my airplane My skin is bare my skin is theirs I feel like a newborn And I feel like a newborn Awake on my airplane awake on my airplane I feel so real Could you take my picture Cause I won t remember Could you take my picture Cause I won t remember Could you take my picture Cause I won t remember Could you take my picture Cause I won t remember yeah I don t believe in I don t believe in In your sanctity your privacy I don t believe in I don t believe in Sanctity a hypocrisy Could everyone agree that No one should be left alone Could everyone agree that They should not be left alone Yeah And I feel like a newborn And I feel like a newborn Could you take my picture Cause I won t remember Could you take my picture Cause I won t remember Could you take my picture Cause I won t remember Could you take my picture Cause I won t remember yeah Hey dad what do you think about your son now Hey dad what do you think about your son now Could you take my picture Cause I won t remember Could you take my picture Cause I won t remember Could you take my picture Cause I won t remember Could you take my picture Cause I won t remember Could you take my picture Cause I won t remember Could you take my picture Cause I won t remember yeah'
59,"Otherside",Red Hot Chili Peppers,2000,b' How long how long will I slide Separate my side I don t I don t believe it s bad Slit my throat it s all I ever I heard your voice through a photograph I thought it up it brought up the past Once you know you can never go back I ve got to take it on the otherside Centuries are what it meant to me A cemetery where I marry the sea Stranger things could never change my mind I ve got to take it on the otherside Take it on the otherside Take it on Take it on How long how long will I slide Separate my side I don t I don t believe it s bad Slit my throat it s all I ever Pour my life into a paper cup The ashtray s full and I m spillin my guts She wants to know am I still her slut I ve got to take it on the otherside A scarlet starlet and she s in my bed A candidate for my soul mate bled Push the trigger and pull the thread I ve got to take it on the otherside Take it on the otherside Take it on Take it on How long how long will I slide Separate my side I don t I don t believe it s bad Slit my throat it s all I ever Turn me on take me for a hard ride Burn me out leave me on the otherside I yell and tell it that it s not my friend I tear it down I tear it down and then it s born again How long how long will I slide Separate my side I don t I don t believe it s bad Slit my throat it s all I ever How long I don t I don t believe it s sad Slit my throat it s all I ever'
60,"Big Pimpin'",Jay-Z,2000,b' Uh uh uh uh It s big pimpin baby It s big pimpin spendin G s Feel me uh huh uhh uh huh Ge ge geyeah geyeah Ge ge geyeah geyeah You know I thug em fuck em love em leave em Cause I don t fuckin need em Take em out the hood keep em lookin good But I don t fuckin feed em First time they fuss I m breezin Talkin about What s the reasons I m a pimp in every sense of the word Bitch better trust and believe em In the cut where I keep em Til I need a nut til I need to beat the guts Then it s beep beep and I m pickin them up Let em play with the dick in the truck Many chicks wanna put Jigga s fists in cuffs Divorce him and split his bucks Just because you got good head I ma break bread so you can be livin it up Shit I part with nothin y all be frontin Me give my heart to a woman Not for nothin never happen I ll be forever mackin Heart cold as assassins I got no passion I got no patience and I hate waitin Ho get your ass in and let s ride We doin big pimpin we spendin cheese Check em out now big pimpin on B L A D s We doin big pimpin up in N Y C It s just that Jigga Man Pimp C and B U N B Nigga it s the big Southern rap impresario Comin straight up out the black barrio Makes a mill up off a sorry ho Then sit back and peep my sce nahr i o Oops my bad that s my scenario No I can t fuck a scary ho Now every time every place everywhere we go Hoes start pointin they say There he go Now these motherfuckers know we carry mo Heat than a little bit We don t pull it out over little shit And if you catch a lick when I spit Then it won t be a little hit Go read a book you illiterate son of a bitch And step up your vocab Don t be surprised if your ho stab out with me And you see us comin down on yo SLAB Livin ghetto fabulous so mad you just can t take it But nigga if you hatin I Then you wait while I get your bitch butt naked Just break it you gotta pay like you weigh Wet with two pairs of clothes on Now get yo ass to the back as I m flyin to the track Timbaland let me spit my prose on Pump it up in the pro zone That s the track that we breakin these hoes on Ain t the track that we flows on But when shit get hot then the Glock start poppin like ozone We keep hoes crunk like Trigger man For real it don t get no bigger man Don t trip let s flip gettin throwed on the flip Gettin blowed with the motherfuckin Jigga Man fool We be big pimpin spendin cheese We be big pimpin on B L A D s We be big pimpin down in P A T It s just that Jigga Man Pimp C and B U N B Smokin out pourin up Keepin lean up in my cup All my car got leather and wood In my hood we call it buck Everybody wanna ball Holla at broads at the mall If he up watch him fall Nigga I can t fuck with y all If I wasn t rappin baby I would still be ridin Mercedes Comin down and sippin daily No record til whitey pay me Uhhh now what y all know about them Texas boys Comin down in candied toys Smokin weed and talkin noise We be big pimpin spendin cheese We be big pimpin on B L A D s We be big pimpin down in P A T It s just that Jigga Man Pimp C and B U N B On the canopy my stamina be Enough for Pamela Anderson Lee MTV jam of the week Made my money quick then back to the streets But still sittin on blades sippin that Ray Standin on the corner of my block hustlin Still gettin that caine Half what I paid slippin right through customs It ll sell by night its egg shell white I got so many grams if the man find out It will land me in jail for life But I m still big pimpin spendin cheese With Bun B Pimp C and Timothy We got bitches in the back of the truck Laughin it up Jigga Man that s what s up We be big pimpin spendin cheese We be big pimpin on B L A D s We be big pimpin down in P A T It s just that Jigga Man Pimp C and B U N B'
61,"A Puro Dolor",Son by Four,2000,b'Letra de A Puro Dolor Perdona si te estoy llamando en este momento Pero me hac a falta escuchar de nuevo Aunque sea un instante tu respiraci n Disculpa s que estoy violando nuestro juramento S que est s con alguien que no es el momento Pero hay algo urgente que decirte hoy Me estoy muriendo muriendo por verte Agonizando muy lento y muy fuerte Vida devu lveme mis fantas as Mis ganas de vivir la vida Devu lveme el aire Cari o m o sin ti yo me siento vac o Las tardes son un laberinto Y las noches me saben A puro dolor Quisiera decirte que hoy estoy de maravilla Que no me ha afectado lo de tu partida Pero con un dedo no se tapa el sol Estoy muriendo muriendo por verte Agonizando muy lento y muy fuerte Vida devu lveme mis fantas as Mis ganas de vivir la vida Devu lveme el aire Cari o m o sin ti yo me siento vac o Las tardes son un laberinto Y las noches me saben A puro dolor Vida devu lveme mis fantas as Mis ganas de vivir la vida Devu lveme el aire Cari o m o sin ti yo me siento vac o Las tardes son un laberinto Y las noches me saben A puro dolor Vida devu lveme mis fantas as Mis ganas de vivir la vida Devu lveme el aire Perdona si te estoy llamando en este momento Pero me hac a falta escuchar de nuevo Aunque sea un instante tu respiraci n'
62,"He Can't Love U",Jagged Edge,2000,b' I ain t no hater or nothing But he can t love you like I can Trust me As the clock strikes twelve I m sitting here wondering how the hell Did I let you leave And baby I know that I did my share Of things to deceive you I m just trying to get an understanding Of what to do Cause I m half way going crazy Girl they can t fade me He can t love you like I love you Baby you know it too And you should never wanna be with a man If he can t be a man And do the things to you like I can He can t love you like I love you Baby you know it too And you should never wanna be with a man If he can t be a man And do the things to you like I can I stop and I wait and I think That I never met someone to make me feel Like I m ready to love So I gotta do what I gotta do Just to keep you Keep you here with me baby Now I feel it s time for me to say That I need you boo And I can go a day with out your lovein Baby I can live without you I know you know No matter were you want it baby Ain t no its whats or buts or maybes And I know one day you ll see He can never love you like I love you OOOO He can t love you like I love you Baby you know it too And you should never wanna be with a man If he can t be a man And do the things to you like I can He can t love you like I love you Baby you know it too And you should never wanna be with a man If he can t be a man And do the things to you like I can'
63,"Separated",Avant,2000,b' Mmm mmm mmm mmm mmm Listen babe Every time I see you I get a bad vibe Just thinkin of someone else in between your thighs And you thought you were slick had tricks up your sleeve But I m sick of your stupid ass and I know you re tired of me That s why I say And when we were together We never turned our backs on each other But now that we re separated We can t stand one another I don t wanna be with you put that on everything I own I can t believe I stayed around that damn long If I never see you again I won t be mad at all no no Cause I believe that you re my downfall You did me wrong When were together you did me wrong I thought you were true You ran out of my life And now I m so through with you I wanted you to be there Right here with me oh It s really over babe Cause you did me wrong I remember when you used to sit there I would hold you in my arms and you would say to me Yeah yeah Yeah yeah yeah yeah yeah yeah Yeah yeah yeah yeah yeah yeah Mmm mmm mmm Yeah yeah yeah yeah yeah yeah Yeah yeah yeah yeah yeah yeah Mmm mmm mmm Yeah yeah yeah yeah yeah yeah Yeah yeah yeah yeah yeah yeah Mmm mmm mmm Yeah yeah yeah yeah yeah yeah Yeah yeah yeah yeah yeah yeah Mmm mmm mmm'
64,"I Wish",Carl Thomas,2000,b' It was love at first sight I know from the way she looked at me Her eyes said it all Long days and nights we spent Until she dropped the bomb on me When she said that she Was unhappily married with children And I wish I never met her at all Even though I love her so She got love for me But she still belongs to someone else It hurts so bad for sure Because she wants to be with me But she cannot be with me She chose to stay at home So they could be a family For the children But what about me Maybe in another life Things could be the way we both desired It s a catch 22 Either way it went Someone had to lose I wish I wish I never met her at all I wouldn t hurt so much inside Oh I wouldn t feel this pain If I never met her at all at all at all Wish I never wish I never'
65,"U Know What's Up",Donell Jones,2000,b' Ooh say what say what say what Ooh girl you know what s up Ooh say what say what say what Ooh girl you know what s up Me and my niggas be rolling Scheming on you and your homies The very first day of summer All chromed out in a hummer babe Hit the park and parlay Hope that you walk this way Do you and your girls wanna ride Play all day puff on the la Ooh say what say what say what You know that I like it baby Ooh girl you know what s up And you know what I need Ooh say what say what say what You know that i m bout it baby Ooh girl you know what s up I m digging you I m feeling you And you know what s up Said I m diggin you and I m wanting you So tell me what s up Peep her thighs and I m zoning Right around two in the morning Looking fly with the sun dress on I think I feel a bone coming on Girl you got me wide open Waitin all day and I m hoping So baby don t front Backseat Jeep you know what I want Ooh say what say what say what You know that I like it baby Ooh girl you know what s up And you know what I need Ooh say what say what say what You know that i m bout it baby Ooh girl you know what s up I m digging you I m feeling you And you know what s up Said I m diggin you and I m wanting you So tell me what s up Digging you you got me wanting you Ooh say what say what say what You know that I like it baby Ooh girl you know what s up And you know what I need Ooh say what say what say what You know that i m bout it baby Ooh girl you know what s up I m digging you I m feeling you And you know what s up Said I m big on you and I m wanting you So tell me what s up'
66,"Faded",soulDecision,2000,b' When I get you all alone I m gonna move in nice and close Ain t nobody gonna interrupt my game oh no no Ever since you ve been hangin round I ve been tryin to figure out What I can say to you to get some play yeah Couldn t we do what we did last night again Baby you and I d be better friends Don t you think it s time we went a bit further Oh yeah Every night when we say goodbye How can I help looking in your eyes Wondering why that you and I haven t hit it Can we get it on I m kind of faded but I feel alright Thinking about making my move tonight I can t pretend that you re only my friend when you re holding my body tight Cause I like the way you re making your move I like the way you re making me wait At the end of the night when I make up your mind You ll be coming on home with me yeah yeah yeah Yeah you know you got it And you know I want it I can t wait to take you home I don t wanna be rude at all I just wanna be where you go Think what we could do alone Couldn t we do what we did last night again Baby you and I d be better friends Don t you think it s time we went a bit further Oh yeah Every night when we say goodbye How can I help looking in your eyes Wondering why that you and I haven t hit it Can we get it on I m kind of faded but I feel alright Thinking about making my move tonight I can t pretend that you re only my friend when you re holding my body tight Cause I like the way you re making your move I like the way you re making me wait At the end of the night when I make up your mind You ll be coming on home with me yeah yeah yeah Uh uh when we first met yo that deal was stated You stepped like my steez the way we conversated Just another day Just around the way Put me up close with everything okay Cause I m Not like the rest Indescision with the best Thoughts for my full court press Just because they hated How s it go HA yo faded I m kind of faded but I feel alright Thinking about making my move tonight I can t pretend that you re only my friend when you re holding my body tight Cause I like the way you re making your move I like the way you re making me wait At the end of the night when I make up your mind You ll be coming on home with me yeah yeah yeah I m kind of faded but I feel alright Thinking about making my move tonight I can t pretend that you re only my friend when you re holding my body tight Cause I like the way you re making your move I like the way you re making me wait At the end of the night when I make up your mind You ll be coming on home with me yeah yeah yeah I m kind of faded but I feel alright Thinking about making my move tonight I can t pretend that you re only my friend when you re holding my body tight Cause I like the way you re making your move I like the way you re making me wait At the end of the night when I make up your mind You ll be coming on home with me yeah yeah yeah'
