Rank,Song,Artist,Year,Lyrics
22,"DJ Got Us Fallin' in Love",Usher,2010,b' Usher Usher Usher Yeah man So we back in the club With our bodies rockin from Side to side side side to side Thank God the week is done I feel like a zombie Gone back to life back back to life Hands up And suddenly we all got our hands up No control of my body Ain t I seen you before I think I remember those eyes eyes eyes Eyes eye eyes Cause baby tonight The DJ got us falling in love again Yeah baby tonight The DJ got us falling in love again So dance dance like it s the last last night Of your life life Gon get you right Cause baby tonight The DJ got us falling in love again Keep downin drinks like there s no tomorrow There s just right now now now no no now now Gon set the roof on fire Gonna burn this motherf Down down down do do down down Hands up When the music drops we both put our hands up Put your hands on my body Swear I ve seen you before I think I remember those eyes eyes eyes Eyes eye eyes Cause baby tonight The DJ got us falling in love again Yeah baby tonight The DJ got us falling in love again So dance dance like it s the last last night Of your life life Gon get you right Cause baby tonight The DJ got us falling in love again Usher don t lie Hear no evil I speak no evil I see no evil Get it baby Hope you catch that like T O That s how we roll My life is a movie and you just TiVo Mami got me twisted like a dreadlock She don t wrestle but I got her in a headlock Yabba dabba doo make her bed rock Mami on fire pshh red hot Bada bing bada boom Mr Worldwide as I step in the room I m a hustler baby but that you knew And tonight it s just me and you Dale Cause baby tonight The DJ got us falling in love again Yeah baby tonight The DJ got us falling in love falling in love So dance dance like it s the last last night Of your life life Gon get you right Cause baby tonight The DJ got us falling in love again Yeah Yeah baby tonight The DJ got us falling in love again So dance dance like it s the last last night Of your life life Gon get you right Cause baby tonight The DJ got us falling in love again Yeah Thank you DJ Haha'
23,"Billionaire",Travie McCoy,2010,b' I wanna be a billionaire so fucking bad Buy all of the things I never had I wanna be on the cover of Forbes magazine Smiling next to Oprah and the Queen Oh every time I close my eyes I see my name in shiny lights yeah A different city every night oh I I swear The world better prepare for when I m a billionaire Yeah I would have a show like Oprah I would be the host of Everyday Christmas give Travie a wish list I d probably pull an Angelina and Brad Pitt And adopt a bunch of babies that ain t never had shit Give away a few Mercedes like here lady have this And last but not least grant somebody their last wish It s been a couple months that I ve been single so You can call me Travie Claus minus the ho ho Aha get it I d probably visit where Katrina hit And damn sure do a lot more than FEMA did Yeah can t forget about me stupid Everywhere I go I mma have my own theme music Oh every time I close my eyes I see my name in shiny lights Oh yeah yeah a different city every night oh I I swear The world better prepare for when I m a billionaire Oh oh oh oh when I m a billionaire Oh oh oh oh I be playing basketball with the president Dunking on his delegates Then I compliment him on his political etiquette Toss a couple milli in the air just for the heck of it But keep the fives twennies tens and bens completely separate And yeah I ll be in a whole new tax bracket We in recession but let me take a crack at it I ll probably take whatever s left and just split it up So everybody that I love can have a couple bucks And not a single tummy around me Would know what hungry was Eating good sleeping soundly I know we all have a similar dream Go in your pocket pull out your wallet And put it in the air and sing I wanna be a billionaire so fucking bad Buy all of the things I never had I wanna be on the cover of Forbes magazine Smiling next to Oprah and the Queen Oh every time I close my eyes I see my name in shiny lights Oh yeah yeah a different city every night oh I I swear The world better prepare for when I m a billionaire Oh oh oh oh when I m a billionaire Oh oh oh oh I wanna be a billionaire so fucking bad'
24,"Not Afraid",Eminem,2010,b' I m not afraid To take a stand Everybody Come take my hand We ll walk this road together through the storm Whatever weather cold or warm Just lettin you know that you re not alone Holla if you feel like you ve been down the same road Yeah it s been a ride I guess I had to go to that place to get to this one Now some of you might still be in that place If you re tryna get out just follow me I ll get you there You can try and read my lyrics off of this paper before I lay em But you won t take the sting out these words before I say em Cause ain t no way I ma let you stop me from causin mayhem When I say I ma do somethin I do it I don t give a damn what you think I m doin this for me So fuck the world feed it beans It s gassed up if it thinks it s stoppin me I ma be what I set out to be without a doubt undoubtably And all those who look down on me I m tearin down your balcony No ifs ands or buts don t try to ask him why or how can he From Infinite down to the last Relapse album he s still shittin Whether he s on salary paid hourly Until he bows out or he shits his bowels out of him Whichever comes first for better or worse He s married to the game Like a fuck you for Christmas his gift is a curse Forget the Earth he s got the urge to pull his dick from the dirt And fuck the whole universe I m not afraid To take a stand Everybody Come take my hand We ll walk this road together through the storm Whatever weather cold or warm Just lettin you know that you re not alone Holla if you feel like you ve been down the same road Okay quit playin with the scissors and shit and cut the crap I shouldn t have to rhyme these words in a rhythm For you to know it s a rap You said you was king you lied through your teeth For that fuck your feelings Instead of gettin crowned you re gettin capped And to the fans I ll never let you down again I m back I promise to never go back on that promise In fact let s be honest that last Relapse CD was ehh Perhaps I ran them accents into the ground Relax I ain t goin back to that now All I m tryin to say is get back click clack blaow Cause I ain t playin around There s a game called circle and I don t know how I m way too up to back down But I think I m still tryin to figure this crap out Thought I had it mapped out but I guess I didn t This fuckin black cloud still follows me around But it s time to exorcise these demons These muh fuckers are doin jumpin jacks now I m not afraid To take a stand Everybody Come take my hand We ll walk this road together through the storm Whatever weather cold or warm Just lettin you know that you re not alone Holla if you feel like you ve been down the same road And I just can t keep livin this way So startin today I m breakin out of this cage I m standin up I ma face my demons I m mannin up I ma hold my ground I ve had enough now I m so fed up Time to put my life back together right now It was my decision to get clean I did it for me Admittedly I probably did it subliminally for you So I could come back a brand new me You helped see me through And don t even realize what you did believe me you I ve been through the wringer But they can do little to the middle finger I think I got a tear in my eye I feel like the king of My world haters can make like bees with no stingers And drop dead no more beef lingers No more drama from now on I promise To focus solely on handlin my responsibilities as a father So I solemnly swear to always treat this roof like my daughters And raise it you couldn t lift a single shingle on it Cause the way I feel I m strong enough to go to the club Or the corner pub and lift the whole liquor counter up Cause I m raisin the bar I d shoot for the moon but I m too busy gazin at stars I feel amazin and I m I m not afraid To take a stand Everybody Come take my hand We ll walk this road together through the storm Whatever weather cold or warm Just lettin you know that you re not alone Holla if you feel like you ve been down the same road'
25,"Replay",Iyaz,2010,b' Shawty s like a melody in my head That I can t keep out got me singin like Na na na na everyday It s like my iPod stuck on replay replay ay ay ay Shawty s like a melody in my head That I can t keep out got me singin like Na na na na everyday It s like my iPod stuck on replay replay Remember the first time we met You was at the mall wit yo friend I was scared to approach ya but then you came closer Hopin you would give me a chance Who would have ever knew That we would ever be more than friends We re real worldwide breaking all the rules She like a song played again and again That girl like somethin off a poster That girl is a dime they say That girl is a gun to my holster She s running through my mind all day ayy Shawty s like a melody in my head That I can t keep out got me singin like Na na na na everyday It s like my iPod stuck on replay replay ay ay ay Shawty s like a melody in my head That I can t keep out got me singin like Na na na na everyday It s like my iPod stuck on replay replay ay ay ay See you been all around the globe Not once did you leave my mind We talk on the phone from night til the morn Girl you really changed my life Doin things I never do I m in the kitchen cookin things she likes We re real worldwide breaking all the rules Someday I wanna make you my wife That girl like somethin off a poster That girl is a dime they say That girl is a gun to my holster She s running through my mind all day ayy Shawty s like a melody in my head That I can t keep out got me singin like Na na na na everyday It s like my iPod stuck on replay replay ay ay ay Shawty s like a melody in my head That I can t keep out got me singin like Na na na na everyday It s like my iPod stuck on replay replay ay ay ay I can be your melody Oh girl I could write you a symphony The one that could fill your fantasies So come baby girl let s sing with me Ayy I can be your melody Oh girl I could write you a symphony The one that could fill your fantasies So come baby girl let s sing with me Ayy na na na na na na na Na na na na na naa Shawty got me singin Na na na na na na na Na na na na na naa Now she got me singin Shawty s like a melody in my head That I can t keep out got me singin like Na na na na everyday It s like my iPod stuck on replay replay ay ay ay Shawty s like a melody in my head That I can t keep out got me singin like Na na na na everyday It s like my iPod stuck on replay replay ay ay ay'
26,"Sexy Bitch",David Guetta,2010,b' Yes I can see her Cause every girl here wanna be her Oh she s a diva I feel the same and I wanna meet her They say she low down It s just a rumor and I don t believe em They say she needs to slow down The baddest thing around town She s nothing like a girl you ve ever seen befo Nothing you can compare to your neighborhood ho I m trying to find the words to describe this girl without being disrespectful The way that booty moving I can t take no more Had to stop what I m doing so I can pull up close I m trying to find the words to describe this girl without being disrespectful Damn you s a sexy bitch a sexy bitch Damn you s a sexy bitch damn girl Damn you s a sexy bitch a sexy bitch Damn you s a sexy bitch damn girl Yes I can see her Cause every girl here wanna be her Oh she s a diva I feel the same and I wanna meet her They say she low down It s just a rumor and I don t believe em They say she needs to slow down The baddest thing around town She s nothing like a girl you ve ever seen befo Nothing you can compare to your neighborhood ho I m tryna find the words to describe this girl without being disrespectful The way that booty movin I can t take no more Had to stop what I m doin so I can pull up close I m tryna to find the words to describe this girl without being disrespectful Damn you s a sexy bitch a sexy bitch Damn you s a sexy bitch damn girl Damn you s a sexy bitch a sexy bitch Damn you s a sexy bitch damn girl Damn you s a sexy bitch a sexy bitch Damn you s a sexy bitch damn girl Damn you s a sexy bitch a sexy bitch Damn you s a sexy bitch damn you s a sexy bitch'
27,"Breakeven",The Script,2010,b' I m still alive but I m barely breathing Just praying to a God that I don t believe in Cause I got time while she got freedom Cause when a heart breaks no it don t break even Her best days will be some of my worst She finally met a man that s gonna put her first While I m wide awake she s no trouble sleeping Cause when a heart breaks no it don t breakeven Even no What am I supposed to do when the best part of me was always you And what am I supposed to say when I m all choked up and you re ok I m falling to pieces yeah I m falling to pieces They say bad things happen for a reason But no wise words gonna stop the bleeding Cause she s moved on while I m still grieving And when a heart breaks no it don t breakeven even even no What am I gonna do when the best part of me was always you And what am I supposed to say when I m all choked up and you re ok I m falling to pieces yeah I m falling to pieces yeah I m falling to pieces I m falling to pieces Oh you got his heart and my heart and none of the pain You took your suitcase I took the blame Now I m tryna make sense of what little remains oh Cause you left me with no love and no love to my name I m still alive but I m barely breathing Just prayed to a God that I don t believe in Cause I got time while she got freedom Cause when a heart breaks no it don t break No it don t break no it don t break even no What am I gonna do when the best part of me was always you And what am I supposed to say when I m all choked up that you re ok I m falling to pieces yeah I m falling to pieces yeah I m falling to pieces I m falling to pieces Oh it don t break even no Oh it don t break even no Oh it don t break even no'
28,"Your Love Is My Drug",Kesha,2010,b' Maybe I need some rehab Or maybe just need some sleep I got a sick obsession I m seeing it in my dreams I m looking down every alley I m making those desperate calls I m staying up all night hoping Hitting my head against the wall What you ve got boy is hard to find I think about it all the time I m all strung out my heart is fried I just can t get you off my mind Because your love your love your love is my drug Your love your love your love I said your love your love your love is my drug Your love your love your love Won t listen to any advice Momma s telling me I should think twice Better left to my own devices I m addicted it s a crisis My friends think I ve gone crazy My judgment s getting kinda hazy My steeze is gonna be affected If I keep it up like a lovesick crackhead What you ve got boy is hard to find I think about it all the time I m all strung out my heart is fried I just can t get you off my mind Because your love your love your love is my drug Your love your love your love I said your love your love your love is my drug Your love your love your love I don t care what people say The rush is worth the price I pay I get so high when you re with me But crash and crave you when you leave Hey so I got a question Do you wanna have a slumber party in my basement Do I make your heart beat like an 808 drum Is my love with your drug Your drug Huh your drug Huh your drug Is my love your drug Because your love your love your love is my drug Your love your love your love I said your love your love your love is my drug Your love your love your love Because your love your love your love is my drug Your love your love your love I said your love your love your love is my drug Your love your love your love Hey Hey so Your love your love your love your love is my drug I like your beard'
29,"I Gotta Feeling",The Black Eyed Peas,2010,b' I got a feeling that tonight s gonna be a good night That tonight s gonna be a good night That tonight s gonna be a good good night A feeling That tonight s gonna be a good night That tonight s gonna be a good night That tonight s gonna be a good good night I got a feeling that tonight s gonna be a good night That tonight s gonna be a good night That tonight s gonna be a good good night A feeling That tonight s gonna be a good night That tonight s gonna be a good night That tonight s gonna be a good good night Tonight s the night Let s live it up I got my money Let s spend it up Go out and smash it Like Oh my God Jump out that sofa Let s kick it Off I know that we ll have a ball If we get down and go out and just lose it all I feel stressed out I wanna let it go Let s go way out spaced out and losing all control Fill up my cup Mazel tov Look at her dancing just take it off Let s paint the town We ll shut it down Let s burn the roof And then we ll do it again Let s do it let s do it let s do it let s do it And do it and do it And do it and do it and do it do it do it Let s do it let s do it let s do it Cause I got a feeling That tonight s gonna be a good night That tonight s gonna be a good night That tonight s gonna be a good good night A feeling That tonight s gonna be a good night That tonight s gonna be a good night That tonight s gonna be a good good night Tonight s that night hey Let s live it up I got my money Let s spend it up Go out and smash it Like Oh my God Jump out that sofa Let s kick it off Fill up my cup Mazel tov Look at her dancing Just take it off Let s paint the town We ll shut it down Let s burn the roof And then we ll do it again Let s do it let s do it let s do it let s do it And do it and do it And do it and do it and do it do it do it Let s do it let s do it let s do it do it do it do it Here we come here we go we gotta rock Easy come easy go now we on top Fill the shot body rock rock it don t stop Round and round up and down around the clock Monday Tuesday Wednesday and Thursday Friday Saturday Saturday to Sunday Weeekend get get get with us you know what we say Party every day p p p party every day And I m feeling That tonight s gonna be a good night That tonight s gonna be a good night That tonight s gonna be a good good night A feeling That tonight s gonna be a good night That tonight s gonna be a good night That tonight s gonna be a good good night '
30,"Fireflies",Owl City,2010,b' You would not believe your eyes If ten million fireflies Lit up the world as I fell asleep Cause they d fill the open air And leave teardrops everywhere You d think me rude but I would just stand and stare I d like to make myself believe That planet Earth turns slowly It s hard to say that I d rather stay awake when I m asleep Cause everything is never as it seems Cause I d get a thousand hugs From ten thousand lightning bugs As they tried to teach me how to dance A foxtrot above my head A sock hop beneath my bed The disco ball is just hanging by a thread I d like to make myself believe That planet Earth turns slowly It s hard to say that I d rather stay awake when I m asleep Cause everything is never as it seems Leave my door open just a crack Cause I feel like such an insomniac Why do I tire of counting sheep When I m far too tired to fall asleep To ten million fireflies I m weird cause I hate goodbyes I got misty eyes as they said farewell But I ll know where several are If my dreams get real bizarre Cause I saved a few and I keep them in a jar I d like to make myself believe That planet Earth turns slowly It s hard to say that I d rather stay awake when I m asleep Cause everything is never as it seems I d like to make myself believe That planet Earth turns slowly It s hard to say that I d rather stay awake when I m asleep Cause everything is never as it seems I d like to make myself believe That planet Earth turns slowly It s hard to say that I d rather stay awake when I m asleep Because my dreams are bursting at the seams'
31,"Say Aah",Trey Songz,2010,b' Ay when I give you these keys homeboy don t move my car man I m right in the front ya dig Don t move my shit man Whoa whoa baby what s yo name Go girl it s your birthday Open wide I know you re thirsty Say aah hey Say aah And we don t buy no drinks at the bar We pop champagne cause we got that dough Let me hear you say aah If you want me say aah Pocket full of money club don t jump til I walk inside the doorway Bottles of that rose Smelling like Dolce Gabbana yeah Shawty you the baddest and to meet you is an honor Lil mama I got a table waiting what you think about a convo And if you like it baby we can take it to the condo And if you like the condo we can move the party to the bedroom I ma beat your body like a congo Since we in the club for now Might as well get another round Noticed ain t nothing in your cup So give it here baby let me fill it up fill it up Go girl it s your birthday Open wide I know you re thirsty Say aah hey Say aah And we don t buy no drinks at the bar We pop champagne cause we got that dough Let me hear you say aah If you want me say aah Shawty dance like a video vixen Say her man be on that bullshit pimping Well I retired from the Bull like Pippen Tryna get you Homer would you be Marge Simpson Whip out front we can leave like pronto Maple Leaf dash got you feeling like Toronto Make your body rise like you puffing on a joint though Girl that s only if you want though you ready Since we in the club for now Might as well get another round Noticed ain t nothing in your cup So give it here baby let me fill it up fill it up Go girl it s your birthday Open wide I know you re thirsty Say aah hey Say aah And we don t buy no drinks at the bar We pop champagne cause we got that dough Let me hear you say aah If you want me say aah Hey hey hey hey hey It s loso you might be too drunk to know so I make you say aah just like I m your doctor All I prescribe is cranberry and vodka Then I m tryna kick it play a little soccer And bust a couple off blaka blaka The Henny in your system You start drunk textin and suddenly you miss him Or even wanna dis him Then you call ya girl like What the hell you gave me She like Don t blame me you better do like Jamie And blame it on the liquor He works every time Patron you my nigga Know it s somebody birthday well where your ass at And girl I know you thirsty but don t know where your glass at Go girl it s your birthday Open wide I know you re thirsty Say aah hey Say aah And we don t buy no drinks at the bar We pop champagne cause we got that dough Let me hear you say aah If you want me say aah Go girl it s your birthday Open wide I know you re thirsty Say aah hey Say aah And we don t buy no drinks at the bar We pop champagne cause we got that dough Let me hear you say aah If you want me say aah'
32,"Find Your Love",Drake,2010,b' I m more than just an option Refuse to be forgotten I took a chance with my heart And I feel it taking over I better find your loving I better find your heart I better find your loving I better find your heart I better find your loving I better find your heart I bet if I give all my love then nothing s gonna tear us apart I m more than just a number I doubt you ll find another So every single summer I ll be the one that you ll remember and I better find your loving I better find your heart I better find your loving I better find your heart I better find your loving I better find your heart I bet if I give all my love then nothing s gonna tear us apart It s more than just a mission You hear but you don t listen You better pay attention And get what you ve been missing I better find your loving I better find your heart I better find your loving I better find your heart I better find your loving I better find your heart I bet if I give all my love then nothing s gonna tear us apart Too many times I ve been wrong I guess being right takes too long I m done waiting there s nothing left to do But give all I have to you and I better find your loving I better find your heart I better find your loving I better find your heart I better find your loving I better find your heart I bet if I give all my love then nothing s gonna tear us apart I bet if I give all my love then nothing s gonna tear us apart'
