Rank,Song,Artist,Year,Lyrics
45,"Whataya Want from Me",Adam Lambert,2010,b' Hey slow it down Whataya want from me Whataya want from me Yeah I m afraid Whataya want from me Whataya want from me There might ve been a time when I would give myself away Oh once upon a time I didn t give a damn But now here we are So whataya want from me Whataya want from me Just don t give up I m workin it out Please don t give in I won t let you down It messed me up Need a second to breathe Just keep coming around Hey whataya want from me Whataya want from me Whataya want from me Yeah it s plain to see That baby you re beautiful And there s nothing wrong with you It s me I m a freak But thanks for loving me Cause you re doing it perfectly Yeah there might ve been a time when I would let you slip away I wouldn t even try but I think you could save my life Just don t give up I m workin it out Please don t give in I won t let you down It messed me up Need a second to breathe Just keep coming around Hey whataya want from me Whataya want from me Whataya want from me Just don t give up on me I won t let you down No I won t let you down So Just don t give up I m workin it out Please don t give in I won t let you down It messed me up Need a second to breathe Just keep coming around Whataya want from me Just don t give up I m workin it out Please don t give in I won t let you down It messed me up Need a second to breathe Just keep coming around Hey whataya want from me Whataya want from me Whataya want from me '
46,"Mine",Taylor Swift,2010,b' You were in college working part time waiting tables Left a small town and never looked back I was a flight risk with a fear of falling Wondering why we bother with love if it never lasts I say Can you believe it As we re lying on the couch The moment I could see it Yes yes I can see it now Do you remember we were sitting there by the water You put your arm around me for the first time You made a rebel of a careless man s careful daughter You are the best thing that s ever been mine Flash forward and we re taking on the world together And there s a drawer of my things at your place You learn my secrets and figure out why I m guarded You say we ll never make my parents mistakes But we got bills to pay We got nothing figured out When it was hard to take Yes yes This is what I thought about Do you remember we were sitting there by the water You put your arm around me for the first time You made a rebel of a careless man s careful daughter You are the best thing that s ever been mine Do you remember all the city lights on the water You saw me start to believe for the first time You made a rebel of a careless man s careful daughter You are the best thing that s ever been mine And I remember that fight 2 30 AM As everything was slipping right out of our hands I ran out crying and you followed me out into the street Braced myself for the goodbye Cause that s all I ve ever known Then you took me by surprise You said I ll never leave you alone You said I remember how we felt sitting by the water And every time I look at you it s like the first time I fell in love with a careless man s careful daughter She is the best thing that s ever been mine Hold on make it last Hold on never turn back You made a rebel of a careless man s careful daughter You are the best thing that s ever been mine Yeah yeah Do you believe it We re gonna make it now And I can see it Yeah yeah I can see it now '
47,"Only Girl (In the World)",Rihanna,2010,b' La la la la La la la la La la la la La la la la I want you to love me like I m a hot ride Be thinking of me Doing what you like So boy forget about the world cause it s gon be me and you tonight I wanna make you beg for it Then I ma make you swallow your pride ooh Want you to make me feel like I m the only girl in the world Like I m the only one that you ll ever love Like I m the only one who knows your heart Only girl in the world Like I m the only one that s in command Cause I m the only one who understands How to make you feel like a man yeah Want you to make me feel like I m the only girl in the world Like I m the only one that you ll ever love Like I m the only one who knows your heart Only one Want you to take it like a thief in the night Hold me like a pillow Make me feel right Baby I ll tell you all my secrets that I m keeping You can come inside And when you enter you ain t leaving Be my prisoner for the night ooh Want you to make me feel like I m the only girl in the world Like I m the only one that you ll ever love Like I m the only one who knows your heart Only girl in the world Like I m the only one that s in command Cause I m the only one who understands Like I m the only one who knows your heart Only one Take me for a ride ride Oh baby take me high high Let me make you rise rise Oh make it last all night night Take me for a ride ride Oh baby take me high high Let me make you rise rise Make it last all night Want you to make me feel like I m the only girl in the world Like I m the only one that you ll ever love Like I m the only one who knows your heart Only girl in the world Like I m the only one that s in command Cause I m the only one who understands How to make you feel like a man Only girl in the world Girl in the world Only girl in the world Girl in the world'
48,"Live Like We're Dying",Kris Allen,2010,b' Ohh yeah yeah Sometimes we fall down can t get back up We re hiding behind skin that s too tough How come we don t say I love you enough Till it s to late it s not too late Our hearts are hungry for a food that won t come And we could make a feast from these crumbs And we re all staring down the barrel of a gun So if your life flashed before you What would you wish you would ve done Yeah we gotta start Looking at the hands of the time we ve been given If this is all we got then we gotta start thinking If every second counts on a clock that s ticking Gotta live like we re dying We only got 86 400 seconds in a day to Turn it all around or to throw it all away Gotta tell them that we love them while we got the chance to say Gotta live like we re dying And if your plane fell out of the skies Who would you call with your last goodbye Should be so careful who we let fall out our lives Cause when we long for absolution There ll no one on the line yeah Yeah we gotta start Looking at the hands of the time we ve been given If this is all we got then we gotta start thinking If every second counts on a clock that s ticking Gotta live like we re dying We only got 86 400 seconds in a day to Turn it all around or to throw it all away Gotta tell them that we love them while we got the chance to say Gotta live like we re dying Like we re dying oh like we re dying Like we re dying oh like we re dying Yeah we gotta start Looking at the hands of the time we ve been given If this is all we got then we gotta start thinking If every second counts on a clock that s ticking Gotta live like we re dying Yeah mmm You never know a good thing till it s gone You never see a crash till it s head on Why do we think we re right when we re dead wrong You never know a good thing till it s gone Yeah we gotta start Looking at the hands of the time we ve been given If this is all we got then we gotta start thinking If every second counts on a clock that s ticking Gotta live like we re dying We only got 86 400 seconds in a day to Turn it all around or to throw it all away Gotta tell them that we love them while we got the chance to say Gotta live like we re dying Like we re dying oh like we re dying Like we re dying oh like we re dying We only got 86 400 seconds in a day to Turn it all around or to throw it all away Gotta tell them that we love them while we got the chance to say Gotta live like we re dying'
49,"Hard",Rihanna,2010,b' Yeah yeah yeah Yeah yeah yeah Ah yeah yeah yeah Ah yeah ah yeah ah yeah yeah Ah yeah ah yeah ah yeah yeah They can say whatever I ma do whatever No pain is forever yup You know this Tougher than a lion ain t gon need to try it I live where the sky ends yup You know this Never lying truth teller That Rihanna reign just won t let up All black on blacked out shades blacked out Maybach I ma rock this shit like fashion as in going til they say stop And my runway never looked so clear but the hottest bitch in heels right here No fear and while you re getting your cry on I m getting my fly on Sincere I see you aiming at my pedestal I better let you know That I I I I m so hard yeah yeah yeah I m so hard That I I I I m so hard yeah yeah yeah I m so hard That I I I I m so hard yeah yeah yeah I m so hard I m so hard I m so hard I m so hard I m so hard That Rihanna reign just don t let up That Rihanna reign just don t let up That Rihanna reign just don t let up I m so hard I m so hard I m so hard I m so hard All up on it know you wanna clone it Ain t like me that chick too phony Ride this beat beat beat like a pony Meet me at the top top top getting lonely Who think they test me now run through your town I ll shut it down Brilliant resilient fan mail from 27 million And I want it all it s gonna take more than that Hope that ain t all you got I need it all The money the fame the cars the clothes I can t just let you run up on me like that all on me like that Yeah I see you aiming at my pedestal so I think I gotta let you know That I I I I m so hard yeah yeah yeah I m so hard That I I I I m so hard yeah yeah yeah I m so hard That I I I I m so hard yeah yeah yeah I m so hard I m so hard I m so hard I m so hard I m so hard Go hard or go home back to your residence Soon as the Red Dogs give the block back to the presidents I used to run my whole block like Obama and them You ain t gotta believe me go ask my momma and them Couldn t even come in my room smelled like a kilo Look like me and two of my boys playing casino Count the style I keep in my bag they can t afford it Tell em give me back my swag They trying to clone it See my Louis chucks Louis flag Louis frames Louis belt What that make me Louis Mane I m in the all white party wearing all black With my new black watch call it the heart attack Cardiac arrest Carti ac a wrist Yeah they say they hard they ain t hard as this Hard the one word describes me If I wasn t doing this you know where I d be Where them girls talking trash Where them girls talking trash Where they at Where they at Where they at Where them bloggers at Where them bloggers at Where they at Where they at Where they at Where your lighters at Where your lighters at Where they at Where they at Where they at I m so hard I m so hard I m so hard I m so hard That I I I I m so hard yeah yeah yeah I m so hard That I I I I m so hard yeah yeah yeah I m so hard That I I I I m so hard yeah yeah yeah I m so hard I m so hard I m so hard I m so hard I m so hard That I I I'
50,"Young Forever",Jay-Z,2010,b' Let s dance in style let s dance for a while Heaven can wait we re only watching the skies Hoping for the best but expecting the worst Are you gonna drop the bomb or not Let us die young or let us live forever We don t have the power but we never say never Sitting in a sandpit life is a short trip The music s for the sad man Forever young I wanna be forever young Do you really want to live forever forever and ever Forever young I wanna be Forever young Do you really want to live forever Forever Forever young So we living life like a video Where the sun is always out and you never get old And the champagne s always cold and the music is always good And the pretty girls just happen to stop by in the hood And they hop they pretty ass up on the hood of that pretty ass car Without a wrinkle in today cause there s no tomorrow Just a picture perfect day that last a whole lifetime And it never ends cause all we have to do is hit rewind So let s just stay in the moment smoke some weed drink some wine Reminisce talk some shit forever young is in your mind Leave a mark they can t erase neither space nor time So when the director yells cut I ll be fine I m forever young Forever young I wanna be forever young Do you really want to live forever forever and ever Forever young I wanna be forever young Do you really want to live forever forever Forever young Fear not when fear not why fear not much while we re alive Life is for living not living uptight till you re somewhere up in the sky Fear not die I ll be alive for a million years bye bye s Are not for legends I m forever young my name shall survive Through the darkest blocks over kitchen stoves over Pyrex pots My name shall be passed down to generations While debating up in barbershops Young slung hung here showed that a nigga from here With a little ambition just what we can become here And as the father pass the story down to his son s ears Young ll get younger every year yeah So if you love me baby this is how you let me know Don t ever let me go that s how you let me know baby Forever young I wanna be forever young Do you really want to live forever forever and ever Forever young I wanna be forever young Do you really want to live forever forever Forever young Just let it run Slamming Bentley doors hopping outta Porsches Popping up on Forbes list gorgeous Niggas thought I lost it they be talking bullshit I be talking more shit they nauseous I ll be here forever you know I m on my fall shit And I ain t with foreclosure I will never forfeit Less than four bars Guru bring the chorus in Did you get the picture yet I m painting you a portrait of Young Forever young I wanna be forever young Do you really want to live forever forever and ever '
51,"Blah Blah Blah",Kesha,2010,b' Badda da dah badda da bah bah Coming out cha mouth with cha blah blah blah Zip your lip like a padlock And meet me in the back with the Jack at the jukebox I don t really care where you live at Just turn around boy let me hit that Don t be a little bitch with your chit chat Just show me where your dick s at Music s up Listen hot stuff I m in love with this song So just hush Baby shut up Heard enough Stop ta ta talking that blah blah blah Think you ll be getting this Nah nah nah Not in the back of my car ar ar If you keep talking that blah blah blah blah blah Boy c mon and get my rocks off Come put a little love in my glove box Wanna dance with no pants on Meet me in the back with the Jack at the jukebox So cut to the chase kid Cause I know you don t care what my middle name is I wanna be naked and you re wasted Music s up Listen hot stuff I m in love with this song So just hush Baby shut up Heard enough Stop ta ta talking that blah blah blah Think you ll be getting this Nah nah nah Not in the back of my car ar ar If you keep talking that blah blah blah blah blah You be delaying you always saying some shit You say I m playin I m never layin the dick Saying Blah blah blah Cause I don t care who you are in this bar It only matters who I is Stop ta ta talking that blah blah blah Think you ll be getting this Nah nah nah Not in the back of my car ar ar If you keep talking that blah blah blah blah blah Blah blah blah Think you ll be getting this Nah nah nah Not in the back of my car ar ar If you keep talking that blah blah blah blah blah Oh Blah blah blah Stop talking Stop ta ta talking that'
52,"Bottoms Up",Trey Songz,2010,b' It s Mr Steal Yo Girl It s Mr Steal Yo Girl Let s go Bottoms up bottoms up ayy what s in ya cup Got a couple bottles but a couple ain t enough Bottoms up bottoms up throw your hands up Tell security we bout to tear this club up Bottoms up bottoms up pocket full of green Girl you know I love the way you shake it in them jeans Bottoms up bottoms up throw ya hands up Bottoms up bottoms up bottoms up up up You know what it is girl we back up in this thang Money stay in my pocket girl I m like a walkin bank Tell me whatcha drank tell me whatcha thank If I go get these bottles we go alcohol insane Callin all the girls do you hear me All around the world city to city Cheers to the girls throw a deuce to the guys Now I got a chicken and a goose in the ride Gettin loose in the ride Hatin ass nigga you can move to the move to the move to the side Bottoms up bottoms up ayy what s in ya cup Got a couple bottles but a couple ain t enough Bottoms up bottoms up throw your hands up Tell security we bout to tear this club up Bottoms up bottoms up pocket full of green Girl you know I love the way you shake it in them jeans Bottoms up bottoms up throw ya hands up Bottoms up bottoms up bottoms up up up My vision s blurred my words slurred It s jam packed a million girls And I ain t tryna leave though We drunk so let me be your alcohol hero Callin all the girls do you hear me All around the world city to city Cheers to the girls throw a deuce to the guys Now I got a chicken and a goose in the ride Gettin loose in the ride Hatin ass nigga you can move to the move to the move to the side Bottoms up bottoms up ayy what s in ya cup Got a couple bottles but a couple ain t enough Bottoms up bottoms up throw your hands up Tell security we bout to tear this club up Bottoms up bottoms up pocket full of green Girl you know I love the way you shake it in them jeans Bottoms up bottoms up throw ya hands up Bottoms up bottoms up bottoms up up up Yo could I get that Tr n Could I get that Remy Could I get that Coke Could I get that Henny Could I get that margarita on the rock rock rocks Could I get that salt all around that rim rim rim rim Trey I was like Yo Trey Do you think you could buy me a bottle of Ros Okay let s get it now I m with a bad bitch he s with his friends I don t say Hi I say keys to the Benz Keys to the Benz Keys to the Benz Motherfuckin right yeah V to the 10 If a bitch tryna get cute I ma stomp her Throw a lot of money at her then yell Fuck her Fuck her Fuck her then yell Fuck her Then I ma go get my Louisville Slugger Excuse me I m sorry I m really such a lady I rep Young Money you know Slim Baby And we be doin donuts while we wavin the 380 We give a lot of money to the babies out in Haiti Yellin all around the world Do you hear me Do you like my body Anna Nicki Rest in peace to Anna Nicole Smith Yes my dear you re so explosive Say Hi to Mary Mary and Joseph Now bottoms up and double my dosage Bottoms up bottoms up ayy what s in ya cup Got a couple bottles but a couple ain t enough Bottoms up bottoms up throw your hands up Tell security we bout to tear this club up Bottoms up bottoms up pocket full of green Girl you know I love the way you shake it in them jeans Bottoms up bottoms up throw ya hands up Bottoms up bottoms up bottoms up up up Bottoms up bottoms up bottoms up bottoms up bottoms up'
53,"Do You Remember",Jay Sean,2010,b' Hey Jay Sean Sean Paul Yeah Lil Jon This one right here is for all the ladies Ladies who want to take it back Holler at them Jay I ve been thinking about you And how we used to be Back when it didn t have to end We can start again There s nothing left to say Don t waste another day Just you and me tonight Everything will be okay If it s alright with you Then it s alright with me Baby let s take this time Let s make new memories Do you remember Do you remember Do you remember All of the times we had Do you remember Do you remember Do you remember All of the times we had Let s bring it back ohhhh Let s bring it back ohhhh Let s bring it back ohhhh Let s bring it back ohhhh Let s bring it back ohhhh Yo Jay sing to these ladies So long since you ve been missing It s good to see you again How you how ya doin And how about me don t let this happen again There s nothing left to say Don t waste another day Just you and me tonight Everything will be okay If it s alright with you Then it s alright with me Baby let s take this time Let s make new memories Do you remember Do you remember Do you remember All of the times we had Do you remember Do you remember Do you remember All of the times we had Let s bring it back ohhhh Let s bring it back ohhhh Let s bring it back ohhhh Let s bring it back ohhhh Let s bring it back ohhhh Yo ay girl yo bring it back to the time when you and me had just begun When I was still your number one Well it might seem far fetched baby girl but it can t be done I ve got this feeling fire blazing and it s hot just like the sun Know you feel it too my girl just freeze up may the good vibes run Girl take a sip of the champange take a lil trip down my lane my girl While you now every night you ll feel alright look I tell you dis girl atta my world Don t change I mma na Rearange Ay girl I mma tell you straight dis atta my world How many years do you want come kiss dis I know you miss this That s what I heard that s what I heard that s what I heard word girl There s nothing left to say Don t waste another day Just you and me tonight Everything will be okay If it s alright with you Then it s alright with me Baby let s take this time Let s make new memories Do you remember Do you remember Do you remember All of the times we had Do you remember Do you remember Do you remember All of the times we had Let s bring it back ohhhh Let s bring it back ohhhh Let s bring it back ohhhh Let s bring it back ohhhh Let s bring it back ohhhh'
54,"All the Right Moves",OneRepublic,2010,b' All the right friends in all the right places So yeah we re going down They ve got All the right moves and all the right faces So yeah we re going down Let s paint the picture of the perfect place They ve got it better than when anyone s told you They ll be the King of Hearts and you re the Queen of Spades Then we ll fight for you like we were your soldiers I know we got it good but they got it made And their grass is getting greener each day I know things are looking up but soon they ll take us down Before anybody s knowing our name They ve got All the right friends in all the right places So yeah we re going down They ve got All the right moves and all the right faces So yeah we re going down They say Everybody knows everybody knows where we re going Yeah we re going down They say Everybody knows everybody knows where we re going Yeah we re going down Do you think I m special Do you think I m nice Am I bright enough to shine in your spaces Between the noise you hear And the sounds you like Are we just sinking in the ocean of faces It can t be possible that rain can fall Only when it s over our heads The sun is shining everyday but it s far away Over the world that s dead They ve got they ve got All the right friends in all the right places So yeah we re going down They ve got All the right moves and all the right faces So yeah we re going down They say Everybody knows everybody knows where we re going Yeah we re going down They say Everybody knows everybody knows where we re going Yeah we re going down It don t matter what you see I know I could never be Someone that ll look like you It don t matter what you say I know I could never fake Someone that could sound like you All the right friends in all the right places So yeah we re going down They ve got All the right moves and all the right faces So yeah we re going down All the right friends in all the right places So yeah we re going down They ve got All the right moves and all the right faces So yeah we re going down They say Everybody knows everybody knows where we re going Yeah we re going down They say Everybody knows everybody knows where we re going Yeah we re going down Yeah we re going down Yeah we re going down All the right moves hey Yeah we re going down All the right moves hey Yeah we re going down'
55,"According to You",Orianthi,2010,b' According to you I m stupid I m useless I can t do anything right According to you I m difficult hard to please Forever changing my mind I m a mess in a dress Can t show up on time Even if it would save my life According to you according to you But according to him I m beautiful incredible He can t get me out of his head According to him I m funny irresistible Everything he ever wanted Everything is opposite I don t feel like stopping it So baby tell me what I ve got to lose He s into me for everything i m not According to you According to you I m boring I m moody And you can t take me any place According to you I suck at telling jokes Cause I always give it away I m the girl with the worst attention span You re the boy who puts up with that According to you according to you But according to him I m beautiful incredible He can t get me out of his head According to him I m funny irresistible Everything he ever wanted Everything is opposite I don t feel like stopping it So baby tell me what I ve got to lose He s into me for everything I m not According to you I need to feel appreciated Loved not hated oh no Why can t you see me through his eyes It s too bad you re making me decide But according to me You re stupid you re useless You can t do anything right But according to him I m beautiful incredible He can t get me out of his head According to him I m funny irresistible Everything he ever wanted Everything is opposite I don t feel like stopping it So baby tell me what I ve got to lose He s into me for everything I m not According to you According to you According to you I m stupid I m useless I can t do anything right'
