Rank,Song,Artist,Year,Lyrics
67,"Party in the U.S.A.",Miley Cyrus,2010,b' I hopped off the plane at LAX With a dream and my cardigan Welcome to the land of fame excess Am I gonna fit in Jumped in the cab here I am for the first time Look to my right and I see the Hollywood sign This is all so crazy Everybody seems so famous My tummy s turnin and I m feelin kinda home sick Too much pressure and I m nervous That s when the taxi man turned on the radio And a JAY Z song was on And a JAY Z song was on And a JAY Z song was on So I put my hands up They re playing my song the butterflies fly away I m noddin my head like yeah Movin my hips like yeah Got my hands up they re playing my song They know I m gonna be okay Yeah it s a party in the U S A Yeah it s a party in the U S A Get to the club in my taxi cab Everybody s looking at me now Like Who s that chick that s rockin kicks She gotta be from out of town So hard with my girls not around me It s definitely not a Nashville party Cause all I see are stilettos I guess I never got the memo My tummy s turnin and I m feelin kinda home sick Too much pressure and I m nervous That s when the DJ dropped my favorite tune And a Britney song was on And a Britney song was on And a Britney song was on So I put my hands up They re playing my song the butterflies fly away I m noddin my head like yeah Movin my hips like yeah Got my hands up they re playing my song They know I m gonna be okay Yeah it s a party in the U S A Yeah it s a party in the U S A Feel like hopping on a flight Back to my hometown tonight Something stops me every time The DJ plays my song and I feel alright So I put my hands up They re playing my song the butterflies fly away I m noddin my head like yeah Movin my hips like yeah Got my hands up they re playing my song They know I m gonna be okay Yeah it s a party in the U S A Yeah it s a party in the U S A So I put my hands up They re playing my song the butterflies fly away I m noddin my head like yeah Movin my hips like yeah Got my hands up they re playing my song They know I m gonna be okay Yeah it s a party in the U S A Yeah it s a party in the U S A '
68,"Deuces",Chris Brown,2010,b' All that bullshit s for the birds you ain t nothing but a vulture Always hopin for the worst waiting for me to fuck up You ll regret the day when I find another girl yeah Who knows just what I need she knows just what I mean When I tell her keep it drama free Chu chuckin up them deuces Yeah yeah told you that I m leaving deuces whoa I know you re mad but so what I wish you best of luck And now I m finna throw them deuces up I m on some new shit I m chuckin my deuces up to her I m moving on to something better better better No more tryna make it work You made me wanna say bye bye Say bye bye say bye bye to her You made me wanna say bye bye Say bye bye say bye bye to her Uh used to be Valentines together all the time Thought it was true love but you know women lie It s like I sent my love with a text two times Call cause I care but I ain t get no reply Tryna see eye to eye but it s like we both blind Fuck it let s hit the club I rarely sip but pour me some Cause when it s all said and done I ain t gon be the one that she can always run to I hate liars fuck love I m tired of tryin My heart big but it beat quiet I don t never feel like we vibin Cause every time we alone it s a awkward silence So leave your keys on the kitchen counter And give me back that ruby ring with the big diamond Shit it s over what you tripping for I don t wanna have to let you go but baby I think its better if I let you know I m on some new shit I m chuckin my deuces up to her I m moving on to something better better better No more tryna make it work You made me wanna say bye bye Say bye bye say bye bye to her You made me wanna say bye bye Say bye bye say bye bye to her Look my shawty always on some bullshit like Chicago So I flip that middle finger and the index finger follow Deuces we ain t got no future in tomorrow I m a dick so it shouldn t be that hard to swallow The other chick I m with never complaining She make me wanna leave the one I m with Usher Raymond Probably didn t register don t trip later on it will Shorty full of drama like Gangsta Gri zills I finally noticed it it finally hit me Like Tina did Ike in the limo it finally hit me I got a new chick and she ain t you She Paula Patton thick she give me d j vu And all that attitude I don t care about it But all that shit I do for her you gon hear about it Breezy rep two up two down But I m just puttin two up chuckin up the deuce now I m on some new shit I m chuckin my deuces up to her I m moving on to something better better better No more tryna make it work You made me wanna say bye bye Say bye bye say bye bye to her You made me wanna say bye bye Say bye bye say bye bye to her deuces'
69,"3",Britney Spears,2010,b' 1 2 3 Not only you and me Got one eighty degrees and I m caught in between Counting 1 2 3 Peter Paul and Mary Getting down with 3P Everybody loves ooh Counting 1 2 1 1 1 2 3 Counting 1 2 Counting 1 2 3 Babe pick a night to come out and play If it s alright What do you say Merrier the more Triple fun that way Twister on the floor What do you say Are you in Living in sin is the new thing Yeah are you in I am counting 1 2 3 Not only you and me Got one eighty degrees and I m caught in between Counting 1 2 3 Peter Paul and Mary Getting down with 3P Everybody loves ooh Counting 1 2 3 Peter Paul and Mary Getting down with 3P Everybody loves ooh Three is a charm Two is not the same I don t see the harm So are you game Let s make a team Make them say my name Loving the extreme Now are you game Are you in Living in sin is the new thing Yeah are you in I am counting 1 2 3 Not only you and me Got one eighty degrees and I m caught in between Counting 1 2 3 Peter Paul and Mary Getting down with 3P Everybody loves ooh Counting 1 2 3 Peter Paul and Mary Getting down with 3P Everybody loves ooh What we do is innocent Just for fun and nothing meant If you don t like the company Let s just do it you and me You and me or three Or four on the floor 1 2 3 Not only you and me Got one eighty degrees and I m caught in between Counting 1 2 3 Peter Paul and Mary Getting down with 3P Everybody loves ooh Counting 1 2 3 Not only you and me Got one eighty degrees and I m caught in between Counting 1 2 3 Peter Paul and Mary Getting down with 3P Everybody loves ooh'
70,"Impossible",Shontelle,2010,b' I remember years ago Someone told me I should take Caution when it comes to love I did I did And you were strong and I was not My illusion my mistake I was careless I forgot I did And now when all is done there is nothing to say You have gone and so effortlessly You have won you can go ahead tell them Tell them all I know now Shout it from the rooftops Write it on the skyline All we had is gone now Tell them I was happy And my heart is broken All my scars are open Tell them what I hoped would be Impossible impossible Impossible Impossible Falling out of love is hard Falling for betrayal is worse Broken trust and broken hearts I know I know Thinking all you need is there Building faith on love and words Empty promises will wear I know I know And now when all is gone there is nothing to say And if you re done with embarrassing me On your own you can go ahead tell them Tell them all I know now Shout it from the rooftops Write it on the skyline All we had is gone now Tell them I was happy And my heart is broken All my scars are open Tell them what I hoped would be Impossible impossible Impossible Impossible Impossible impossible Impossible impossible Ooh impossible I remember years ago Someone told me I should take Caution when it comes to love I did Tell them all I know now Shout it from the rooftops Write it on the skyline All we had is gone now Tell them I was happy And my heart is broken All my scars are open Tell them what I hoped would be Impossible impossible Impossible impossible Impossible impossible Impossible impossible Impossible impossible I remember years ago Someone told me I should take Caution when it comes to love I did'
71,"Forever",Drake,2010,b' I just love when I m with you yeah this shit is on ten We used to be friends girl and even back then You would look at me with no hesitation and you d tell me baby it s yours Nobody else s yeah this shit belong to nobody it s yours Nobody else s yeah this shit belong to nobody and that What made me think about the game girl And how I switched it up with a new thing Young nigga came through on his Wu Tang And nowadays when I ask about who got it they say it s yours Nobody else s yeah this shit belong to nobody it s yours Nobody else s yeah this shit belong to nobody it s yours It s yours it s yours it s yours that s for sure that s for sure It s yours it s yours it s yours it s yours that s for sure that s for sure How you feel about comin home with a nigga for the night If you nervous hit the lights I know we only fuckin out of spite Cause your man don t do you right do you right I could fuck you so good Then I hit you with the 9 a m in Dallas who you like baby who you like Machine gun raps for all my niggas in the back Stadium packed just glad to see the city on the map I just gave the city life it ain t about who did it first It s bout who did it right niggas looking like Preach Open cases on me for a half a million each I find peace knowing that it s harder in the streets I know Luckily I didn t have to grow there I would only go there cause niggas that I know there I don t know what s getting into me I just like the rush When you see your enemy somewhere in the club and you realize He just not in a position to reciprocate your energy You ain t ever worried cause he s not who he pretends to be People like Mazin who was a best friend to me Start to become a distant memory things change in that life And this life started lacking synergy And fuckin with me mentally I think it s meant to be Yeah paranoid always rolling with my mothafuckin boys But you gotta understand when it s yours They don t really leave your ass with a mothafuckin choice man I just love when I m with you yeah this shit is on ten We used to be friends girl and even back then You would look at me with no hesitation and you d tell me baby it s yours Nobody else s yeah this shit belong to nobody it s yours Nobody else s yeah this shit belong to nobody and that What made me think about the game girl And how I switched it up with a new thing Young nigga came through on his Wu Tang And nowadays when I ask about who got it they say it s yours Nobody else s yeah this shit belong to nobody it s yours Nobody else s yeah this shit belong to nobody it s yours It s yours it s yours it s yours that s for sure that s for sure It s yours it s yours it s yours that s for sure that s for sure'
72,"Two Is Better Than One",Boys Like Girls,2010,b' I remember what you wore on the first date You came into my life and I thought hey You know this could be something Cause everything you do and words you say You know that it all takes my breath away And now I m left with nothing Maybe it s true that I can t live without you And maybe two is better than one But there s so much time to figure out the rest of my life And you ve already got me coming undone And I m thinking two is better than one I remember every look upon your face The way you roll your eyes the way you taste You make it hard for breathing Cause when I close my eyes and drift away I think of you and everything s okay I m finally now believing So maybe it s true that I can t live without you And maybe two is better than one But there s so much time to figure out the rest of my life And you ve already got me coming undone And I m thinking two is better than one I remember what you wore on the first date You came into my life and I thought hey Maybe it s true that I can t live without you And maybe two is better than one But there s so much time to figure out the rest of my life And you ve already got me coming undone And I m thinking ooh I can t live without you Cause baby two is better than one There s so much time to figure out the rest of my life But I ll figure out with all that s said and done Two is better than one Two is better than one'
73,"My First Kiss",3OH!3,2010,b' My first kiss went a little like this And twist and twist Well my first kiss went a little like this And twist and twist I said no more teachers and no more books I got a kiss under the bleachers hoping that nobody looks Lips like liquorice tongue like candy Excuse me miss but can I get you out your panties In the back of the car on the way to the bar I got you on my lips At the foot of the stairs with my fingers in your hair Baby this is it She won t ever get enough once she gets a little touch If I had it my way you know that I d make her say Ooooooh Ooooooh She won t ever get enough once she gets a little touch If I had it my way you know that I d make her say Ooooooh Ooooooh My first kiss went a little like this I said no more sailors and no more soldiers With your name in a heart tattooed upon their shoulders Kisses like whiskey it gets me drunk And I wake up in the morning with the taste of your tongue In the back of the car on the way to the bar I got you on my lips At the foot of the stairs with my fingers in your hair Baby this is it She won t ever get enough once she gets a little touch If I had it my way you know that I d make her say Ooooooh Ooooooh She won t ever get enough once she gets a little touch If I had it my way you know that I d make her say Ooooooh Ooooooh My first kiss went a little like this And twist and twist Well my first kiss went a little like this And twist and twist She won t ever get enough once she gets a little touch If I had it my way you know that I d make her say Ooooooh She won t ever get enough once she gets a little touch If I had it my way you know that I d make her say Ooooooh Ooooooh She won t ever get enough once she gets a little touch If I had it my way you know that I d make her say Ooooooh Ooooooh She won t ever get enough once she gets a little touch If I had it my way you know that I d make her say Ooooooh Ooooooh She won t ever get enough once she gets a little touch If I had it my way you know that I d make her say'
74,"Already Gone",Kelly Clarkson,2010,b' Remember all the things we wanted Now all our memories they re haunted We were always meant to say goodbye Even with our fists held high It never would ve worked out right yeah We were never meant for do or die I didn t want us to burn out I didn t come here to hurt you now I can t stop I want you to know that it doesn t matter Where we take this road Someone s gotta go And I want you to know you couldn t have loved me better But I want you to move on so I m already gone Looking at you makes it harder But I know that you ll find another That doesn t always make you wanna cry It started with a perfect kiss then We could feel the poison set in Perfect couldn t keep this love alive You know that I love you so I love you enough to let you go I want you to know that it doesn t matter Where we take this road Someone s gotta go And I want you to know you couldn t have loved me better But I want you to move on so I m already gone I m already gone already gone You can t make it feel right when you know that it s wrong I m already gone already gone There s no moving on so I m already gone Ahh already gone already gone already gone Ahh already gone already gone already gone yeah Remember all the things we wanted Now all our memories they re haunted We were always meant to say goodbye I want you to know that it doesn t matter Where we take this road Someone s gotta go And I want you to know you couldn t have loved me better But I want you to move on so I m already gone I m already gone already gone You can t make it feel right when you know that it s wrong I m already gone already gone There s no moving on so I m already gone'
75,"Rock That Body",The Black Eyed Peas,2010,b' I wanna rock right now I wanna I wanna rock right now I wanna I wanna rock right now Now now rock right now I wanna I wanna rock right now I wanna I wanna rock right now I wanna I wanna rock right now I wanna da I wanna dance in the lights I wanna ro I wanna rock yo body right I wanna go I wanna go for a ride Hop in the music and rock yo body right Rock that body c mon c mon rock that body Rock that body c mon c mon rock that body Rock that body c mon c mon rock that body Rock that body c mon c mon rock that body Let me see your body rock Shaking from the bottom and top Freak to what the DJ drop We be the ones to make it hot Electric shock energy like a billion watts Space be booming the speakers pop Galactic comb and Mr Spock We bumping in your parking lot Parking lot When you comin up in the spot Don t bring nothin we call P Dot Cause we burning around the clock Hit the lights and then turn them off If you bring that don t make you stop Like the jungle we run the block No one rolling the way we rock way we rock I wanna rock right now I wanna I wanna rock right now I wanna I wanna rock right now I wanna da I wanna dance in the lights I wanna ro I wanna rock yo body right I wanna go I wanna go for a ride Hop in the music and rock yo body right Rock that body c mon c mon rock that body Rock that body c mon c mon rock that body Rock that body c mon c mon rock that body Rock that body c mon c mon rock that body Superfly ladies all of my superfly ladies All of my superfly ladies All of my super superfly ladies Yeah you could big boned long as you feel like you on You could be the model type skinny with no appetite Short stacked black or white long as you do what you like Body outta sight body body outta sight She does the two step and the tongue drop She does the cabbage patch and the bus stop She like electro she love hip hop She like the reggae she feel punk rock She love samba and the mambo She like to breakdance and calypso Get a lil crazy get a lil stupid Get a lil crazy crazy crazy I wanna da I wanna dance in the lights I wanna ro I wanna rock yo body right I wanna go I wanna go for a ride Hop in the music and rock yo body right Rock yo body right Rock yo body right C mon yeah C mon yeah Go oh oh oh oh oh oh Let go oh oh oh oh oh oh Let go oh oh oh oh oh oh Let go oh oh oh oh oh oh I wanna I wanna rock right now I wanna I wanna rock I wanna I wanna rock Let go oh oh oh oh oh oh I wanna I wanna rock I wanna I wanna rock Let go oh oh oh oh oh oh Let go oh oh oh oh oh oh I wanna I wanna rock right now I wanna I wanna rock right now I wanna I wanna rock Now now rock right now I wanna I wanna rock I wanna I wanna rock right now I wanna I wanna rock right now'
76,"Secrets",OneRepublic,2010,b' I need another story Something to get off my chest My life gets kinda boring Need something that I can confess Til all my sleeves are stained red From all the truth that I ve said Come by it honestly I swear Thought you saw me wink no I ve been on the brink So tell me what you want to hear Something that will light those ears I m sick of all the insincere So I m gonna give all my secrets away This time Don t need another perfect lie Don t care if critics ever jump in line I m gonna give all my secrets away My God amazing how we got this far It s like we re chasing all those stars Who s driving shiny big black cars And every day I see the news All the problems that we could solve And when a situation rises Just write it into an album Send it straight to gold But I don t really like my flow no So tell me what you want to hear Something that will light those ears I m sick of all the insincere So I m gonna give all my secrets away This time Don t need another perfect lie Don t care if critics ever jump in line I m gonna give all my secrets away Ooh Got no reason got no shame Got no family I can blame Just don t let me disappear I ma tell you everything So tell me what you want to hear Something that ll light those ears I m sick of all the insincere So I m gonna give all my secrets away This time Don t need another perfect lie Don t care if critics ever jump in line I m gonna give all my secrets away So tell me what you want to hear Something that ll light those ears I m sick of all the insincere So I m gonna give all my secrets away This time Don t need another perfect lie Don t care if critics ever jump in line I m gonna give all my secrets away All my secrets away All my secrets away'
77,"Naturally",Selena Gomez,2010,b' How you choose to express yourself It s all your own and I can tell it comes naturally It comes naturally You follow what you feel inside It s intuitive you don t have to try it comes naturally Mmm it comes naturally And it takes my breath away What you do so naturally You are the thunder and I am the lightning And I love the way you know who you are And to me it s exciting When you know it s meant to be Everything comes naturally It comes naturally when you re with me baby Everything comes naturally it comes naturally Ba ba baby You have a way of moving me A force of nature your energy It comes naturally It comes naturally And it takes my breath away What you do so naturally You are the thunder and I am the lightning And I love the way you know who you are And to me it s exciting When you know it s meant to be Everything comes naturally It comes naturally when you re with me baby Everything comes naturally it comes naturally Ba ba baby When we collide sparks fly When you look in my eyes it takes my breath away You are You are the thunder and I am the lightning And I love the way you know who you are And to me it s exciting When you know it s meant to be Everything comes naturally It comes naturally when you re with me baby Everything comes naturally it comes naturally Ba ba baby Naturally naturally naturally naturally naturally Ba ba baby Naturally naturally naturally naturally naturally Everything baby comes naturally Naturally naturally naturally naturally'
78,"Un-Thinkable (I'm Ready)",Alicia Keys,2010,b' Moment of honesty Someone s gotta take the lead tonight who s it gonna be I m gonna sit right here and tell you while it comes to me If you have something to say you should say it right now You give me a feeling that I never felt before And I deserve it I think I deserve it It s becoming something that s impossible to ignore And I can t take it I was wondering maybe could I make you my baby If we do the unthinkable would it make us look crazy If you ask me I m ready If you ask me I m ready I know you said to me This is exactly how it should feel when it s meant to be Time is only wasting so why wait for eventually If we gonna do something about it we should do it right now You give me a feeling that I never felt before And I deserve it I know I deserve it It s becoming something that s impossible to ignore It is what we make it I was wondering maybe could I make you my baby If we do the unthinkable would it make us look crazy Or would it be so beautiful Either way I m sayin If you ask me I m ready If you ask me I m ready Yeah yeah Sayin Why give up before we try Feel the lows before the highs Clip our wings before we fly away I can t say I can t compare I m suspended it the air Won t you come be in the sky with me I was wondering maybe could I make you my baby If we do the unthinkable would it make us look crazy Or would it be so beautiful Either way I m sayin If you ask me I m ready If you ask me I m ready If you ask me I m ready If you ask me I m ready '
