Rank,Song,Artist,Year,Lyrics
55,Want U Back,Cher Lloyd,2012,b' Uh Mmm yeah La la la la la Uh Hey boy you never had much game Thought I needed to upgrade So I went and walked away way way Now I see you ve been hanging out With that other girl in town Looking like a pair of clowns clowns clowns Remember all the things that you and I did first And now you re doing them with her Remember all the things that you and I did first You got me got me like this And now you re taking her to every restaurant And everywhere we went come on And now you re taking her to every restaurant You got me got me like this Boy you can say anything you wanna I don t give a shh no one else can have you I want you back I want you back Want want you want you back I broke it off thinking you d be crying Now I feel like shh looking at you flying I want you back I want you back Want want you want you back Please this ain t even jealousy She ain t got a thing on me Tryna rock them ugly jeans jeans jeans You clearly didn t think this through If what I ve been told is true You ll be crawling back like boo hoo hoo Remember all the things that you and I did first And now you re doing them with her Remember all the things that you and I did first You got me got me like this And now you re taking her to every restaurant And everywhere we went come on And now you re taking her to every restaurant You got me got me like this Boy you can say anything you wanna I don t give a shh no one else can have you I want you back I want you back Want want you want you back I broke it off thinking you d be crying Now I feel like shh looking at you flying I want you back I want you back Want want you want you back Ooh ooh ooh I thought you d still be mine When I kissed you goodbye uh oh uh oh Ooh ooh ooh and you might be with her But I still had you first uh oh uh oh Yeah yeah yo Remember all the things that you and I did first And now you re doing them with her Remember all the things that you and I did first You got me got me like this Boy you can say anything you wanna I don t give a shh no one else can have you I want you back I want you back Want want you want you back I broke it off thinking you d be crying Now I feel like shh looking at you flying I want you back I want you back Want want you want you back Ooh ooh ooh la la la la la I want you back I want you back Want want you want you back Ooh ooh ooh uh I want you back I want you back Want want you want you back Does that sound like a helicopter Brrr'
56,Don't Wake Me Up,Chris Brown,2012,b' Dearly beloved if this love only exists in my dreams Don t wake me up Too much light in this window don t wake me up Only coffee no sugar inside my cup If I wake and you re here still give me a kiss I wasn t finished dreaming about your lips Don t wake me up up up up up Don t wake me up up up up up Don t wake me up up up up up Don t wake me up don t wake me Don t wake me up yeah Don t wake me up don t wake me up Don t wake me up yeah Don t wake me up up up up up Don t wake me up don t wake me So much light in the city you won t believe Been awake some days now no time to sleep If your heart is a pillow this love s the bed Tell me what is the music inside my head Don t wake me up up up up up Don t wake me up up up up up Don t wake me up up up up up Don t wake me up don t wake me Don t wake me up yeah Don t wake me up don t wake me up Don t wake me up yeah Don t wake me up up up up up Don t wake me up don t wake me I don t wanna fall fall fall fall asleep no I don t wanna fall unless I m falling for you I don t wanna fall fall fall fall asleep no I don t wanna fall unless I m falling for you Don t wake me up up up up up Don t wake me up up up up up Don t wake me up up up up up Don t wake me up don t wake me Don t wake me up yeah Don t wake me up don t wake me up Don t wake me up yeah Don t wake me up up up up up Don t wake me up don t wake me'
57,Dance (A$$),Big Sean,2012,b' Ass ass ass ass ass Ass ass ass ass ass Ass ass ass ass ass Ass ass ass ass ass Ass ass Stop now make that motherfucker Hammer time like Go stupid go stupid go stupid Do it boi do it boi boi boi Drop it drop it Wobbledy wobbledy wo wobble wobble I m stacking my paper my wallet look like a Bible I got girlies half naked that shit look like the grotto How yo waist anorexic And then yo ass is colossal like woo Drop that ass make it boomerang Take my belt off bitch I m Pootie Tang Tippy tow tippy tay you gon get a tip today Fuck that you gon get some dick today I walk in with my crew and I m breaking they necks I m looking all good I m making her wet They pay me respect they pay me in checks And if she look good she pay me in sex Bounce that ass it s the roundest You re the best you deserve a crown bitch Right on that ass Ass ass ass ass ass Ass ass ass ass ass Ass ass ass ass ass Ass ass ass ass ass Ass ass Stop now make that motherfucker Hammer time like Go stupid go stupid go stupid Do it boi do it boi boi boi Drop it drop it Okay stop drop it drop it You got everybody in here oh my goshing Bad bitches I m your dada white girls go Gaga When the sticks out they bust it open like ya ya s a Pinata Bitch look down tell me what s up Girl you talk too much shut up I got that mad dick you know it always nut up And it got an attitude no wonder why it s stuck up Pop it then backflip yo gymnastics got me ecstatic Your whole crew look like a pageant I m dropping cash tips and some taxes Girl you got me about to pass out I m wondering if cupid gave you ass shots Cause I m in love with that ass Ass ass ass ass ass Ass ass ass ass ass Ass ass ass ass ass Ass ass ass ass ass Ass ass Stop now make that motherfucker Hammer time like Go stupid go stupid go stupid Do it boi do it boi boi boi Whoa white girls black girls tall girls fat girls Shake that ass shake that ass shake that ass Shake that ass shake that ass shake that ass Short girls small girls skinny girls all girls Shake that ass shake that ass shake that ass Shake that ass shake that ass shake that ass And I want all of that Ass ass ass ass ass Ass ass ass ass ass Ass ass ass ass ass Ass ass ass ass ass Ass ass Stop now make that motherfucker Hammer time like Go stupid go stupid go stupid Do it boi do it boi boi boi Go stupid'
58,Springsteen,Eric Church,2012,b' To this day when I hear that song I see you standin there on that lawn Discount shades store bought tan Flip flops and cut off jeans Somewhere between that setting sun I m on Fire and Born to Run You looked at me and I was done And we re we re just getting started I was singin to you you were singin to me I was so alive never been more free Fired up my daddy s lighter and we sang Ooohh Stayed there til they forced us out And took the long way to your house I can still hear the sound of you sayin don t go When I think about you I think about 17 I think about my old jeep I think about the stars in the sky Funny how a melody sounds like a memory Like the soundtrack to a July Saturday night Springsteen I bumped into you by happenstance You probably wouldn t even know who I am But if I whispered your name I bet there d still be a spark Back when I was gasoline And this old tattoo had brand new ink And we didn t care what your mom would think About your name on my arm Baby is it spring or is it summer The guitar sound or the beat of that drummer You hear sometimes late at night On your radio Even though you re a million miles away When you hear Born in the USA You relive those glory days So long ago When you think about me do you think about 17 Do you think about my old jeep Think about the stars in the sky Funny how a melody sounds like a memory Like a soundtrack to a July Saturday night Springsteen Springsteen Woah oh oh oh Funny how a melody sounds like a memory Like a soundtrack to a July Saturday night Springsteen Springsteen Woah Springsteen Woah oh oh oh'
59,Brokenhearted,Karmin,2012,b' Oh yeah Uh c mon yeah This is more than the typical kinda thing Felt a jones in my bones when you were touching me Uh oh didn t wanna take it slow In a daze goin craze I can barely think You re replayin in my brain find it hard to sleep Uh oh waitin for my phone to blow Uh oh yup Now I m here in a sticky situation Got a bit of trouble yup and now I m pacin Five minutes ten minutes now it s been an hour I don t wanna think too hard but I m sour Uh oh I can t seem to let you go See I ve been waitin all day for you to call me baby So let s get up let s get on it Don t you leave me brokenhearted tonight Come on that s right Honest baby I ll do anything you want to So can we finish what we started Don t you leave me brokenhearted tonight Come on that s right cheerio What s the time Such a crime not a single word Sippin on that Patr n just to calm my nerves Uh oh poppin bottles by the phone oh yeah Had me up had me down turned me inside out That s enough call me up baby I m in doubt Uh oh and I don t even think you know No no no See I ve been waitin all day for you to call me baby So let s get up let s get on it Don t you leave me brokenhearted tonight Come on that s right Honest baby I ll do anything you want to So can we finish what we started Don t you leave me brokenhearted tonight Come on that s right cheerio ay Anything you wanna do I ll be on it too Everything you said is like gold with a view Business in the front party in the back Maybe I was wrong was the outfit really wack This kinda thing doesn t happen usually I m on the opposite side of it truthfully I know you want it so come and get it Cheerio See I ve been waitin all day for you to call me baby So let s get up let s get on it Don t you leave me brokenhearted tonight Honest baby I ll do anything you want to So can we finish what we started Don t you leave me brokenhearted tonight Come on that s right Cheeri cheerio uh When you gonna call Don t leave me brokenhearted I ve been waiting up let s finish what we started Oh oh I can t seem to let you go Come on that s right cheerio uh'
60,Not Over You,Gavin DeGraw,2012,b' Dreams that s where I have to go To see your beautiful face anymore I stare at a picture of you and listen to the radio Hope hope there s a conversation We both admit we had it good But until then it s alienation I know That much is understood And I realize If you ask me how I m doing I would say I m doing just fine I would lie and say that you re not on my mind But I go out and I sit down at a table set for two And finally I m forced to face the truth No matter what I say I m not over you Damn damn girl you do it well And I thought you were innocent Took this heart and put it through hell But still you re magnificent I I m a boomerang doesn t matter how you throw me I turn around and I m back in the game Even better than the old me But I m not even close without you If you ask me how I m doing I would say I m doing just fine I would lie and say that you re not on my mind But I go out and I sit down at a table set for two And finally I m forced to face the truth No matter what I say I m not over you And if I had the chance to renew You know there isn t a thing I wouldn t do I could get back on the right track But only if you d be convinced So until then If you ask me how I m doing I would say I m doing just fine I would lie and say that you re not on my mind But I go out and I sit down at a table set for two And finally I m forced to face the truth No matter what I say I m not over you Not over you Not over you Not over you'
61,Stereo Hearts,Gym Class Heroes,2012,b' My heart s a stereo It beats for you so listen close Hear my thoughts in every no Oh ote Make me your radio And turn me up when you feel low This melody was meant for you Just sing along to my stereo If I was just another dusty record on the shelf Would you blow me off and play me like everybody else If I ask you to scratch my back could you manage that Like yikky yeah check it Travie I can handle that Furthermore I apologize for any skipping tracks It s just the last girl that played me left a couple cracks I used to used to used to used to now I m over that Cause holding grudges over love is ancient artefacts If I could only find a note to make you understand I d sing it softly in your ear and grab you by the hand Just keep it stuck inside your head like your favorite tune And know my heart s a stereo that only plays for you My heart s a stereo It beats for you so listen close Hear my thoughts in every no Oh ote Make me your radio And turn me up when you feel low This melody was meant for you Just sing along to my stereo Oh oh oh oh oh Oh oh oh Oh oh oh oh Just sing along to my stereo Let s go If I was an old school fifty pound boombox Would you hold me on your shoulder wherever you walk Would you turn my volume up in front of the cops And crank it higher every time they told you to stop And all I ask is that you don t get mad at me When you have to purchase mad D batteries Appreciate every mixtape your friends make You never know we come and go like on the interstate I think I finally found a note to make you understand If you could hit it sing along and take me by the hand Just keep it stuck inside your head like your favorite tune You know my heart s a stereo that only plays for you My heart s a stereo It beats for you so listen close Hear my thoughts in every no Oh ote Make me your radio And turn me up when you feel low This melody was meant for you Just sing along to my stereo Oh oh oh oh oh Oh oh oh Oh oh oh oh Just sing along to my stereo I only pray you never leave me behind Because good music can be so hard to find I take your hand and hold it closer to mine Thought love was dead but now you re changing my mind My heart s a stereo It beats for you so listen close Hear my thoughts in every no Oh ote Make me your radio And turn me up when you feel low This melody was meant for you Just sing along to my stereo Oh oh oh oh oh Yeah yeah ye eh eh Oh oh oh oh Yeah yeah ye eh eh Oh oh oh Yeah yeah ye eh eh Just sing along to my stereo Yeah yeah yeah Yeah'
62,Back in Time,Pitbull,2012,b' Let s excuse me baby Go yeah you baby Back oh you groovy baby In let s make a movie baby Time excuse me baby Let s yeah you baby Go oh you groovy baby Back in let s make a movie baby Time It s Mr Worldwide Agent A reporting live From Cape Canaveral MK Big Syphe let s ride Back back in in time Baby Ohhh baby Ohhh baby My sweet baby You re the one Miami equals Black mask black clothes With a little bit of rope to tie I flipped it Black suits white shirts black glasses with a matching tie Like Agent J or Agent K and I wish the whole world would Ok I m tryin make a billion out of 15 cents Understand understood I m a go getter mover shaker culture Bury a boarder record breaker won t cha Give credit where credit is due don t cha Know that I don t give a number two Y all just halfway thoughts Not worth the back of my mind But to understand the future We have to go back in time Baby Ohhh baby Ohhh baby My sweet baby You re the one I got the globe yeah in the palm of my hand Wherever I spin it that s where I land Let s save the world Men In Black I know you understand Stop the movement they can try if they want to Ignorar lo latino si they can try if they want to What Pit solves is a bit raw Took like jigsaw and built it all Despite a big loss I d bet it all And fought blind against the world Ray Charles Y all just halfway thoughts Not worth the back of my mind But to understand the future We have to go back in time Baby Ohhh baby Ohhh baby My sweet baby You re the one Let s excuse me baby Go yeah you baby Back oh you groovy baby In let s make a movie baby Time excuse me baby Let s yeah you baby Go oh you groovy baby Back in let s make a movie baby Time Baby My sweet baby My sweet baby My sweet baby You re the Baby Ohhh baby Ohhh baby My sweet baby You re the one'
63,Work Out,J. Cole,2012,b' I want to see you work out for me work out for me Ayy we ve got a good thing Don t know if I ma see you again But is that a good thing Cause girl I can t be your man no ma am I know what s on your brain You probably hoped it never would end Like Is it the real thing Or is it just a one night stand Well then Let me see you get high then go low Now girl won t you drop that thing down to the floor I m here for one night how far will you go I wanna see you High then go low Now girl won t you drop that thing down to the floor I m here for one night how far will you go I wanna see you She like them boys with the big ol chains Ridin around town in a big ol Range I knew her when I rocked big ol jeans Now the little nigga doin big ol thangs Would you look at that I came back for her Just to give it to ya like you asked for it Man that thing in them jeans too fat for her Rebounds so I caught her off the backboard I told her Baby girl come here Know I run the town even when I ain t from there And I brag hardly but just to show up at this party I made what yo nigga make in one year That s unfair but so is life take a chance roll the dice Money can t buy you love cause it s overpriced Don t overthink just hope it s right I m only here for the night Ayy we ve got a good thing Don t know if I ma see you again But is that a good thing Cause girl I can t be your man no ma am I know what s on your brain You probably hoped it never would end Like Is it the real thing Or is it just a one night stand Well then Let me see you get high then go low Now girl won t you drop that thing down to the floor I m here for one night how far will you go I wanna see you High then go low Now girl won t you drop that thing down to the floor I m here for one night how far will you go I wanna see you Carolina Blue kicks fresh on the scene Hottest nigga on the block Damn girl you re mean They be startin shit but it s yo world On my Martin shit You go girl She bad and she know it Some niggas save hoes I m not that heroic Could you be my escort Cause just like them two door Fords Damn they don t make em like you no more Cole World real Cole World Them boys cool me I m on fire Know what s on my mind Tryna see what s on yours tonight tonight tonight Move slow cause you wanna live fast Up late so you ll probably skip class Life is a test so before the night pass get right get right Ayy we ve got a good thing Don t know if I ma see you again But is that a good thing Cause girl I can t be your man no ma am I know what s on your brain You probably hoped it never would end Like Is it the real thing Or is it just a one night stand Well then Straight up now tell me Do you really wanna love me forever Or is it just a hit and run Straight up I tell ya I just really wanna cut when we together Come here girl let s get it on Straight up now tell me Do you really wanna love me forever Or is it just a hit and run Well straight up I tell ya I just really wanna cut when we together Come here girl let s get it on '
64,Rumour Has It,Adele,2012,b' Ooh ooh ooh ooh She she ain t real She ain t gon be able to love you like I will She is a stranger You and I have history or don t you remember Sure she s got it all But baby is that really what you want Bless your soul you ve got your head in the clouds She made a fool out of you And boy she s bringing you down She made your heart melt but you re cold to the core Now rumour has it she ain t got your love anymore Rumour has it But rumour has it But rumour has it But rumour has it But rumour has it But rumour has it But rumour has it But rumour has it She is half your age But I m guessing that s the reason that you stayed I heard you ve been missing me You ve been telling people things you shouldn t be Like when we creep out when she ain t around Haven t you heard the rumours Bless your soul you ve got your head in the clouds You made a fool out of me And boy you re bringing me down You made my heart melt yet I m cold to the core But rumour has it I m the one you re leaving her for Rumour has it But rumour has it But rumour has it But rumour has it But rumour has it But rumour has it But rumour has it But rumour has it All of these words whispered in my ear Tell a story that I cannot bear to hear Just cause I said it it don t mean that I meant it People say crazy things Just cause I said it don t mean that I meant it Just cause you heard it Rumour has it But rumour has it But rumour has it But rumour has it But rumour has it But rumour has it But rumour has it But rumour has it But rumour has it But rumour has it But rumour has it But rumour has it But rumour has it But rumour has it But rumour has it he s the one I m leaving you for'
65,Let's Go,Calvin Harris,2012,b' Let s go Make no excuses now I m talking here and now I m talking here and now Let s go Your time is running out I m talking here and now I m talking here and now It s not about what you ve done It s about what your doing It s all about where you re going no matter where you ve been Let s go Let s go Let s go Let s go Hey it s now or never Ohhh ohhh Lets go Tomorrow s good tonight is better Ohhh ohhh Ohhh let s go There is no better time I m talking here and now I m talking here and now Let s go Right now is where you shine I m talking here and now I m talking here and now It s not about what you ve done It s about what you re doing It s all about where you re going no matter where you ve been Let s go Let s go Let s go Let s go Hey it s now or never Ohhh ohhh Let s go Tomorrow s good tonight is better Ohhh ohhh Let s make it happen Ohhh let s make it happen tonight Let s make it happen Ohhh let s make it happen tonight Let s make it happen Ohhh let s make it happen tonight Let s make it happen Ohhh let s make it happen tonight Let s go Let s go Let s go Hey it s now or never Ohhh ohhh Let s go Tomorrow s good tonight is better Ohhh ohhh Ohhh let s go'
66,Good Girl,Carrie Underwood,2012,b' Hey good girl With your head in the clouds I bet you I can tell you what you re thinking about You ll see a good boy Gonna give you the world But he s gonna leave you crying with your heart in the dirt His lips are dripping honey but he ll sting you like a bee So lock up all your love and go and throw away the key Hey good girl Get out while you can I know you think you got a good man Why why you gotta be so blind Won t you open up your eyes Just a matter of time til you find He s no good girl No good for you You better get to gettin on your goodbye shoes and go go go Better listen to me he s low low low Hey good girl You got a heart of gold You want a white wedding and a hand you can hold Just like you should girl Like every good girl does Want a fairytale ending somebody to love But he s really good at lying Yeah he ll leave you in the dust Cause when he says forever Well it don t mean much Hey good girl So good for him Better back away honey you don t know where he s been Why why you gotta be so blind Won t you open up your eyes Just a matter of time til you find He s no good girl No good for you You better get to gettin on your goodbye shoes and go go go Yeah yeah yeah he s low Yeah yeah yeah Oh he s no good girl Why can t you see He ll take your heart and break it Listen to me yeah Why why you gotta be so blind Won t you open up your eyes Just a matter of time til you find He s no good he s no good Won t you open up your eyes Just a matter of time til you find He s no good girl No good for you You better get to gettin on your goodbye shoes'
67,Pontoon,Little Big Town,2012,b' Back this hitch up into the water Untie all the cables and rope Step onto the astro turf Get yourself a coozie Let s go Who said anything about skiing Floating is all I want to do You can climb the ladder Just don t rock the boat while I barbeque On the pontoon Making waves and catching rays up on the roof Jumping out the back don t act like you don t want to Party in slow motion Out here in the open Mmmmmmm motorboating Reach your hand down into the cooler Don t drink it if the mountains aren t blue Try to keep it steady as you recline on your black inner tube 5 mile an hour with aluminum side Wood paneling with a water slide Can t beat the heat so let s take a ride On the pontoon On the pontoon Back this hitch out into the water On the pontoon '
68,Ho Hey,The Lumineers,2012,b' I been trying to do it right I been living a lonely life I been sleepin here instead I been sleepin in my bed I been sleepin in my bed So show me family All the blood that I will bleed I don t know where I belong I don t know where I went wrong But I can write a song I belong with you you belong with me You re my sweetheart I belong with you you belong with me You re my sweetheart I don t think you re right for him Think of what it might have been if we Took a bus to Chinatown I d be standin on Canal and Bowery And she d be standin next to me I belong with you you belong with me You re my sweetheart I belong with you you belong with me You re my sweetheart Love we need it now Let s hope for some Cause oh we re bleedin out I belong with you you belong with me You re my sweetheart I belong with you you belong with me You re my sweetheart'
