Rank,Song,Artist,Year,Lyrics
69,Paradise,Coldplay,2012,b' Oo oo oo oo oo oo oo oo oo Oo oo oo oo oo oo oo oo oo When she was just a girl She expected the world But it flew away from her reach So she ran away in her sleep And dreamed of para para paradise Para para paradise Para para paradise Every time she closed her eyes Oo oo oo oo oo oo oo oo oo Oo oo oo oo oo oo oo oo oo When she was just a girl She expected the world But it flew away from her reach And the bullets catch in her teeth Life goes on it gets so heavy The wheel breaks the butterfly Every tear a waterfall In the night the stormy night she ll close her eyes In the night the stormy night away she d fly And dream of para para paradise Para para paradise Para para paradise Oh oh oh oh oh oh oh oh She d dream of para para paradise Para para paradise Para para paradise Oh oh oh oh oh oh oh oh La la La la la la la La la la la la La la la la So lying underneath those stormy skies She d say Oh oh oh oh oh I know the sun must set to rise This could be para para paradise Para para paradise This could be para para paradise Oh oh oh oh oh oh oh oh This could be para para paradise Para para paradise This could be para para paradise Oh oh oh oh oh oh oh oh This could be para para paradise Para para paradise This could be para para paradise Oh oh oh oh oh oh oh oh Oo oo oo oo oo oo oo oo oo Oo oo oo oo oo oo oo oo oo Oo oo oo oo oo oo oo oo oo Oo oo oo oo oo oo'
70,Blown Away,Carrie Underwood,2012,b' Dry lightning cracks across the skies Those storm clouds gather in her eyes Her daddy was a mean old mister Mama was an angel in the ground The weatherman called for a twister She prayed blow it down There s not enough rain in Oklahoma To wash the sins out of that house There s not enough wind in Oklahoma To rip the nails out of the past Shatter every window til it s all blown away Every brick every board every slamming door blown away Til there s nothing left standing nothing left of yesterday Every tear soaked whiskey memory blown away Blown away She heard those sirens screamin out Her daddy laid there passed out on the couch She locked herself in the cellar Listened to the screaming of the wind Some people called it taking shelter She called it sweet revenge Shatter every window til it s all blown away Every brick every board every slamming door blown away Til there s nothing left standing nothing left of yesterday Every tear soaked whiskey memory blown away Blown away There s not enough rain in Oklahoma To wash the sins out of that house There s not enough wind in Oklahoma To rip the nails out of the past Shatter every window til it s all blown away Every brick every board every slamming door blown away Til there s nothing left standing nothing left of yesterday Every tear soaked whiskey memory blown away Blown away Blown away Blown away Blown away Blown away'
71,Rolling in the Deep,Adele,2012,b' There s a fire starting in my heart Reaching a fever pitch and it s bringing me out the dark Finally I can see you crystal clear Go ahead and sell me out and then I ll lay your ship bare See how I ll leave with every piece of you Don t underestimate the things that I will do There s a fire starting in my heart Reaching a fever pitch and it s bringing me out the dark The scars of your love remind me of us They keep me thinkin that we almost had it all The scars of your love they leave me breathless I can t help feeling We could have had it all Rolling in the deep You had my heart inside of your hand And you played it to the beat Baby I have no story to be told But I ve heard one on you Now I m gonna make your head burn Think of me in the depths of your despair Make a home down there As mine sure won t be shared The scars of your love remind me of us They keep me thinkin that we almost had it all The scars of your love they leave me breathless I can t help feeling We could have had it all Rolling in the deep You had my heart inside of your hand And you played it to the beat Could have had it all Rolling in the deep You had my heart inside of your hand But you played it with a beating Throw your soul through every open door Count your blessings to find what you look for Turn my sorrow into treasured gold You ll pay me back in kind and reap just what you sow We could have had it all We could have had it all It all it all it all We could have had it all Rolling in the deep You had my heart inside of your hand And you played it to the beat We could have had it all Rolling in the deep You had my heart inside of your hand But you played it you played it you played it You played it to the beat'
72,Climax,Usher,2012,b' Going nowhere fast We ve reached the climax We re together now we re undone Won t commit so we choose to run away Do we separate Oh don t wanna give in so we both gave up Can t take it back it s too late we ve reached the climax Climax I ve fallen somehow Feet off the ground Love is the cloud That keeps raining down Where are you now When I need you around I m on my knees But it seems we re Going nowhere fast We ve reached the climax We re together now we re undone Won t commit so we choose to run away Do we separate Oh don t wanna give in so we both gave up Can t take it back it s too late we ve reached the climax Climax I gave my best it wasn t enough You get upset we argue too much We made a mess of what used to be love So why do I care I care at all At all At all at all Going nowhere fast We ve reached the climax We re together now we re undone Won t commit so we choose to run away Do we separate Oh don t wanna give in so we both gave up Can t take it back it s too late we ve reached the climax Climax You say it s better if we Love each other separately I just need you one more time I can t get what we had out my mind Where are you now When I need you around I m on my knees But it seems we re going Nowhere fast We ve reached the climax We re together now we re undone Won t commit so we choose to run away Do we separate Oh don t wanna give in so we both gave up Can t take it back it s too late we ve reached the climax Climax'
73,Work Hard Play Hard,Wiz Khalifa,2012,b' Work hard play hard Work hard play hard Work hard play hard Work hard play hard Work work work work Work work work work Diamonds all on my ring nigga Gold watches gold chain nigga Hundred thou on champagne nigga Yeah my money insane nigga Yeah I m making it rain nigga But I was just on the plane nigga Buying gear flying here Fuck what you heard it s my time of year If I m in the club I get a hundred stacks I m always rolling up so I get love for that Them niggas stole my swag but I don t want it back My nigga uh I was on this but now I m onto that You see it in my closet before it s on the rack Was out there in Hawaii now I m goin back My nigga uh I got so much money I should start a bank So much paper right in front of me it s hard to think Buy so many bottles it s gon be hard to drink But I m still pourin up and my family here and they rolling up so uh The bigger the bill the harder you ball Well I m throwing mine cause my money long The quicker you here the faster you go That s why where I come from the only thing we know is The bigger the bill the harder you ball Well I m throwing mine cause my money long The quicker you here the faster you go That s why where I come from the only thing we know is Work hard play hard Work hard play hard Work hard play hard Work hard play hard Work work work work Work work work work Hop your pretty ass up in this fucking car Bitch I m out this world girl you know I m a star Used to buying rounds but now we buy the bar Last year they had to ask now they know who we are Boss shit walk in the building I own shit You can tell by who I m on the phone with Yeah nigga talking about grown shit Niggas too busy jacking my swag Need to fuck around get your own shit Get your own cars get your own clothes Get your own smoke get your own bitch You ain t reppin my gang get your own clique The bigger the bill the harder you ball Well I m throwing mine cause my money long The quicker you here the faster you go That s why where I come from the only thing we know is The bigger the bill the harder you ball Well I m throwing mine cause my money long The quicker you here the faster you go That s why where I come from the only thing we know is Go hard Make sure you do whatever is that you gotta do that s your job And niggas gon hate but that s no prob So hey fuck em don t need nothing from em Some niggas talking but the shit they claiming don t mean nothing It s straight from Cali that s what s in my joint that s what I m puffin OG And been one since I was young enough to know that everybody was gonna know me Most niggas don t see The bigger the bill the harder you ball Well I m throwing mine cause my money long The quicker you here the faster you go That s why where I come from the only thing we know is The bigger the bill the harder you ball Well I m throwing mine cause my money long The quicker you here the faster you go That s why where I come from the only thing we know is Work hard play hard Work hard play hard Work hard play hard Work hard play hard'
74,Let Me Love You (Until You Learn to Love Yourself),Ne-Yo,2012,b' Much as you blame yourself you can t be blamed for the way that you feel Had no example of a love that was even remotely real How can you understand something that you never had Ooh baby if you let me I can help you out with all of that Girl let me love you And I will love you Until you learn to love yourself Girl let me love you And all your trouble Don t be afraid girl let me help Girl let me love you And I will love you Until you learn to love yourself Girl let me love you A heart of numbness gets brought to life I ll take you there Girl let me love you Girl let me love you baby oh Girl let me love you Girl let me love you baby Girl let me love you Let me love you let me love you oh I can see the pain behind your eyes It s been there for quite a while I just wanna be the one to remind you what it is to smile I would like to show you what true love can really do Girl let me love you And I will love you Until you learn to love yourself Girl let me love you And all your trouble Don t be afraid girl let me help Girl let me love you And I will love you Until you learn to love yourself Girl let me love you A heart of numbness gets brought to life I ll take you there Girl let me love you baby Girl let me love you Let me love you let me love you baby Girl let me love you Girl let me love you baby Girl let me love you Let me love you girl let me love you baby For every heart that beats For every heart that beats For every heart that beats For every heart that beats Heart that beats Heart that beats Heart that beats Heart that beats Girl let me love you And I will love you Until you learn to love yourself Girl let me love you And all your trouble Don t be afraid girl let me help Girl let me love you And I will love you Until you learn to love yourself Girl let me love you A heart of numbness gets brought to life I ll take you there Girl let me love you Let me love you baby love you baby Girl let me love you Let me love you babe love you babe ooh ooh ah'
75,Pound the Alarm,Nicki Minaj,2012,b' Oh oh oh Come fill my glass up a little more We bout to get up and burn this floor You know we getting hotter and hotter Sexy and hotter let s shut it down Uh Yo what I gotta do to show these girls that I own em Some call me Nicki and some call me Roman Skeeza pleeza I m in Ibiza Giuseppe Zanotti my own sneaker Sexy sexy that s all I do If you need a bad bitch let me call a few Pumps on and the little mini skirts is out I see some good girls I mma turn em out Ok bottle sip bottle guzzle I m a bad bitch no muzzle hey Bottle sip bottle guzzle I m a bad bitch no muzzle let s go Music makes me high Oh oh oh Come fill my glass up a little more We bout to get up and burn this floor You know we getting hotter and hotter Sexy and hotter let s shut it down Pound the alarm Pound the alarm I wanna do it for the night night So get me now and knock this over I wanna do it like you like like Come get me baby we re not getting younger I just want you tonight night Baby we won t do it for life life Music makes me high Oh oh oh Come fill my glass up a little more We bout to get up and burn this floor You know we getting hotter and hotter Sexy and hotter let s shut it down Pound the alarm Pound the alarm Alarm Alarm Alarm Alarm Oh oh oh Come fill my glass up a little more We bout to get up and burn this floor You know we getting hotter and hotter Sexy and hotter let s shut it down Pound the alarm Pound the alarm Pound the alarm '
76,Come Over,Kenny Chesney,2012,b' Verse 1 I turn the TV off to turn it on again Staring at the blades of the fan as it spins around Counting every crack the clock is wide awake Talking to myself anything to make a sound Chorus I told you I wouldn t call I told you I wouldn t care But baby climbing the walls gets me nowhere I don t think that I can take this bed getting any colder Come over come over come over come over come over Verse 2 You can say we re done the way you always do It s easier to lie to me than to yourself Forget about your friends you know they re gonna say We re bad for each other but we ain t good for anyone else Chorus I told you I wouldn t call I told you I wouldn t care But baby climbing the walls gets me nowhere I don t think that I can take this bed getting any colder Come over come over come over come over come over Bridge We don t have to miss each other come over We don t have to fix each other come over We don t have to say forever come over You don t have to stay forever come over Chorus I told you I wouldn t call I told you I wouldn t care But baby climbing the walls gets me nowhere I don t think that I can take this bed getting any colder Come over come over come over come over come over Outro Come over come over come over come over come over Come over come over come over come over come over'
77,Heart Attack,Trey Songz,2012,b' Woop turn the lights on Oh woah oh woah We share something so common but still so rare And I m in awe never been here before So high we re still climbing even here inside these walls Breaking each others hearts and we don t care cause we re so In too deep can t think about giving it up But I never knew love would feel like a heart attack It s killing me swear I never cried so much Cause I never knew love would hurt this fucking bad The worst pain that I ever had Oh woah never knew love oh woah Would hurt this fucking bad The worst pain that I ever had All the times when I know I should be smiling Seem to be the time that I frown the most Can t believe that we re still surviving Cause I m slowly breaking down even when I hold you close And if I lose you I m afraid I would lose who Who I gave my love to That s the reason I stay around Even though I fell way In too deep can t think about giving it up But I never knew love would feel like a heart attack It s killing me swear I never cried so much Cause I never knew love would hurt this fucking bad The worst pain that I ever had Oh woah never knew love oh woah Would hurt this fucking bad The worst pain that I ever had And it hurts cause I wanna leave And you wanna leave but the love keeps us together And if I lose you I m afraid I would lose who who I gave my love to That s the reason I stay around even though I fell way In too deep can t think about giving it up But I never knew love would feel like a heart attack It s killing me swear I never cried so much Cause I never knew love would hurt this fucking bad The worst pain that I ever had Oh woah never knew love oh woah Would hurt this fucking bad The worst pain that I ever had'
78,Drank in My Cup,Kirko Bangz,2012,b' I done came down hold up Grip the grain roll up And your girlfriend want a nigga like me Cause I ain t tryin to control her She call me when she wants a change Black diamond my pinky ring And she know you weak and we ain t the same You hit the scene I make the scene I m in her head like Maybelline H Town so I m made for lean I m in her soul I make her scream I don t ride the toll don t pay the change I m EZ tag like Peter Pan She want a man don t need a man I m flying down your boulevard She cookin dinner with your pans Draped up dripped out Your bitch know what I m taking bout Pulls up pull out We get it poppin in the parking lot She like to do it with the lights on Don t matter to me if it s dark or not I m G d up East up Fossil pants I m hard as rock Girl I know how much you really want somebody Want somebody that don t really need you Girl I know how much you really want somebody Want somebody that ain t trying to keep You heard what I said that could put you to bed That ain t tryin to love you baby just fuck you instead And don t tell em nothing baby you know that I m comin baby Just hit up my phone whenever you need you some company Got this drank in my cup oh yeah I got this drank in my cup I got this drank in my cup cup cup I done came down came up Slow pitch change up Same hood same style same drink same cup She call me when she wanna fuck I never call she knows what s up Same page same book different song same hook Everytime her nigga trippin she on the phone with the same crook And everytime I pull up she hit me with that same look Lips bitin hips right She left her man for that get right I m in the middle like midnight Only if you got that sit tight Only if you got that wine fine Only if you got that sip type Only if you got that mind bomb Only if you got that zip tight Eat that shit like wonton Jokin baby I m pimp tight I m used to bein that one and done But girl you got that g get right Girl I know how much you really want somebody Want somebody that don t really need you Girl I know how much you really want somebody Want somebody that ain t trying to keep You heard what I said that could put you to bed That ain t tryin to love you baby just fuck you instead And don t tell em nothing baby you know that I m comin baby Got this drank in my cup oh yeah I got this drank in my cup I got this drank in my cup cup cup H Town oh yeah I got this drank in my cup I got this drank in my cup I came down hold up hold up I said hold up Hold up I done came down like hold up Hold up hold up fuck chea'
79,Birthday Cake,Rihanna,2012,b' Come and put cha name on it put cha name on it Come and put cha name on it ya name Don t chu wanna put ya name on it put cha name on it Come and put cha name on it bay bay bay bay uh It s not even my birthday But he wanna lick the icing off I know you want it in the worst way Can t wait to blow my candles out He want that Cake cake cake cake cake Cake cake cake cake cake Cake cake cake cake cake Oh baby I like it It s so exciting Don t try to hide it I mma make you my bitch Cake cake cake cake cake Cake cake cake cake cake Cake cake cake cake cake I know you wanna bite this It s so enticing Nothing else like this I mma make you my bitch And it s not even my birthday But you wanna put your name on it And it s not even my birthday And he s tryna put his name on it Oh I wanna fuck you right now Just get up on my body I ll do anything '
80,So Good,B.o.B,2012,b' Drinking a German beer with a Cuban cigar In the middle of Paris with a Dominican broad Great head on her shoulders she probably studied abroad She transferred to Harvard from King s College in March She says that I m her favorite cause she admires the art Of Michelangelo with the flow Picasso with the bars She s well put together like a piece by Gershwin Renaissance style tonight is picture perfect So smile and pack your bags real good baby Cause you ll be gone for a while Girl tell me how you feel what your fantasy oh I see us on a beach down in Mexico You can put your feet up be my se orita We ain t gotta rush just take it slow You ll be in the high life Soaking up the sunlight Anything you want is yours I ll have you living life like you should You say you never had it so good La la la la la la la la la You never had it so good La la la la la la la la la You never had it so good Suffering from first class cabin fever Five hour layovers from Norway to Egypt I m to the point like the pyramids of Giza Still I m to the left like the tower out in Pisa I m feeling single baby I could use a feature Swagger like Caesar I ll get you a visa We can go to Italy and maybe see the Colosseum I ll be Da Vinci if you ll be my Mona Lisa Now smile and pack your bags real good baby Cause you ll be gone for a while Girl tell me how you feel what your fantasy oh I see us on a beach down in Mexico You can put your feet up be my se orita We ain t gotta rush just take it slow You ll be in the high life Soaking up the sunlight Anything you want is yours I ll have you living life like you should You say you never had it so good La la la la la la la la la la You never had it so good La la la la la la la la la la You never had it so good Well I been feeling singular how about let s make it plural Spin the globe whatever it lands that s where we ll go We ll hit up Europe yep and spend some Euros And maybe visit Berlin the walls with the murals This is your month baby sign of the Virgo Private reservations glasses full of Merlot A Ros a Burgundy traveling like turbo Brush up on your Espa ol we re Barcelona bound Smile and pack your bags real good baby Cause you ll be gone for a while Girl tell me how you feel what your fantasy oh I see us on a beach down in Mexico You can put your feet up be my se orita We ain t gotta rush just take it slow You ll be in the high life Soaking up the sunlight Anything you want is yours I ll have you living life like you should You say you never had it so good La la la la la la la la la la You never had it so good La la la la la la la la la la You never had it so good La la la la la la la la la la You never had it so good La la la la la la la la la la You never had it so good'
81,50 Ways to Say Goodbye,Train,2012,b' My heart is paralyzed My head was oversized I ll take the high road like I should You said it s meant to be That it s not you it s me You re leaving now for my own good That s cool but if my friends ask where you are I m gonna say She went down in an airplane Fried getting suntanned Fell in a cement mixer full of quicksand Help me help me I m no good at goodbyes She met a shark under water Fell and no one caught her I returned everything I ever bought her Help me help me I m all out of lies And ways to say you died My pride still feels the sting You were my everything Some day I ll find a love like yours She ll think I m Superman Not super minivan How could you leave on Yom Kippur That s cool but if my friends ask where you are I m gonna say She was caught in a mudslide Eaten by a lion Got run over by a crappy purple Scion Help me help me I m no good at goodbyes She dried up in the desert Drowned in a hot tub Danced to death at an east side night club Help me help me I m all out of lies And ways to say you died I wanna live a thousand lives with you I wanna be the one you re dying to love But you don t want to That s cool but if my friends ask where you are I m gonna say That s cool but if my friends ask where you are I m gonna say She went down in an airplane Fried getting suntanned Fell in a cement mixer full of quicksand Help me help me I m no good at goodbyes She met a shark under water Fell and no one caught her I returned everything I ever bought her Help me help me I m all out of lies She was caught in a mudslide Eaten by a lion Got run over by a crappy purple Scion Help me help me I m no good at goodbyes She dried up in the desert Drowned in a hot tub Danced to death at an east side night club Help me help me I m all out of lies And ways to say you died'
82,Red Solo Cup,Toby Keith,2012,b'Hey one two three Now red Solo cup is the best receptacle For barbecues tailgates fairs and festivals And you sir do not have a pair of testicles If you prefer drinking from glass Hey red Solo cup is cheap and disposable And in 14 years they are decomposable And unlike my home they are not foreclosable Freddy Mac can kiss my ass Whoo Red Solo cup I fill you up Let s have a party Let s have a party I love you red Solo cup I lift you up Proceed to party Proceed to party Now I really love how you re easy to stack But I really hate how you re easy to crack Cause when beer runs down in front of my pack Well that my friends is quite yucky But I have to admit that the ladies get smitten Admiring at how sharply my first name is written On you with a Sharpie when I get to hitting On them to help me get lucky Red Solo cup I fill you up Let s have a party Let s have a party I love you red Solo cup I lift you up Proceed to party Proceed to party Now I ve seen you in blue and I ve seen you in yellow But only you red will do for this fellow Cause you are the Abbott to my Costello And you are the Fruit to my Loom Red Solo cup you re more than just plastic You re more than amazing you re more than fantastic And believe me that I am not the least bit sarcastic When I look at you and say Red Solo cup you re not just a cup You re my you re my friend Thank you for being my friend Red Solo cup I fill you up Let s have a party Let s have a party I love you red Solo cup I lift you up Proceed to party Proceed to party Red Solo cup Red Solo cup Let s have a party Let s have a party Oh red Solo cup Let s have a party Proceed to party yeah yeah '
