Rank,Song,Artist,Year,Lyrics
53,"Na Na",Trey Songz,2014,b' Put your hands in the air in the air Trigga Put your put your hands up in the air Mustard on the beat hoe Oh na na look what you done started Oh na na why you gotta act so naughty Oh na na I m bout to spend all this cash Oh na na if you keep shaking that ass Oh na na na put your hands in the air if you re fucking tonight Oh na na na keep your hands in the air if you re spending the night Oh na na na oh na na na na na na na everybody say it like Oh na na na oh na na na na na na na everybody say I m the nigga that you like yeah I ma give you what you like yeah Oh yeah I ma give it to you right yeah Best time of your life yeah oh yeah Baby when you ready tell the waitress get the check Girl I know you re ready I ain t even gotta check You been through the worst let me show you who s the best You know I ma get you right curve them niggas to the left like Oh na na look what you done started Oh na na why you gotta act so naughty Oh na na I m bout to spend all this cash Oh na na if you keep shaking that ass Oh na na na put your hands in the air if you re fucking tonight Oh na na na keep your hands in the air if you re spending the night Oh na na na oh na na na na na na na everybody say it like Oh na na na oh na na na na na na na everybody say You re the one that s hella bad yeah You re the one I ain t never had yeah oh yeah All the problems you did have yeah Leave them broke niggas in the past yeah oh yeah Girl you had good but I could give you better I ll have you thinking bout forever I ma make you say Oh na na look what you done started Oh na na why you gotta act so naughty Oh na na I m bout to spend all this cash Oh na na if you keep shaking that ass Oh na na na put your hands in the air if you re fucking tonight Oh na na na keep your hands in the air if you re spending the night Oh na na na oh na na na na na na na everybody say it like Oh na na na oh na na na na na na na everybody say I m feeling lucky tonight everybody say When we leave this party you gon love me tonight everybody say You feeling lucky tonight tonight girl When we leave this party you gon love me tonight Oh na na na put your hands in the air if you re fucking tonight Oh na na na keep your hands in the air if you re spending the night Oh na na na oh na na na na na na na everybody say it like Oh na na na oh na na na na na na na everybody say Na na na Hands in the air na na na Hands in the air na na na na na Hands in the air na na na na na'
54,"Hot Boy",Bobby Shmurda,2014,b' Ich bin ein hot Boy so wie Bobby Shmurda Ich hab Goldketten drauf auf meinem K rper Ich trag ne Gucci Jacke und Louis Vuitton Belts Ich zieh die Glock wenn sich mir jemand in den Weg stellt Denn du wei t ich bin ein hot Boy Meine Gang vertickt den Stoff Boy Denn du wei t ich bin ein hot Boy Meine Gang vertickt den Stoff Boy Kein Mezzo Mix wir trinken nur Spirituosen Ich trage Fendi G rtel und Versace Unterhosen Ich bin bei Burger King und order mir ein King Meal Ich kann nicht wieder aufstehen weil ich noch nie hinfiel Denn du wei t ich bin ein hot Boy Meine Gang vertickt den Stoff Boy Wir chillen hier am Block man Denn ich bin so bertrieben hot damn Hustensaft J ngling Glo up Dinero Gang Ich gebe keinen Fick denn ich will das Dinero man Mula Gwalla Mula Guap Gwalla Mula Guap Mula Das ist alles was ich neede das ist was ich mach 2015 Das ist unser Takeover Ich habe eine neue Gold Daytona Denn du wei t ich bin ein hot Boy Meine Gang vertickt den Stoff Boy'
55,"Hold On We're Going Home",Drake,2014,b' I got my eyes on you You re everything that I see I want your hot love and emotion endlessly I can t get over you You left your mark on me I want your hot love and emotion endlessly Cause you re a good girl and you know it You act so different around me Cause you re a good girl and you know it I know exactly who you could be Just hold on we re going home Just hold on we re going home It s hard to do these things alone Just hold on we re going home I got my eyes on you You re everything that I see I want your hot love and emotion endlessly I can t get over you You left your mark on me I want your hot love and emotion endlessly Cause you re a good girl and you know it You act so different around me Cause you re a good girl and you know it I know exactly who you could be Just hold on we re going home Just hold on we re going home It s hard to do these things alone Just hold on we re going home You re the girl you re the one Gave you everything I loved I think there s something baby I think there s something baby You re the girl you re the one Gave you everything I loved I think there s something baby I think there s something baby Cause you re a good girl and you know it You act so different around me Cause you re a good girl and you know it I know exactly who you could be Just hold on we re going home Just hold on we re going home It s hard to do these things alone Just hold on we re going home '
56,"Sing",Ed Sheeran,2014,b' It s late in the evening Glass on the side I ve been sat with you For most of the night Ignorin everybody here We wish they would disappear So maybe we could get down now And I don t wanna know If you re gettin ahead of the program I want you to be mine lady To hold your body close Take another step into the no man s land And for the longest time lady I need you darling Come on set the tone If you feel you re fallin Won t you let me know If you love me Come on get involved Feel it rushin through you From your head to toe SING LOUDER SING This love is ablaze I saw flames from the side of the stage And the fire brigade comes in a couple of days Until then we got nothin to say and nothin to know But somethin to drink and maybe somethin to smoke Let it go until our roads are changed Singin We Found Love in a local rave No I don t really know what I m supposed to say But I can just figure it out then hope and pray I told her my name then said It s nice to meet you Then she handed me a bottle of water filled with tequila I already know if she s a keeper Just from this one small act of kindness I m in Deep shit if anybody finds out I meant to drive home but I drunk all of it now Not soberin up we just sit on the couch One thing led to another now she s kissin my mouth I need you darling Come on set the tone If you feel you re fallin Won t you let me know If you love me Come on get involved Feel it rushin through you From your head to toe SING LOUDER SING Can you feel it All the guys in here don t even wanna dance Can you feel it All that I can hear is music from the back But can you feel it Found you hidin here so won t you take my hand darlin Before the beat kicks in again Can you feel it Can you feel it SING I need you darling Come on set the tone If you feel you re fallin Won t you let me know LOUDER SING If you love me Come on get involved Feel it rushin through you From your head to toe LOUDER SING '
57,"Radioactive",Imagine Dragons,2014,b' Whoah oh Whoah oh Whoah oh Whoah I m waking up to ash and dust I wipe my brow and I sweat my rust I m breathing in the chemicals Yeah ah I m breaking in shaping up then Checking out on the prison bus This is it the apocalypse Whoa I m waking up I feel it in my bones Enough to make my system blow Welcome to the new age to the new age Welcome to the new age to the new age Whoa oh whoa I m radioactive radioactive Whoa oh whoa I m radioactive radioactive I raise my flags don my clothes It s a revolution I suppose We re painted red to fit right in Whoa I m breaking in shaping up then Checking out on the prison bus This is it the apocalypse Whoa I m waking up I feel it in my bones Enough to make my system blow Welcome to the new age to the new age Welcome to the new age to the new age Whoa oh whoa I m radioactive radioactive Whoa oh whoa I m radioactive radioactive All systems go the sun hasn t died Deep in my bones straight from inside I m waking up I feel it in my bones Enough to make my system blow Welcome to the new age to the new age Welcome to the new age to the new age Whoa oh whoa I m radioactive radioactive Whoa oh whoa I m radioactive radioactive'
58,"My Hitta",YG,2014,b' Mustard on the beat I said that I ma ride for my Most likely I ma die for my I ve been grindin outside all day with my And I ain t goin in unless I m with my hittas My hitta my hitta My hitta my hitta My hittas my hittas My hittas my hittas duh First thing s first I love all my hittas This rap rap cracked and I involve my hittas You lookin for some lean lemme call my hitta He sell it for the high I need all mines hitta Some hittas smoke smoke some hittas drink drank Got hittas on the block with the Glock that don t think That s a hitta back up they in a bucket lapped up I got to act right if you hittas wanna act up He talkin like a snitch no that ain t my hitta He trippin off a bitch no that ain t my hitta Take a case yeah that s my hitta Know him since I was eight yeah that s my hitta Fucked my first bitch passed her to my hitta Hit my first lick passed with my hitta my hitta Fuck them other hittas cause I m down for my hittas I ride for my hittas fuck them other hittas I said that I ma ride for my Most likely I ma die for my I ve been grindin outside all day with my And I ain t goin in unless I m with my hittas My hitta my hitta My hitta my hitta My hittas my hittas My hittas my hittas Just know I m down with the hittas down for me I got two words for you love and loyalty It was me and my hitta trippin on a half a B When we used to hit a mall and buy everything we see Me and my down ass hitta gettin twisted Hitta get to trippin knock the gravy out your biscuit Just know I fucked with you the long way my hitta So when I see you out I m like Hey my hitta Drink that act right by the case my hittas Drink that act right and get straight with my hittas Me and my hitta ridin dirty tryna chase them figures Who got the yopper who got the yola Don t matter go figure I said that I ma ride for my Most likely I ma die for my I ve been grindin outside all day with my hittas And I ain t goin in unless I m with my hittas My hitta my hitta My hitta my hitta My hittas my hittas My hittas my hittas My homie got K my homie got weight My homie fronted me he the reason I m straight My homie got a house my homie got a lake My homie we eatin my homie get a plate And we re still hittin licks my hitta my hitta Runnin off a hitta shit my hitta my hitta I fucked a hitta bitch with my hitta my hitta If a hitta talkin shit then he ain t my hitta My hitta my hitta Yg my hitta and I ain t goin in ain t tryna leave my hittas Shawty seein me and want to leave with a hitta But it wasn t enough room cause I came with my hittas My hittas my hittas I need a set of wings cause I m too fly hitta And I m all about my business like a suit and tie hitta I ride for my hittas I said that I ma ride for my Most likely I ma die for my I ve been grindin outside all day with my And I ain t goin in unless I m with my hittas My hitta my hitta My hitta my hitta My hittas my hittas My hittas my hittas My hitta my hitta My hitta my hitta My hitta my hitta'
59,"Cool Kids",Echosmith,2014,b' She sees them walking in a straight line that s not really her style And they all got the same heartbeat but hers is falling behind Nothing in this world could ever bring them down Yeah they re invincible and she s just in the background And she says I wish that I could be like the cool kids Cause all the cool kids they seem to fit in I wish that I could be like the cool kids Like the cool kids He sees them talking with a big smile but they haven t got a clue Yeah they re living the good life can t see what he is going through They re driving fast cars but they don t know where they re going In the fast lane living life without knowing And he says I wish that I could be like the cool kids Cause all the cool kids they seem to fit in I wish that I could be like the cool kids Like the cool kids I wish that I could be like the cool kids Cause all the cool kids they seem to get it I wish that I could be like the cool kids Like the cool kids And they said I wish that I could be like the cool kids Cause all the cool kids they seem to fit in I wish that I could be like the cool kids Like the cool kids I wish that I could be like the cool kids Cause all the cool kids they seem to fit in I wish that I could be like the cool kids Like the cool kids I wish that I could be like the cool kids Cause all the cool kids they seem to get it I wish that I could be like the cool kids Like the cool kids Like the cool kids'
60,"Hey Brother",Avicii,2014,b' Hey brother There s an endless road to rediscover Hey sister Know the water s sweet but blood is thicker Oh if the sky comes falling down For you there s nothing in this world I wouldn t do Hey brother Do you still believe in one another Hey sister Do you still believe in love I wonder Oh if the sky comes falling down For you there s nothing in this world I wouldn t do What if I m far from home Oh brother I will hear you call What if I lose it all Oh sister I will help you out Oh if the sky comes falling down For you there s nothing in this world I wouldn t do Hey brother There s an endless road to rediscover Hey sister Do you still believe in love I wonder Oh if the sky comes falling down For you there s nothing in this world I wouldn t do What if I m far from home Oh brother I will hear you call What if I lose it all Oh sister I will help you out Oh if the sky comes falling down For you there s nothing in this world I wouldn t do'
61,"Trumpets",Jason Derulo,2014,b' Every time that you get undressed I hear symphonies in my head I wrote this song just looking at you oh oh Yeah the drums they swing low And the trumpets they go And the trumpets they go Yeah the trumpets they go Da da da ra ra da da da Da ra ra ra da da Da da da ra ra da da da Da ra ra ra da da Haha is it weird that I hear Violins whenever you re gone Yeah is it weird that your ass Remind me of a Kanye West song Haha yeah is it weird that I hear Trumpets when you re turning me on Is it weird that your bra Remind me of a Katy Perry song Every time that you get undressed I hear symphonies in my head I wrote this song just looking at you oh oh Yeah the drums they swing low And the trumpets they go And the trumpets they go haha yeah Yeah the trumpets they go Da da da ra ra da da da Da ra ra ra da da Yeah the trumpets they go Da da da ra ra da da da Da ra ra ra da da Damn is it weird that I hear Angels every time that you moan Uh oh yeah is it weird that your eyes Remind me of a Coldplay song Is it weird that I hear Trumpets when you re turning me on Is it weird that your bra Remind me of a Katy Perry song Every time that you get undressed I hear symphonies in my head I wrote this song looking at you oh oh Every time that you get undressed I hear symphonies in my head I wrote this song just looking at you oh oh Uh yeah the drums they swing low And the trumpets they go Da da da ra ra da da da Da ra ra ra da da Da da da ra ra da da da Da ra ra ra da da They go '
62,"Animals",Maroon 5,2014,b' Baby I m preying on you tonight Hunt you down eat you alive Just like animals animals like animals mals Maybe you think that you can hide I can smell your scent from miles Just like animals animals like animals mals Baby I m So what you trying to do to me It s like we can t stop we re enemies But we get along when I m inside you yeah You re like a drug that s killing me I cut you out entirely But I get so high when I m inside you Yeah you can start over you can run free You can find other fish in the sea You can pretend it s meant to be But you can t stay away from me I can still hear you making that sound Taking me down rolling on the ground You can pretend that it was me but no oh Baby I m preying on you tonight Hunt you down eat you alive Just like animals animals like animals mals Maybe you think that you can hide I can smell your scent from miles Just like animals animals like animals mals Baby I m So if I run it s not enough You re still in my head forever stuck So you can do what you wanna do yeah I love your lies I ll eat em up But don t deny the animal That comes alive when I m inside you Yeah you can start over you can run free You can find other fish in the sea You can pretend it s meant to be But you can t stay away from me I can still hear you making that sound Taking me down rolling on the ground You can pretend that it was me but no oh Baby I m preying on you tonight Hunt you down eat you alive Just like animals animals like animals mals Maybe you think that you can hide I can smell your scent from miles Just like animals animals like animals mals Baby I m Don t tell no lie lie lie lie You can t deny ny ny ny The beast inside si si side Yeah yeah yeah No girl don t lie lie lie lie You can t deny ny ny ny The beast inside si si side Yeah yeah yeah yo oh oh oh oh oh oh oh Just like animals animals like animals mals Just like animals animals like animals mals oww Baby I m preying on you tonight Hunt you down eat you alive Just like animals animals like animals mals Maybe you think that you can hide I can smell your scent from miles Just like animals animals like animals mals Baby I m Don t tell no lie lie lie lie You can t deny ny ny ny The beast inside si si side Yeah yeah yeah No girl don t lie lie lie lie You can t deny ny ny ny The beast inside si si side Yeah yeah yeah'
63,"Burnin' It Down",Jason Aldean,2014,b' You slip your finger through the tear in my t shirt You stirrin up dirty in the back of my mind You keep on flirtin cause you know that it s workin You stuck in my head girl writing the lines Couldn t sing this song without you if I tried Let s light it up like it s our last night We re just hanging around Burnin it down Sippin on some cold Jack Daniel s Jammin to some old Alabama with you baby Laying right here naked in my bed I m just doing my thing You love it when I sing Say it makes you feel like an angel We about to get a little tangled up right about now So girl let s keep burnin it down Burnin it down burnin it down Girl when you want it You know that I m on it You know that I love lovin up on you Let s hit the switch and let our shadows dance And light it up like it s our last chance We re just hanging around Burnin it down Sippin on some cold Jack Daniel s Jammin to some old Alabama with you baby Laying right here dreamin in my bed I m just doing my thing You love it when I sing Say it makes you feel like an angel We about to get a little tangled up right about now So girl let s keep burnin it down Burnin it down burnin it down burnin it down Burnin it down burnin it down burnin it down I wanna rock it all night Baby girl will you rock it out with me I wanna crawl through the dark Just to feel your heartbeat against me I wanna rock it all night Baby girl will you rock it out with me I wanna crawl through the dark Just to feel your heartbeat against me We re just hanging around Burnin it down Sippin on some cold Jack Daniel s Jammin to some old Alabama with you baby Laying right here naked in my bed I m just doing my thing You love it when I sing Say it makes you feel like an angel We about to get a little tangled up right about now So girl let s keep burnin it down Burnin it down burnin it down burnin it down Burnin it down burnin it down burnin it down I wanna rock it all night Baby girl will you rock it out with me I wanna crawl through the dark Just to feel your heartbeat against me'
64,"Play It Again",Luke Bryan,2014,b' She was sittin all alone over on the tailgate Tan legs swingin by a Georgia plate I was lookin for her boyfriend Thinkin no way she ain t got one Soon as I sat down I was fallin in love Tryin to pour a little sugar in her Dixie cup Talkin over the speakers in the back of that truck She jumped up and cut me off She was like oh my God this is my song I ve been listenin to the radio all night long Sittin round waitin for it to come on and here it is She was like come here boy I wanna dance Fore I said a word she was takin my hand Spinnin me around till it faded out And she gave me a kiss And she said play it again play it again play it again And I said play it again play it again play it again I d gave that DJ my last dime If he would have played it just one more time But a little while later We were sittin in the drive in my truck Before I walked her to the door I was scannin like a fool AM FM XM too But I stopped real quick when I heard that groove Man you should have seen her light up She was like oh my God this is my song We ve been listenin to the radio all night long I can t believe that it came back on but here it is She was like come here boy I wanna dance Fore I said a word she was takin my hand Spinnin in the headlights she gave me a goodnight kiss And I said play it again play it again play it again And she said play it again play it again play it again The next Friday night we were sittin out under the stars You should have seen her smile when I broke out my guitar She was like oh my God this is my song I ve been listenin to the radio all night long Sittin round waitin for it to come on and here it is She was like come here boy I wanna dance Fore I said a word she was takin my hand Spinnin in the headlights she gave me a goodnight kiss And she said play it again play it again play it again And I said play it again play it again play it again Yeah play it again play it again play it again Somebody play it again play it again play it again'
65,"2 On",Tinashe,2014,b' Give me all that you got now Make you want me cause I m hot now I m gone so faded I m on one Bang bang pop off like a long gun If you a lame nigga you ain t making no noise Get faded turn up with the big boys Live fast die young that s my choice Get money get money like an invoice We can mob all in the whip Make the money make a grip I be stuntin with my clique Getting faded till we trip Man I love to get on I love to get 2 on When the drink be too strong When the tree be way too strong Get faded turn up bruh Pour it on up till I can t even think no more Get ratchet go dumb then go more dumb then We can keep it lit let s roll I love to get 2 on Let let let s roll I love to get 2 on I love to Let let let s roll Let let let s roll Yea we can get active And all my bitches attractive We go you know who we are now Get high hotbox in my car now If you a lame nigga you ain t making no noise Get faded turn up with the big boys Live fast die young that s my choice Get money get money like an invoice We can mob all in the whip Make the money make a grip I be stuntin with my clique Getting faded till we trip Man I love to get on I love to get 2 on When the drink be too strong When the tree be way too strong Get faded turn up bruh Pour it on up till I can t even think no more Get ratchet go dumb then go more dumb then We can keep it lit let s roll I love to get 2 on Let let let s roll I love to get 2 on I love to Let let let s roll Let let let s roll Uh pull your panties down from under you Beat that pussy up make you wanna holla Q Drunk than a bitch high on that Mary Jane Pussy in my mouth pussy on my pinky ring Nasty baby me do it in the backseat Swear this marijuana keep it cracking Lights camera action I ain t doing nothing til the cash in Money money money weed fashion Draped up and dripped out keep the trees passing Girl toot that thing up fuck me fuck rapping Days of our lives so clap clap that cake Spreading your thighs I pump pump your brakes ay Just give me the trees and we can smoke it ya Just give me the drink and we can pour it ya And my enemies they see me living now And if you roll with me then you ll be winning now oh Man I love to get on I love to get 2 on When the drink be too strong When the tree be way too strong Get faded turn up bruh Pour it on up till I can t even think no more Get ratchet go dumb then go more dumb then We can keep it lit let s roll I love to get 2 on Let let let s roll I love to get 2 on I love to Let let let s roll Let let let s roll'
